Title,Author,Score,Created_UTC,URL
"Star Wars Stans Blame Cancellation Of ‘The Acolyte’ On Everything But Ratings: “I’m Really Tired Of Sharing The Franchise I Love With Toxic, Misogynistic, Immature Racists”",Natural-March8839,636,2024-08-22 23:41:30,https://boundingintocomics.com/2024/08/22/star-wars-stans-blame-cancellation-of-the-acolyte-on-everything-but-ratings-im-really-tired-of-sharing-the-franchise-i-love-with-toxic-misogynistic-immature-racists/
"Following Reports Of 'Dustborn' Receiving Funding From The EU, The U.S. Government Spent Over A Quarter Million Dollars On A ""Counter-Disinformation Game""",shipgirl_connoisseur,634,2024-08-29 13:28:03,https://thatparkplace.com/following-reports-of-dustborn-receiving-funding-from-the-eu-the-u-s-government-spent-over-a-quarter-million-dollars-on-a-counter-disinformation-game/
Ubisoft Stock Plummets 15% After 'Assassin's Creed Shadows Trailer Debut And Company Failed To Meet Forecasted Sales Figures,shipgirl_connoisseur,643,2024-05-18 00:29:14,https://thatparkplace.com/ubisoft-stock-plummets-15-after-assassins-creed-shadows-trailer-debut-and-company-failed-to-meet-forecasted-sales-figures/
The most idiotic practice in the VA industry.,SquishmuffinKYM,637,2024-01-20 23:25:11,https://i.redd.it/jgq1pmfniodc1.png
"Steam curator ""Sweet Baby Inc detected"" reaches 400,000 followers",Omega_brownie,633,2024-06-18 02:07:12,https://www.reddit.com/r/KotakuInAction/comments/1difhkv/steam_curator_sweet_baby_inc_detected_reaches/
"The recent astroturfing for The Boys Season 4, AC: Shadows, and The Acolyte is shameless",Jaded_Permit_7209,641,2024-06-16 23:30:53,https://www.reddit.com/r/KotakuInAction/comments/1dhkczr/the_recent_astroturfing_for_the_boys_season_4_ac/
Valorant will be issuing hardware bans if you hurt someone's feelings. I'm sure this won't backfire at all. Link to tweet in comments,N/A,638,2024-05-30 20:11:36,https://i.redd.it/yx4wr4sifm3d1.png
Former Bond Girl Gemma Arterton Says Female 007 Would Be ‘Too Outrageous’: ‘Sometimes You Just Have to Respect the Tradition,ChargeProper,631,2024-12-12 13:53:34,https://archive.ph/uAeNH
"In light of Dustborn launching with a historical 81 player peak yesterday, here is Game Director Ragnar Tørnquist promoting his game by talking about the importance of Diversity on BBC News",AboveSkies,650,2024-08-20 23:14:46,https://www.youtube.com/watch?v=V28A97GcuDY
"In Another Black Eye For Sony, 'LEGO Horizon Adventures' Debuts To Even Less Steam Players Than 'Concord'",shipgirl_connoisseur,641,2024-11-20 15:37:17,https://boundingintocomics.com/video-games/video-game-news/in-another-black-eye-for-sony-lego-horizon-adventures-debuts-to-even-less-steam-players-than-concord/
Dot Esports Tom Foley: Black Myth Wukong’s shameless lack of diversity is attracting the wrong type of fan - We shouldn’t be carrying hate into what should be a safe space for everyone,AboveSkies,639,2024-08-23 00:28:43,https://archive.is/aoF9d
[DISCUSSION] do you agree replacing English Anime Translators with AI,Dramatic-Bison3890,635,2024-10-19 08:54:09,https://i.redd.it/o69fky60govd1.jpeg
"Asmongold highlights Twitch's apparent policy of allowing racism, violence and death threats on their platform if you have the correct skin color or genitals.",HereForGames,630,2024-05-18 10:06:59,https://www.youtube.com/watch?v=hvkRwjrj2-U
"Maybe this is cope, but in light of people freaking out about Ciri's looks in Witcher 4 trailer, it should be reminded that the trailer and final in-game versions of Witcher 3's Geralt and Yennefer differed, so Ciri's design might still evolve for the better",RainbowDildoMonkey,634,2024-12-13 18:40:38,https://i.redd.it/dbsqhs5ktn6e1.jpeg
Another sweet baby infested studio slowly dying,gadesabc,631,2024-12-07 11:48:38,https://x.com/DeckNineGames/status/1865138496601575468
Black Girl Gamers Announces Legal Action Against Entertainment News Outlet That Park Place Over Recent Report Suggesting Video Game Diversity Consultant Company Engages In Discriminatory Hiring Practices,Son0fSun,633,2024-03-28 19:16:44,https://boundingintocomics.com/2024/03/27/black-girl-gamers-announces-legal-action-against-that-park-place-over-recent-report-suggesting-video-game-diversity-consultant-company-engages-in-disc/
"PCGamer: ""Steam accused of 'normalizing hate and extremism in the gaming community' in new ADL report""",tyranicalmoon,640,2024-11-14 23:50:48,https://archive.ph/C1wHk
"Take note: all the people currently claiming that the changes made to Stellar Blade are ""insignificant, trivial and overblown"" will be very upset IF those changes are reversed by Sony and Shift Up. Suddenly this thing that ""doesn't matter"" will matter very much to them.",SickusBickus,627,2024-04-29 16:33:05,https://www.reddit.com/r/KotakuInAction/comments/1cg3kd0/take_note_all_the_people_currently_claiming_that/
Stardew Valley developer under fire for not including pronouns.,Antique-Flow-647,638,2024-04-28 03:15:25,https://www.reddit.com/r/KotakuInAction/comments/1cewjx4/stardew_valley_developer_under_fire_for_not/
Geoff Keighly's The Game Awards Honored Amir Satvat As A Folk Hero For Laid Off Devs - In Reality He's A Tencent Exec Who Runs A Glorified Unemployment List,Sliver80,633,2024-12-17 02:34:08,https://boundingintocomics.com/video-games/video-game-news/geoff-keighlys-the-game-awards-honored-amir-satvat-as-a-folk-hero-for-laid-off-devs-in-reality-hes-a-tencent-exec-who-runs-a-glorified-unemployment-list/
Concord cost $400m per Colin Moriarty on X.,janonx1,625,2024-09-20 16:45:48,https://x.com/longislandviper/status/1837157796137030141?t=uKR8kv9eUyPlitf2hEbZWQ&s=19
"The world is healing: ""Woke language"" dropped from one of the two biggest Mexican TV Networks.",Doktorumbra,626,2024-12-19 22:31:12,https://www.reddit.com/r/KotakuInAction/comments/1hi50sz/the_world_is_healing_woke_language_dropped_from/
Sweet Baby Inc. Infected 'Unknown 9: Awakening' Reportedly Has Poor Pre-Orders And Atrocious Steam Wishlist Ranking,shipgirl_connoisseur,622,2024-09-18 15:34:39,https://thatparkplace.com/sweet-baby-inc-infected-unknown-9-awakening-reportedly-has-poor-pre-orders-and-atrocious-steam-wishlist-ranking/
"'Marvel's Wolverine' Associate Narrative Director Mary Kenney Says ""Every Lever"" Must Be Pulled To Push Disordered LGBTQ+ Agenda",shipgirl_connoisseur,628,2024-05-24 18:41:31,https://thatparkplace.com/marvels-wolverine-associate-narrative-director-mary-kenney-says-every-lever-must-be-pulled-to-push-disordered-lgbtq-agenda/
"[Censorship] Black Girl Gamers threatens to sue That Park Place for article quoting them saying they are ""Looking for Black Women Content Creators that make [D&D] content for some potential brand work""",sodiummuffin,620,2024-03-27 04:08:09,https://i.redd.it/skd1jappwsqc1.png
The duality of petty censorship defender,dandrixxx,618,2024-05-31 19:05:28,https://i.redd.it/o1rib0gx6t3d1.jpeg
"Black Myth Wukong Streaming Agreement Says No Politics, No China, and No ""Feminist Propaganda”",CaracallaTheSeveran,623,2024-08-17 19:57:43,https://archive.ph/i0XRY
'Unknown 9: Awakening' The Next Sweet Baby Inc. Game Already Looks Like A Complete And Utter Financial Disaster,shipgirl_connoisseur,621,2024-10-16 15:36:02,https://thatparkplace.com/unknown-9-awakening-the-next-sweet-baby-inc-game-already-looks-like-a-complete-and-utter-financial-disaster/
"In the span of 10 years, why have wokies gone from saying “your favorite video game is racist and sexist!” To saying “your favorite video game has been woke all along!”?",RavenSilver_67,617,2024-04-11 19:39:08,https://www.reddit.com/r/KotakuInAction/comments/1c1o3qt/in_the_span_of_10_years_why_have_wokies_gone_from/
Alanah Pearce sneakily deleted one of her video(where she gaslight people into thinking that there is no agenda in making females ugly) in fear that she might get fired or Santa Monica Studios might get Backlash/Boycotted what a sneaky little B,Virus19847,626,2024-04-13 12:25:04,https://gofile.io/d/Y6YxE4
"YouTube Rejects Apparent Organized Cancel Campaign From Disney Star Wars Fans That Targeted Nerdrotic, Geeks + Gamers, And Ryan Kinel",Sliver80,619,2024-09-05 22:24:38,https://thatparkplace.com/youtube-rejects-apparent-organized-cancel-campaign-from-disney-star-wars-fans-that-targeted-nerdrotic-geeks-gamers-and-ryan-kinel/?_gl=1*1vd9vuh*_up*MQ..*_ga*MTQyMzQxNjIxMi4xNzI1NTc1MDQ5*_ga_Y1JSQE3GKY*MTcyNTU3NTA0OS4xLjAuMTcyNTU3NTA0OS4wLjAuMTc1NzU4ODkzMg..
"Warner Bros is standing by Jk Rowling and her right to expression, Variety is obviously not happy",ChargeProper,616,2024-11-22 10:51:06,https://www.reddit.com/r/KotakuInAction/comments/1gx55c0/warner_bros_is_standing_by_jk_rowling_and_her/
"After Sales Were Over 50% Worse Than 'Marvel's Spider-Man,' Insomniac Reveals 'Spider-Man 2's' PC Release Has ""No Additional Story Content Planned""",shipgirl_connoisseur,613,2024-10-22 00:12:36,https://thatparkplace.com/after-sales-were-over-50-worse-than-marvels-spider-man-insomniac-reveals-spider-man-2s-pc-release-has-no-additional-story-content-planned/
"Japanese Political Aide Indicates 'Assassin's Creed Shadows' Debacle Could Escalate Into ""Diplomatic Incident""",shipgirl_connoisseur,627,2024-07-20 00:34:01,https://thatparkplace.com/japanese-political-aide-indicates-assassins-creed-shadows-debacle-could-escalate-into-diplomatic-incident/
"So Activisions CoD BO-6 injects ""meaningful DEI"" into their game per this leak. Reading this leaked memo kills your brain cells. ",357-Magnum-CCW,614,2024-10-23 23:02:59,https://x.com/Grummz/status/1791136879460622388
Ghost of Yotei ,omegableh1234,619,2024-09-27 13:38:07,https://i.redd.it/t6974hdrucrd1.png
"TheParKPlace: ""‘Star Wars Outlaws’ Community Manager Shauna Jones Appears To Have Animus Against White Men In Numerous Social Media Posts""",tyranicalmoon,619,2024-04-08 15:33:44,https://thatparkplace.com/star-wars-outlaws-community-manager-shauna-jones-appears-to-have-animus-against-white-men-in-numerous-social-media-posts/
They keep shooting themselves in the foot 🤣,grandialine32,617,2024-03-13 06:46:42,https://i.redd.it/pjpnnqcvs1oc1.jpeg
Dead Rising Remake ALSO has yellow paint indicating players (journalists) where to go...,Seiros_Acolyte,614,2024-08-15 04:16:46,https://i.redd.it/01rj3jkb7rid1.png
Stellar Blade censorship update: It looks like the NG+ variant of the bunny suit is censored as well,rpcgamingmodsaresoy,629,2024-04-25 22:48:48,https://i.redd.it/20gmc7rofpwc1.png
"Bayonetta is considered safe and virtuous now, but they had a very different opinion of her in 2014",Leisure_suit_guy,614,2024-04-04 03:21:20,https://www.youtube.com/watch?v=XbihPTgAql4
"Sweet Baby Inc CEO on video trying to work hard, using marginalized change agents as shield, to ""Take over"" the gaming Industry and lead it into a ""new area"".",ManifestedLurker,614,2024-03-11 18:20:17,https://twitter.com/JohnnyMassacre/status/1766579818932355488
Alyssa Mercante goes out of her way to publicly Dox SmashJT,PolishTamales,616,2024-12-11 22:12:17,https://x.com/SmashJT/status/1866926929850536419
"Former Amazon And Disney Executive Affirms That Hollywood Has ""Contempt For The Audience"" ",Sliver80,615,2024-11-25 21:26:41,https://fandompulse.substack.com/p/former-amazon-and-disney-executive
Unhinged GTA 6 employees making death threats and being diversity hires?,konsoru-paysan,609,2024-12-08 13:57:00,https://fandompulse.substack.com/p/grand-theft-auto-developers-employees?utm_campaign=post&utm_medium=web
The Pokemon Go community and their proverbial elephant in the room,Jaded_Permit_7209,613,2024-04-20 00:08:39,https://www.reddit.com/r/KotakuInAction/comments/1c8c4zx/the_pokemon_go_community_and_their_proverbial/
Legacy of Kain Remaster changes the feminine statue into something less feminine.,gadesabc,613,2024-09-25 05:40:43,https://i.redd.it/ajogop5k7wqd1.png
Amazon Studios Founder Criticizes Hollywood’s Turn To Ideology Over Entertainment: “Making Customers The Enemy Of Your Industry Is Never Viable”,AboveSkies,607,2024-11-27 09:58:58,https://boundingintocomics.com/tv-shows/amazon-studios-founder-criticizes-hollywoods-turn-to-ideology-over-entertainment-making-customers-the-enemy-of-your-industry-is-never-viable/
Imagine my shock...,Vifnis,613,2024-04-28 14:26:58,https://i.redd.it/22ur93xuc8xc1.png
"'Final Fantasy Tactics' Director Responds To Western Localization Discourse Surrounding 'Unicorn Overlord': ""It Is Unacceptable For Someone To Alter A Work Without Considering The Original Author's Intent""",CrimsonOmega80,611,2024-03-10 03:53:51,https://boundingintocomics.com/2024/03/09/final-fantasy-tactics-director-responds-to-western-localization-discourse-surrounding-unicorn-overlord-it-is-unacceptable-for-someone-to-alter-a-work-without-considering-the-original-author/
Roosterteeth has been shuttered,HalosBane,609,2024-03-06 17:17:31,https://x.com/Wario64/status/1765423926287409578?s=20
"What happens if you are a woke white man.  Deck Nine makes progressive games and its CCO, Zak Garriss believed in assembling a diverse narrative team.  But the people he hired hated and resented him and tried to destroy him.",Green_Source3135,602,2024-04-07 10:25:33,https://x.com/danfriedman81/status/1776630000617132268?s=46
Avowed (Obsidian game) - When game developpers are not focused at only creating games and entertainment (part 2),gadesabc,609,2024-11-28 18:05:09,https://i.redd.it/l9mit7gvmo3e1.png
Marvel Comics' New Sentry is a disabled woman of color,N/A,609,2024-03-13 06:11:21,https://i.redd.it/z6ykarxgm1oc1.jpeg
Report: Disney's Star Wars Movies Have Not Recouped The Cost Of Purchasing Lucasfilm At The Box Office,Equilybrium,605,2024-04-17 12:08:39,https://thatparkplace.com/report-disneys-star-wars-movies-have-not-recouped-the-cost-of-purchasing-lucasfilm-at-the-box-office/
Google censored deidetected.com?,TheCactusPie,606,2024-07-06 06:08:35,https://www.reddit.com/r/KotakuInAction/comments/1dwixsf/google_censored_deidetectedcom/
Financial Statements Confirm 'Indiana Jones And The Dial Of Destiny' Was Another Multimillion Dollar Disney Flop,Sliver80,602,2024-04-02 05:36:31,https://boundingintocomics.com/2024/04/01/financial-statements-confirm-indiana-jones-and-the-dial-of-destiny-was-another-multimillion-dollar-disney-flop/
GamerGate 2.0 is currently happening but some mods on this sub are determined it not be talked about.,qalpha94,609,2024-03-07 20:36:24,https://www.reddit.com/r/KotakuInAction/comments/1b94nkk/gamergate_20_is_currently_happening_but_some_mods/
Ghost of Tsushima is removed from stores in Regions where PSN is locked,valk_1234,599,2024-05-09 15:33:34,https://i.redd.it/80wz90vt6fzc1.jpeg
"Elon Musk Reacts To Xbox's Global Product Marketing Manager's Objectionable Comments: ""It Should Not Be Acceptable For Any Company In The Gaming Industry To Be Racist & Sexist Against 'White Guys'"" Apparently the Xbox head of marketing doesn't like ""white guys""",superdude500,613,2024-04-13 15:36:11,https://thatparkplace.com/elon-musk-reacts-to-xboxs-global-product-marketing-managers-objectionable-comments-it-should-not-be-acceptable-for-any-company-in-the-gaming-industry-to-be-racist-sexist-against-white-guys/
8GB of censorship update in steam's FF7RemakeIntergrade just silently rolled in today,Ywaina,600,2024-02-26 08:07:23,https://www.reddit.com/r/KotakuInAction/comments/1b0cb67/8gb_of_censorship_update_in_steams/
Never change SNK,DUNdundundunda,600,2024-06-08 00:35:33,https://i.redd.it/wtv83hsxt85d1.png
Sega Promoting Diversity,N/A,603,2024-02-19 13:46:59,https://i.redd.it/t82x1psuqjjc1.png
"Barbara Broccoli, the James Bond franchise producer doesn’t trust Amazon with the character and says “these people [Amazon] are fucking idiots” ",Dramatic-Bison3890,605,2024-12-20 17:26:24,https://archive.li/bEPjA
"Ragnar Tørnquist of Red Thread Games about the design philosophy regarding ""Diversity"" in his games, and how he feels embarrassed/ashamed of his past creations (might help explain Dustborn some more)",AboveSkies,593,2024-09-01 19:29:51,https://i.imgur.com/LwbOTNZ.jpeg
New Update To Riot Games’ Terms Of Service Gives ‘League Of Legends’ Dev The Right To Respond To Players’ “Off-Platform Conduct” With “Penalties In-Game”,ChargeProper,592,2024-12-03 10:10:42,https://boundingintocomics.com/video-games/video-game-news/new-update-to-riot-games-terms-of-service-gives-league-of-legends-dev-the-right-to-respond-to-players-off-platform-conduct-with-penalties-in-game/
Associate Narrative Designer Working On 'Marvel's Black Panther' Admits To Being A Racist While Accusing Gamers Of Racism And Saying You Can't Be Racist To White People ,CrimsonOmega80,594,2024-03-12 01:35:57,https://thatparkplace.com/associate-narrative-designer-working-on-marvels-black-panther-admits-to-being-a-racist-while-accusing-gamers-of-racism-and-saying-you-cant-be-racist-to-white-people/
"Young guy mentioning Concord and Dustborn asks Elon Musk if he ever thought about making his own Gaming Studio, he says it could be a ""fun thing to do"", talks about AI and mentions how DEI destroys art because it kicks you out of the story and makes you feel like you're being lectured",AboveSkies,600,2024-10-19 05:07:56,https://x.com/AutismCapital/status/1847442893650481220
'Helldivers 2' Community Manager Spitz Fired,shipgirl_connoisseur,591,2024-05-07 22:11:19,https://thatparkplace.com/helldivers-2-community-manager-spitz-fired/
"'Captain America: Brave New World' Reshoots Reportedly Balloon Budget To $375 Million: ""It's Like They're Shooting A Brand New Movie""",shipgirl_connoisseur,595,2024-06-28 12:50:53,https://boundingintocomics.com/2024/06/28/captain-america-brave-new-world-reshoots-reportedly-balloon-budget-to-375-million-its-like-theyre-shooting-a-brand-new-movie/
Ubisoft has been trash for so long.,CartRambler,595,2024-05-16 20:43:55,https://imgur.com/a/I5EMkAL
Kotaku Senior Editor Alyssa Mercante Continues To Play Victim As She Attacks 'Stellar Blade' And Gamers,shipgirl_connoisseur,589,2024-04-29 15:46:03,https://thatparkplace.com/kotaku-senior-editor-alyssa-mercante-continues-to-play-victim-as-she-attacks-stellar-blade-and-gamers/
Former Kotaku And IGN Editor Calls For Video Game Developers And Publishers To Condemn Gamers For Opposing Woke Ideology,shipgirl_connoisseur,587,2024-06-21 00:44:41,https://thatparkplace.com/former-kotaku-and-ign-editor-calls-for-video-game-developers-and-publishers-to-condemn-gamers-for-opposing-woke-ideology/
Well played Journos....Well played. ,HalosBane,588,2024-06-26 16:55:56,https://i.redd.it/09tvhdz75y8d1.png
CD Projekt Red Senior Experience Designer Seems to Mocks Fan Over Witcher 4 DEI Concerns,gadesabc,587,2024-11-27 15:42:13,https://thatparkplace.com/cd-projekt-red-senior-experience-designer-attacks-fan-over-witcher-4-dei/
"Former GameSpot Host Danny O'Dwyer: ""Games Journalism is like fewer than 40 people now. Magazines are basically gone and websites are close behind them. None of this is a surprise to me, but it's incredibly sad. We had something awesome for a while there.""",AboveSkies,590,2024-12-12 11:02:43,https://x.com/dannyodwyer/status/1866725603183038572
"A petition to restore ""sex: male/female"" for the upcoming DQ III and future games",CommercialAd6066,585,2024-09-29 17:22:40,https://www.reddit.com/r/KotakuInAction/comments/1fs9l5s/a_petition_to_restore_sex_malefemale_for_the/
"Firewalk Studios (Concord) staff reportedly demanded to use pronouns, open about ""decreasing straight white males"", cult mentality.",QForKiwi,586,2024-07-30 18:59:35,https://icon-era.com/threads/whistleblower-at-concords-firewalk-studios-staff-demanded-to-use-pronouns-open-about-decreasing-straight-white-males-cult-mentality.13396/
'Black Myth Wukong' Goes To Top of Steam Wishlist Charts Despite IGN Accusing Developer Of Sexism And Misogyny,shipgirl_connoisseur,586,2024-06-19 13:14:58,https://thatparkplace.com/black-myth-wukong-goes-to-top-of-steam-wishlist-charts-despite-ign-accusing-developer-of-sexism-and-misogyny/
This is more evidence of the social engineering being pushed. ,SilentSpectre45,588,2024-03-13 21:44:54,https://i.redd.it/hq70skf496oc1.jpeg
"'Kill La Kill' Creator Defends Fan Service In Anime: ""If We Make The Work Completely Sterile, People's Immunity Will Be Weakened And They Will All Die""",shipgirl_connoisseur,586,2024-05-17 08:44:30,https://boundingintocomics.com/2024/05/17/kill-la-kill-creator-defends-fan-service-in-anime-if-we-make-the-work-completely-sterile-peoples-immunity-will-be-weakened-and-they-will-all-die/
"Sweet Baby Inc. Reveals Dev Team Behind 'Shadow Gambit: The Cursed Crew' Shut Down, Costs Were Exceeding Revenues",shipgirl_connoisseur,583,2024-04-22 15:46:57,https://thatparkplace.com/sweet-baby-inc-reveals-dev-team-behind-shadow-gambit-the-cursed-crew-shut-down-costs-were-exceeding-revenues/
Old news but the head proportions in Silent Hill 2 Remake just bug me. They had several months to walk it back and they didn't.,T24Rev133,580,2024-10-06 09:40:54,https://i.redd.it/oh4v00j7w3td1.jpeg
"Nihon University erases Associate Professor Lockley's resume, NHK deletes program over ""Assassin's Creed"" issue",Ywaina,583,2024-07-20 10:04:08,https://tweetsoku.news/2024/07/20/%e3%80%8c%e3%82%a2%e3%82%b5%e3%82%af%e3%83%aa%e5%95%8f%e9%a1%8c%e3%80%8d%e3%81%a7%e6%97%a5%e5%a4%a7%e3%81%af%e3%83%ad%e3%83%83%e3%82%af%e3%83%aa%e3%83%bc%e5%87%86%e6%95%99%e6%8e%88%e3%81%ae%e7%b5%8c/
Paramount is withholding Sonic 3 from small movie theaters that chose not to show Gladiator 2,unSentAuron,583,2024-12-17 18:20:29,https://i.redd.it/bjjq3fruag7e1.png
Hating Ghost of Yotei because the actors personal beliefs is the same as woke twitter people hating on Hogwarts Legacy because JKR’s personal beliefs,MrCreepySkeleton,607,2024-09-26 08:56:58,https://www.reddit.com/r/KotakuInAction/comments/1fprpud/hating_ghost_of_yotei_because_the_actors_personal/
Exclusive: Ubisoft Finances Point To Potential Bankruptcy in 2025,shipgirl_connoisseur,580,2024-12-19 05:13:40,https://thatparkplace.com/ubisoft-bankruptcy/
"'The Acolyte' Showrunner Leslye Headland Says Critics Describing Witch Coven As Lesbians Are ""Not Really Paying Attention"", Claim Series Is ""The Most Important Piece Of Art That I've Ever Made""",Sliver80,590,2024-06-21 20:02:03,https://boundingintocomics.com/2024/06/21/the-acolyte-showrunner-leslye-headland-says-critics-describing-witch-coven-as-lesbians-are-not-really-paying-attention-claim-series-is-the-most-important-piece-of-art-that-ive-ever-made/
[News] Assassin's Creed boss claims Yasuke can HEAL the world!,Dramatic-Bison3890,580,2024-11-03 06:20:43,https://thatparkplace.com/assassins-creed-shadows-boss-claims-dei-is-killing-game-not-only-doubles-down-on-it-but-also-attacks-critics/
"Ubisoft Exec Says Gamers Need To Get Comfortable With ""Not Owning Your Games""",Judah_Earl,582,2024-01-16 10:23:54,https://i.redd.it/6jlyyrek3scc1.png
"'She-Hulk' Star Praises How Series Creator Used Marvel Series To Attack Fans: ""What's Fun About It Is That She Built Into The Story That People Were Going To Troll Us""",Sliver80,581,2024-04-30 03:43:14,https://boundingintocomics.com/2024/04/29/she-hulk-star-praises-how-series-creator-used-marvel-series-to-attack-fans-whats-fun-about-it-is-that-she-built-into-the-story-that-people-were-going-to-troll-us/
Another day another Hollywood award where diversity is given importance over talent,Otherwise-Yard-3176,585,2024-01-24 09:16:10,https://i.redd.it/w7kzo4evucec1.jpeg
"ADL Doxxes Private Citizen on X, Violating Platform Rules, While trying to Label Gamers as Toxic on Steam",Equilybrium,577,2024-11-15 17:01:46,https://www.youtube.com/watch?v=GUPKBJvZRiU
Boycotting DEI in video games is now a pastime and an industry.,Itchy-Pilot-8987,577,2024-08-30 16:28:17,https://www.reddit.com/r/KotakuInAction/comments/1f4zj7t/boycotting_dei_in_video_games_is_now_a_pastime/
"Star Wars Outlaws, 48 hours after its release on Steam.",gadesabc,574,2024-11-24 10:36:38,https://i.redd.it/u0zzdh05vt2e1.png
"It was already reported about the possible removal of biological gender to body type on DQ III HD-2D Remake, and it seems Japanese magazine Shonen Jump confirms it.",nekcore,586,2024-07-09 17:33:10,https://i.redd.it/ebyyqewp3jbd1.jpeg
Nintendo Of America Manager James Wong Attempts To Deny That He Encouraged Racism Against White People,shipgirl_connoisseur,591,2024-06-20 00:18:15,https://thatparkplace.com/nintendo-of-america-manager-james-wong-attempts-to-deny-that-he-encouraged-racism-against-white-people/
"Blackrock, Vanguard and State Street have all cut down their support for ESG proposals.",EjnarH,574,2024-09-21 09:20:17,https://www.reddit.com/r/KotakuInAction/comments/1flz2ci/blackrock_vanguard_and_state_street_have_all_cut/
"Dragon Age: The Veilguard’s Clumsy, Preachy Political Messaging Does More Harm Than Good | Forbes",Calico_fox,576,2024-11-01 00:37:59,https://archive.ph/9qkIT
"YouTuber SidAlpha about Hellblade II: ""Wait... 3 hours and 19 minutes of CUTSCENES in a 5 hour game.. So the cutscenes are TWICE as long as the gameplay... That's not a game. It's just a movie at that point.""",AboveSkies,581,2024-05-22 22:44:38,https://archive.is/llUaF
There is no such thing as a “modern audience”,GeauxColonels21,577,2024-03-28 13:38:59,https://www.reddit.com/r/KotakuInAction/comments/1bpvuo8/there_is_no_such_thing_as_a_modern_audience/
"'The Marvels' Confirmed As Biggest Box Office Bomb Of 2023, Widely-Panned Sequel Resulted In $237 Million Loss For Disney",shipgirl_connoisseur,578,2024-05-03 09:01:46,https://boundingintocomics.com/2024/05/03/the-marvels-confirmed-as-biggest-box-office-bomb-of-2023-widely-panned-sequel-resulted-in-237-million-loss-for-disney/
My take on the Boys season 4 so far:,eventualwarlord,580,2024-06-14 17:55:35,https://i.redd.it/xhi7fidzsk6d1.jpeg
