Title,Author,Score,Created_UTC,URL
Eurogamer gets community noted for their SBI puff piece,FirstLine1,2057,2024-03-09 08:47:06,https://i.redd.it/mjuonkyrt9nc1.png
Gamergate2 in a nutshell,AvidanYoutube,2110,2024-03-12 22:32:05,https://i.redd.it/eo8ipcnfcznc1.png
The absolute state of role playing in a 2024 BioWare game,RainbowDildoMonkey,2075,2024-11-01 12:43:03,https://i.redd.it/aoq8ue01cayd1.jpeg
No wonder Starfield was a complete disappointment,SnooDucks6239,1964,2024-03-03 16:47:09,https://i.redd.it/fqkpj2yve5mc1.jpeg
I remember being amazed at how much better games got,RealMcGonzo,2247,2024-10-02 15:47:41,https://i.redd.it/negidwic6dsd1.png
Nothing screams a fantasy world more than modern day gender lingo ,SnooDucks6239,2706,2024-10-28 17:07:22,https://i.redd.it/mzctp0uc4jxd1.jpeg
"Former Obsidian Entertainment director/writer Chris Avellone speaks up about Avowed situation, calls artists who were rejected by Obsidian for racial reasons to take legal action",HelloKolla,1842,2024-11-27 19:31:39,https://i.redd.it/ckv8c6afxh3e1.png
"""No diversity' yeah alright, i think we know why",QForKiwi,1839,2024-08-22 16:22:45,https://i.imgur.com/hMilTfU.jpeg
Really?,sebitian,2294,2024-08-26 11:18:48,https://i.redd.it/2rj420poszkd1.jpeg
Return to form,aska33j,1820,2024-10-29 10:49:51,https://i.redd.it/q7covbhvdoxd1.png
Dragon Age Veilguard's localization is bastardizing German language in the name of ''inclusivity'',RainbowDildoMonkey,2666,2024-10-31 15:54:52,https://i.redd.it/nened39z44yd1.jpeg
"Thomas Mahler, director of Ori 1 and 2, has taken time out of his busy day to stomp noted cockroach Alyssa Mercante scuttling into his mentions in attempt to shame him.",HereForGames,1813,2024-10-10 09:44:06,https://i.redd.it/dymsrmanfwtd1.png
"RUMOR | It seems that JK Rowling is suing Warner Brothers for the rights to Harry Potter, as the studio is looking for ""a diverse cast"" for the new version but Rowling prefers a cast ""more traditional and faithful to the original work""",FirstLine1,1717,2024-10-19 08:42:11,https://i.redd.it/eeeworyxdovd1.png
"Jason Schreier deletes his post about dragon age ""Go woke, go brok-err, top of the charts""",Equilybrium,1800,2024-11-08 15:59:39,https://i.redd.it/3oytk5n9apzd1.jpeg
"Kotaku started laying off today, including Alyssa Mercante. ",xariznightmare2908,1701,2024-11-07 18:22:20,https://i.redd.it/zurlpctjuizd1.jpeg
The Hypocrisy is too blatant,N/A,1694,2024-04-27 22:25:12,https://i.redd.it/y6r6wuc6l3xc1.jpeg
What a weird thing to brag about.,dandrixxx,1767,2024-03-25 19:02:52,https://i.redd.it/8oo3zhnz1jqc1.jpeg
"Why are people who hate guns and can't handle seeing them in games, making games about guns?",sorryurwronglol,1696,2024-10-08 20:45:33,https://i.redd.it/ynvaazs1hltd1.jpeg
Yasuke doesn't make sense as an Assassin for the new game,DarkSkyAboveUs,1698,2024-05-16 14:10:46,https://pbs.twimg.com/media/GNsjHK1W0AA6HZ5.jpg
Usual suspects strike again,Modern_Maverick,1794,2024-02-01 07:37:26,https://i.redd.it/ewuwkhq6gxfc1.jpeg
Classic Fantasy vs Modern Fantasy,AboveSkies,1684,2024-11-22 05:41:22,https://www.nerfnow.com/img/3313/4944.png
"""Someone cut the hair of the xbox""female"" fable characters and this is what happens""",hostrelok,1694,2024-04-07 16:10:58,https://i.redd.it/8xwm8grb03tc1.jpeg
Have a nice weekend everyone ,fer6600,1637,2024-04-13 00:22:27,https://i.redd.it/69zwb3uk45uc1.jpeg
Female face models in Death Stranding 2 ,nitin42,1635,2024-09-30 09:23:04,https://i.redd.it/9glv6wuzzwrd1.jpeg
Star Wars: Outlaws Main Actress is completely changed from real life,DarkSkyAboveUs,1692,2024-04-10 00:08:50,https://i.imgur.com/8fsxmPE.jpeg
Former member of BGG speaks out,Equilybrium,1594,2024-03-27 15:39:54,https://i.redd.it/k2z36bircwqc1.jpeg
"Black Myth Wukong 3D models and their real life models. This is visual proof that the excuses given by Woke Western devs that the tech is not there to make visually accurate or stunning 3D models is a complete lie. Even Ellen Page looked like herself in a PS3 game, Beyond Two Souls.",Jakunobi,1630,2024-08-28 05:11:58,https://i.redd.it/7mtauaqb8cld1.png
Turns out Senator Mark Warner is bankrolled by Disney who pumped $1.5 billion into Steam's chief competitor Epic Games,Equilybrium,1582,2024-11-19 20:23:01,https://i.redd.it/9uhrxb083x1e1.jpeg
"In the live-action of How to Train Your Dragon, Astrid will be played by the actress Nico Parker, who already played Sarah (Joel's biological daughter) in the HBO serie adaptation of The Last of Us.",gadesabc,1635,2024-11-17 12:48:38,https://i.redd.it/zrf53wewjg1e1.png
They are now trying to rewrite history because of the game. I know it just a wikipedia page but this shouldnt be taken lightly,MmntoMri,1564,2024-07-07 12:10:47,https://i.redd.it/wdl4b2lf83bd1.jpeg
This article didn't age well,theonewithcats,1583,2024-10-10 18:40:21,https://i.redd.it/595gfl6j4ztd1.jpeg
Lead weapons designer in CDPR talks about the The AC character design choice ,HereYouGooo,1526,2024-05-19 18:31:00,https://i.redd.it/fj2ps5olff1d1.jpeg
They are attacking Steam Forums now,SnooWalruses7872,1533,2024-11-15 23:48:40,https://i.redd.it/ng2uc1yck51e1.jpeg
Game workshop at Playstation Studios only for girls and non binary kids,Masoud-97,1549,2024-10-06 09:37:53,https://i.redd.it/58qzt6h3w3td1.jpeg
Dustborn is being exhibited at Tokyo Game Show,AboveSkies,1512,2024-09-26 15:55:21,https://files.catbox.moe/0g2g7w.jpg
[Gaming] Neil Druckmann's female characters vs Amy Hennig's female characters,totlmstr,1499,2024-12-18 22:39:53,https://i.redd.it/e5elo2zvpo7e1.jpeg
"Godot Engine decided to virtue signal on Twitter and then went on mass blocking spree against anyone critical of them, even those simply suggesting to focus on improving their engine instead.",RainbowDildoMonkey,1508,2024-09-28 13:55:05,https://i.redd.it/vo7ot1rxxjrd1.png
Dragon Age the veilguard is even worse in French.,Lapinal1,1474,2024-11-02 23:20:45,https://www.reddit.com/r/KotakuInAction/comments/1gi9avs/dragon_age_the_veilguard_is_even_worse_in_french/
"Ubisoft apparently forgets Yasuke was African, not African American, and blasts stereotypical hiphop music whenever he fights in Assassin's Creed Shadows",HereForGames,1484,2024-06-12 04:00:35,https://www.youtube.com/watch?v=p6g6rwVaZds
Shout out to Resident Evil remake devs for being able to accurately recreate their real life female models in-game without uglifying them.,dandrixxx,1460,2024-04-08 20:21:40,https://i.redd.it/i3i35nwn4btc1.jpeg
"Ken Takakura (Dandadan) EN VA supports blackwashing art. Also thinks white vas can’t voice POCs, but not vice versa. ",Individual_Ad_4899,1509,2024-12-09 18:10:19,https://i.redd.it/ey5fr8fv5v5e1.jpeg
Steam won't be taking down the Sweet Baby curator page,DarkSkyAboveUs,1461,2024-03-08 12:37:04,https://i.redd.it/yfapz29su3nc1.jpeg
"Concord devs removed the 'LGBTQ'+ and 'Political' tag from the steam page​, now there's only 'FPS, Action, and Shooter' ",QForKiwi,1523,2024-08-24 03:43:32,https://i.imgur.com/WYQbaDc.png
Avowed's art direction vs Skyrim's modders,Modern_Maverick,1457,2024-11-30 22:37:39,https://i.redd.it/2kbohs19944e1.jpeg
The woke game dev who cried about game studios uglifying all his Black female characters has been told to STFU by his fellow devs.,SickusBickus,1594,2024-06-24 14:27:29,https://i.redd.it/gcbs4m7q4j8d1.jpeg
BREAKING: Concord Developer Firewalk Studios Shut Down By Sony,janonx1,1441,2024-10-29 17:55:28,https://insider-gaming.com/breaking-concord-developer-firewalk-studios-shut-down-by-sony/
"Zip from Tomb Raider games, who was explicitly stated to be a ladies man, has been turned into a flamboyant gay man in Netflix's animated Tomb Raider series.",RainbowDildoMonkey,1419,2024-10-11 12:05:17,https://i.redd.it/l0kz8bll44ud1.jpeg
"Japanese Players Petition Ubisoft To Cancel 'Assassin's Creed Shadows', Accuse Game Of Being ""A Serious Insult To Japanese Culture And History""",shipgirl_connoisseur,1417,2024-07-02 02:31:00,https://boundingintocomics.com/2024/07/01/japanese-players-petition-ubisoft-to-cancel-assassins-creed-shadows-accuse-game-of-being-a-serious-insult-to-japanese-culture-and-history/
It feels like the last year has been a thundering referendum against identity politics in culture.,HereForGames,1416,2024-11-06 11:08:50,https://www.reddit.com/r/KotakuInAction/comments/1gkw1ct/it_feels_like_the_last_year_has_been_a_thundering/
Why is every male hobby being infested with inclusivity?,PalpitationGood6803,1422,2024-09-30 14:08:24,https://www.reddit.com/r/KotakuInAction/comments/1fswfh1/why_is_every_male_hobby_being_infested_with/
Thanks for telling us what games to avoid.,Chadahn,1409,2024-09-19 20:14:09,https://i.redd.it/gjsmp1u1qtpd1.png
Godot's Discord mod is a racist. Surprise surprise,Lammahamma,1425,2024-09-30 00:41:48,https://i.redd.it/uj2hlwszeurd1.jpeg
DEI Detected website by Krabutus is up. It's a website that lists all games with involvement from a consultant firm like SBI,DarkSkyAboveUs,1387,2024-04-23 13:19:41,https://i.imgur.com/wT2maq5.png
From the Pokemon Leak regarding Changes to Overseas versions,AboveSkies,1401,2024-10-15 13:22:38,https://i.postimg.cc/8z8GCtPW/1728870230959253.png
One piece Live action series writer claimed the next villain is based on Trump,Dramatic-Bison3890,1389,2024-11-10 22:51:51,https://i.redd.it/ncgg40yel50e1.jpeg
[ART] K. (BurntAsh),cesariojpn,1351,2024-09-05 20:18:57,https://i.redd.it/qocqdfott1nd1.jpeg
Insider leaks on what's going on at Firewalk Studios (Concord),MapCold6687,1382,2024-08-25 15:39:17,https://i.redd.it/jg9hznjaytkd1.png
NexusMods did it again - This time they removed the mod which deletes warning message.,FragSinus,1376,2024-02-17 23:08:50,https://i.redd.it/71n8sjys88jc1.png
‘The Acolyte’ Canceled: No Season 2,PhuckSJWs,1375,2024-08-19 23:26:48,https://deadline.com/2024/08/the-acolyte-canceled-no-season-2-star-wars-disney-plus-1236044233/
"Lara Croft having bigger breasts and curves in 2024 is apparently 'unrealistic' for what she does according to people in charge of Tomb Raider, but a double amputee raiding tombs and fighting is perfectly fine... (character from the upcoming official Tomb Raider: Shadows of Truth TTRPG)",RainbowDildoMonkey,1355,2024-10-13 19:51:49,https://i.redd.it/abanrie5tkud1.png
JOKER IS HILARIOUSLY BAD,N/A,1384,2024-10-05 11:29:21,https://www.reddit.com/r/KotakuInAction/comments/1fwo9re/joker_is_hilariously_bad/
The Boys has made me realize Trump's mere existence helped ruin an entire generation of writers in every medium.,HereForGames,1383,2024-06-18 08:55:45,https://www.reddit.com/r/KotakuInAction/comments/1dim125/the_boys_has_made_me_realize_trumps_mere/
"I found this post really insightful on why it's become much harder to do ""diverse"" or ""inclusionary"" content without backlash",EjnarH,1352,2024-10-22 11:46:20,https://i.redd.it/5sq01qkpoawd1.png
"The people who say ""just don't choose the dialogue option"" for dragon age are letting on that they haven't even played the game so here's what you'll miss out on if you actually take their advice (spoilers)",Ok-Background8466,1346,2024-11-04 10:22:26,https://www.reddit.com/r/KotakuInAction/comments/1gjb2fx/the_people_who_say_just_dont_choose_the_dialogue/
Dragon Age Metacritic score 30 minutes after review embargo lifting.,TrunkisMaloso,1346,2024-11-01 19:38:51,https://i.redd.it/012waggwecyd1.png
"Sail on the horizon! Inspired by the sea and pirates, my friend and I have always dreamed of shouting this from the mast. For over two years, we’ve been independently developing a pirate action game. What do you think? ",FoamyBrewProduction,1322,2024-11-09 14:05:35,https://www.youtube.com/watch?v=PcGTrYf5UWI
Their strawmen have become so lazy and smooth brained that it's just sad at this point.,dandrixxx,1343,2024-03-16 23:06:17,https://i.redd.it/xq7lhp9rsqoc1.jpeg
"We are two developers pursuing our dream of creating an open-world pirate action game called Neverseas, featuring a variety of mechanics. We are ambitious and determined to finish development at all costs. We really hope you enjoy the results of our work!",RogueOne427,1319,2024-10-07 07:52:13,https://www.youtube.com/watch?v=_gnRiGdaxJE
They're going after Helldivers 2 now,speedb0at,1326,2024-03-08 16:49:49,https://i.redd.it/19cq6b8v35nc1.png
So it begins; Kotaku laid off 4 staff members today,Equilybrium,1308,2024-05-08 05:39:47,https://i.redd.it/chmm0g3x35zc1.jpeg
Ubisoft just added a wheelchair operator with a robot to Rainbow Six Siege. They are literally doing the meme now.,metalhusky,1335,2024-09-10 23:34:32,https://i.redd.it/2z3phllnh2od1.jpeg
Suicide Squad: Kill the Justice League is like a self-unaware parody of woke writing tropes.,dandrixxx,1308,2024-02-03 16:39:05,https://i.redd.it/yxz3kmjvdegc1.jpeg
Black Panther really ruined a whole generation of character designers. ,docs5198,1302,2024-11-21 02:58:10,https://i.redd.it/5g9hyf7q662e1.jpeg
"Sweet Baby Inc. Employee Admits Goal Is ""Burning The Games Industry To The Ground""",gadesabc,1340,2024-09-24 21:04:51,https://thatparkplace.com/sweet-baby-inc-employee-admits-goal-is-burning-the-games-industry-to-the-ground/
"Moon Studios CEO Describes 'Dragon Age: The Veilguard' Writing As ""Infantile And Terrible""",iansanmain,1305,2024-11-04 19:51:24,https://thatparkplace.com/moon-studios-ceo-describes-dragon-age-the-veilguard-writing-as-infantile-and-terrible/
Sweet Baby Inc. Took Notice Of The Steam Curator And They Are Not Happy,darkallnight,1360,2024-02-29 20:21:26,https://www.reddit.com/r/KotakuInAction/comments/1b3a8dv/sweet_baby_inc_took_notice_of_the_steam_curator/
This trend really needs to stop. ,docs5198,1290,2024-12-06 18:35:23,https://i.redd.it/mzh1sqwlv95e1.jpeg
Sweet Baby Inc. CEO Makes It Clear She Wants To Erase White Male Lead Characters While Employee Shows Disdain For White People ,CrimsonOmega80,1319,2024-03-04 17:42:22,https://thatparkplace.com/sweet-baby-inc-ceo-makes-it-clear-she-wants-to-erase-white-male-lead-characters-while-employee-shows-disdain-for-white-people/
Mass Effect board game creators were so preoccupied with giving characters preferred pronouns that they forgot how to spell 'adrenaline' correctly.,RainbowDildoMonkey,1270,2024-10-22 17:20:41,https://i.redd.it/i428mgsvbcwd1.jpeg
"Old School Runescape removes Male and Female options from character creation, adds Body Type A or B and pronouns options",Trogadorr,1268,2024-08-14 16:38:43,https://i.redd.it/ind4yqxpqnid1.png
Screenrant gives a 6/10 to Black Myth Wukong: 'Lacking in inclusivity and diversity',QForKiwi,1647,2024-08-16 15:39:27,https://screenrant.com/black-myth-wukong-review/
A tourist discovers 40K,dandrixxx,1268,2024-01-05 17:59:54,https://i.redd.it/en2sdkjpunac1.jpeg
Sweet Baby Inc. CEO And Co-Founder Kim Belair Compares White Male Gamers To Picky Babies,CrimsonOmega80,1276,2024-03-05 20:13:14,https://thatparkplace.com/sweet-baby-inc-ceo-and-co-founder-kim-belair-compares-white-male-gamers-to-picky-babies/
"From pirate enthusiasts to game creators: for over a year, my friend and I have been working on Neverseas, an open-world sea adventure. Dive into the gameplay and let us know—are you ready to sail with us and take on the high seas?",RogueOne427,1250,2024-10-24 06:25:01,https://www.youtube.com/watch?v=x7LxP5hxufo
Games journalists are just outright advocating for violence against Grummz now.,SickusBickus,1246,2024-06-18 18:43:43,https://i.redd.it/phk9678ykd7d1.jpeg
"In an ironic twist of fate, woke DA Veilguard turned out to be the most sexist game I’ve seen",hakovoid,1237,2024-11-02 02:29:29,https://www.reddit.com/r/KotakuInAction/comments/1ghmlqp/in_an_ironic_twist_of_fate_woke_da_veilguard/
Dragon Age: The Veilguard fosters a friendly welcoming community — insensitive laughing bigots need not apply.,h-v-smacker,1223,2024-12-01 12:15:55,https://i.redd.it/72d4qf8ua84e1.jpeg
"Then why aren’t they called “Woke” now, Genius?",TonyAbbotIsATwat,1213,2024-12-15 10:14:36,https://i.redd.it/rkc0xvtgmz6e1.jpeg
Finally an actual developer telling what many of us have been saying for a while about character design in games. The guy behind Stellar Blade keeps being based.,dandrixxx,1286,2024-02-09 17:20:11,https://i.redd.it/dzcz35ovelhc1.jpeg
"Activist Organization That Encouraged Game Developers To Denounce Gamers Is Now Begging For $80,000 In Order To Remain Open",shipgirl_connoisseur,1209,2024-09-11 13:33:27,https://thatparkplace.com/activist-organization-that-encouraged-game-developers-to-denounce-gamers-is-now-begging-for-80000-in-order-to-remain-open/
Godot Discord moderator’s insane response to all the drama,AbdelYG,1261,2024-09-29 14:58:20,https://i.redd.it/3x6w4u7wirrd1.jpeg
"Reddit ""Fallout Fandom"" has nuclear meltdown and goes full ""SHUT IT DOWN!"" after three different Fallout creators and lead writers come out saying Fallout was never about ""CAPITALISM BAD!""",AboveSkies,1228,2024-08-26 03:08:00,https://www.reddit.com/r/KotakuInAction/comments/1f1ea8h/reddit_fallout_fandom_has_nuclear_meltdown_and/
Assassin’s Creed Shadows has Officially Been Delayed Until 14th of February 2025,Mons7ec,1223,2024-09-25 16:04:01,https://i.redd.it/vt0h41ryazqd1.jpeg
"Kotaku parent company tells Kotaku to only make game guides, no more politics",N/A,1199,2024-03-22 06:31:50,https://i.redd.it/h666pm1fytpc1.png
"Thank you based Sony. Pronouns on the character selection screen? Check. DEImographics? Check. Never has a game been so dead on arrival. This is a paid game, not f2p btw. (game is called Concord)",ketaminenjoyer,1215,2024-05-31 00:58:05,https://i.redd.it/2wuuz3waun3d1.png
Tetsuya Nomura doesn't think we should have to play as ugly characters in games,xavdeman,1195,2024-09-23 08:59:22,https://www.gamereactor.eu/tetsuya-nomura-doesnt-think-we-should-have-to-play-as-ugly-characters-in-games-1435953/
Black male characters now seem to have their own version of the butch side shave that's been plaguing female character design.,dandrixxx,1244,2024-01-15 20:32:41,https://i.redd.it/icmakij0zncc1.jpeg
"New research on female video game characters uncovers a surprising twist - Female gamers prefer playing as highly sexualized characters, despite disliking them.",N/A,1188,2024-10-30 11:35:37,https://www.psypost.org/new-research-on-female-video-game-characters-uncovers-a-surprising-twist/
"Women supposedly state they dislike sexualised female characters in video games, however they actually prefer to play and identify with said characters, according to a recent scientific study.",Nelo999,1191,2024-12-20 16:10:54,https://www.psypost.org/new-research-on-female-video-game-characters-uncovers-a-surprising-twist/
This reads like parody.,N/A,1176,2024-02-14 19:48:49,https://i.redd.it/k3wdwr2wulic1.jpeg
BORDERLANDS debuts with 0% on Rotten Tomatoes,phenomen,1181,2024-08-08 17:29:00,https://i.redd.it/3isva6x86hhd1.png
"'The First Descendant' Announces Plans To Add Jiggle Physics, Prompting Outrage From Critics: ""Gamers Are The Most Pathetic Incel Losers There Are""",shipgirl_connoisseur,1171,2024-11-18 16:14:00,https://boundingintocomics.com/video-games/video-game-news/the-first-descendant-announces-plans-to-add-jiggle-physics-prompting-outrage-from-critics-gamers-are-the-most-pathetic-incel-losers-there-are/
iGN France editor has meltdown regarding Stellar Blade,Equilybrium,1195,2024-04-04 17:11:00,https://i.redd.it/a7izmj5bwhsc1.jpeg
It looks like Avowed will be successful in avoiding the male gaze,HeroOfLight,1166,2024-11-26 23:42:50,https://i.redd.it/whh2grwy0c3e1.png
MetroUK just deleted their Twitter/X account after intense backlash to their racist Doctor Who article.,SickusBickus,1169,2024-05-12 17:34:49,https://i.redd.it/cgcb7l47710d1.jpeg
Villain of the new Indiana Jones game set in the 1930's sounds like a Redditor,RainbowDildoMonkey,1175,2024-12-09 17:51:57,https://i.redd.it/vpwsyd8p1v5e1.jpeg
"The Japanese comments on the new Assassin's Creed gameplay trailer are absolutely brutal, some choice examples:",CummyKuat,1171,2024-06-12 07:38:58,https://www.reddit.com/r/KotakuInAction/comments/1de0zlp/the_japanese_comments_on_the_new_assassins_creed/
"""No one is mad about Stellar Blade or sexy women in video games""",dandrixxx,1172,2024-03-18 16:05:08,https://i.redd.it/m7ihk3bx84pc1.jpeg
"Former Suicide Squad game dev, who bragged about race swapping Deadshot and condemned SBI criticism, has an issue with studios stripping black female characters of the original beauty he designed them with. He ignored and made excuses when it happened to characters in remakes or based off irl models",HalosBane,1155,2024-06-18 15:46:12,https://i.redd.it/upjryeaepc7d1.png
"BREAKING: Senior VP Michael Giordano at The Walt Disney Company details discriminatory hiring practices during undercover exposee: ""Nobody else is going to tell you this, but they're not considering any white males for the job""",knossig,1187,2024-06-20 19:42:22,https://x.com/i/status/1803833834946883901
Terminator Zero uses disinformation to spread the hate of men,tyranicalmoon,1149,2024-09-09 11:44:13,https://i.redd.it/sl82jc3otrnd1.png
'Helldivers 2' Moderator Bans Users For Vomit Reacting To LGBTQ+ Furry Art Then Removes The Emote As Player Base Continues To Shrink,shipgirl_connoisseur,1148,2024-06-13 00:09:57,https://thatparkplace.com/helldivers-2-moderator-bans-users-for-vomit-reacting-to-lgbtq-furry-art-then-removes-the-emote-as-player-base-continues-to-shrink/
Soulash 2 dev stood up to mob trying to cancel him,WuddlyPum,1170,2024-08-28 21:18:30,https://i.redd.it/e2lhm8x91hld1.jpeg
"My friend is a solo dev, he keeps getting knocked back from government grants because his game doesn't promote 'diversity and inclusion'. ",whydyouonlycallme,1147,2024-09-17 23:34:03,https://www.reddit.com/r/KotakuInAction/comments/1fjehht/my_friend_is_a_solo_dev_he_keeps_getting_knocked/
Sweet Baby Inc detected just reached 200k followers!,FirstLine1,1128,2024-03-07 06:58:09,https://i.redd.it/6dkblrec1vmc1.png
Creative director at GRIMOIRE made this vile tweet in response to Alyssa Mercante contacting Smash JTs wife before protecting his account.,SickusBickus,1137,2024-05-07 22:57:09,https://i.redd.it/ak5ompc543zc1.jpeg
"Veilguard character creator boasts a ton of diverse option. But here's what ""Chest size"" sliders to 100/100 looks like. ",Shirokurou,1124,2024-09-19 21:41:07,https://i.redd.it/lf2bysmb5upd1.png
Sony to take Concord offline on Sept. 6 and issue refunds to everyone who purchased it,Megistrus,1893,2024-09-03 16:06:25,https://blog.playstation.com/2024/09/03/an-important-update-on-concord/
Kathleen maybe your series is just horrible with a brain dead plot full of plotholes and some primary school fan fiction level of writing ? But no let's find the easy way and scream Misogyny.,aborted_dreamss,1125,2024-06-19 11:56:49,https://i.redd.it/8p3e5l6jpi7d1.jpeg
"Musk eyeing up events, tweet is related to the Xbox head of marketing tweet",Equilybrium,1122,2024-03-28 11:52:38,https://i.redd.it/sw1enko4d2rc1.jpeg
Gamespot has disabled comments on their Veilguard videos. GO WOKE GO BROKE,OnTheAccountOf,1114,2024-11-09 08:44:18,https://i.redd.it/dd159bid9uzd1.png
 Sweet Baby Inc detected,MikiSayaka33,1113,2024-02-26 03:01:42,https://steamcommunity.com/groups/sweetbabyinc-detected
"So let me get this straight, the new Batman show’s first episode has: ",eventualwarlord,1144,2024-08-03 05:04:42,https://www.reddit.com/r/KotakuInAction/comments/1eiv5y3/so_let_me_get_this_straight_the_new_batman_shows/
"Grummz is reporting that the Wikipedia editors are erasing historical facts of Yasuke, to protect the new Assassin's Creed Shadows of any ""racist criticism"" for the main character.",nekcore,1143,2024-05-15 18:27:11,https://i.redd.it/ufycqgu9vm0d1.jpeg
"Shift Up CEO Says He Was “Following His Instincts” When Designing Sexy Characters For ‘Stellar Blade’ And ‘Goddess Of Victory: Nikke’: “It’s Something That Users Like And Want, But I Also Do It Because I Like It”",AboveSkies,1131,2024-10-22 05:25:37,https://boundingintocomics.com/video-games/shift-up-ceo-says-he-was-following-his-instincts-when-designing-sexy-characters-for-stellar-blade-and-goddess-of-victory-nikke-its-something-that-users-like-and-want-but-i-also-do-i/
"""Greek Mythology"" But White Men Are Minority",N/A,1260,2024-05-11 16:39:16,https://i.redd.it/f61lvmj9stzc1.png
Morrigan once again nerfed in Dragon Age The Veilguard,QForKiwi,1099,2024-08-15 16:27:02,https://i.imgur.com/GNEtrkq.jpeg
Wait until this guy hears about Nikke,theonewithcats,1099,2024-09-27 17:47:38,https://i.redd.it/5ja0ha2a3erd1.jpeg
BBC Doctor Who branded 'woke' and 'unwatchable' as TV ratings plummet following return to screens,Judah_Earl,1107,2024-05-13 14:49:59,https://www.gbnews.com/celebrity/bbc-doctor-who-woke-ratings-ncuti-gatwa
"""Modern Audiences"" just means 'Far-Left Audiences'",Cute-Let-5834,1098,2024-12-18 16:18:21,https://www.reddit.com/r/KotakuInAction/comments/1hh5400/modern_audiences_just_means_farleft_audiences/
"'Naughty Dog' Turns Off Comments For Its 'Intergalactic: The Heretic Prophet' Trailer, Gamers Roast It Anyway",Sliver80,1086,2024-12-13 19:51:10,https://fandompulse.substack.com/p/naughty-dog-turns-off-comments-for
Got this Bespoken shit at TGS. Seriously can’t go any more brain dead.,DO4_girls,1090,2024-11-20 12:16:47,https://i.redd.it/xav2q7zgt12e1.jpeg
Ghost of Tsushima is a weird game,My_name_plus_numbers,1090,2024-09-23 19:48:07,https://www.reddit.com/r/KotakuInAction/comments/1fntk2f/ghost_of_tsushima_is_a_weird_game/
Disney hates money.,TrakssX,1093,2024-02-08 05:33:36,https://i.redd.it/x31gpuossahc1.png
Harada don’t mess around,Cousin_Rabid,1085,2024-01-03 19:45:23,https://i.redd.it/stugt5pz3aac1.jpeg
Kotaku is on twitter whining that SBI is the gaming equivalent of Palestine.,ofmanvv,1088,2024-03-11 21:41:22,https://x.com/danulmao/status/1767213950515474789?s=20
Did gamers win this day?,Seiros_Acolyte,1078,2024-08-20 04:56:56,https://i.redd.it/z0o0diy23rjd1.png
