Title,Author,Score,Created_UTC,URL
"""____ game has always been woke!"" Then why do they have to ""update it for a modern audience""?",Greg2630,919,2024-04-10 10:30:26,https://i.redd.it/opbkjvc2qmtc1.jpeg
"I’m Making a Game That Combines Farming, Automation, PvP, and PvE in an Open World",Crytivo,885,2024-12-19 19:40:47,https://www.youtube.com/watch?v=fdyGXIhSqcw
Dont expect Western games urinalists giving Stellar Blade a fair treatment.,dandrixxx,880,2024-03-31 17:32:29,https://i.redd.it/02wf1sglbprc1.jpeg
Rest In Peace King - Akira Toriyama forever a Legend ,nekcore,878,2024-03-08 04:02:45,https://i.redd.it/eh827wb2b1nc1.jpeg
Things are not going well...,CottonShock,878,2024-11-02 08:57:09,https://i.redd.it/aou44g6gdgyd1.jpeg
Capcom using screenshots of link saving zelda as an example of stereotypes to avoid and bunch more,N/A,875,2024-02-08 10:08:05,https://i.redd.it/9v5w24an5chc1.png
Grummz reports Black Girl Gamers tried to get after him over the lawsuit threat reporting.,cesariojpn,874,2024-03-29 15:33:39,https://i.redd.it/89nko618larc1.jpeg
"One of the consultants from HitDetection Inc., Jacob Geller. who worked on the Silent Hill 2 remake, said that eradicating gamers would make the world a better place.",gadesabc,887,2024-10-07 20:35:26,https://x.com/Pirat_Nation/status/1843323590206480724
Disney Executive Blames Fan For Box Office Failure ,N/A,872,2024-02-24 07:03:29,https://i.redd.it/5jvs29ogfhkc1.jpeg
This is accidentally the harshest criticism of what Dragon Age has become,Fast_Cow_8313,872,2024-10-29 14:58:01,https://www.reddit.com/r/KotakuInAction/comments/1gewmzf/this_is_accidentally_the_harshest_criticism_of/
"Concord They/Them Gameplay Animator lashes out by calling critics ""talentless freaks"" after poor game Launch",AboveSkies,865,2024-08-24 00:39:12,https://pbs.twimg.com/media/GVsr7peXkAAor4n.jpg
"Concord ""Peak"" was below 200 Yesterday after being backed up by all SONY Major gaming Studios cross their social media account encouraging their own developers and fans to play it.  ",N/A,859,2024-08-29 15:47:25,https://i.redd.it/jhrlaqj1jmld1.png
"These 2 originally censored outfits were added to Stellar Blade as new costumes, so now we have the option to either play as the censored costume or the uncensored slightly modified version",TheWholeF-NShow,865,2024-05-24 08:15:42,https://i.redd.it/1sim3sfc2c2d1.jpeg
Kotaku Editor and Chief just resigned,mattcruise,870,2024-03-21 17:41:24,https://www.reddit.com/r/KotakuInAction/comments/1bkcg9u/kotaku_editor_and_chief_just_resigned/
Stellar blade devs added some enhancements to the games physics in the new update ,Former-Pipe-5025,865,2024-09-27 18:57:18,https://i.redd.it/xhdmxmbpferd1.jpeg
"The devs of Unknown 9 did a mass ban of people on their Steam page back in March for talking about Sweet Baby Inc or being negative to the game. The forum group has since been abandoned and it is now filled with people like us. A top rated thread is ""Run Sweet Baby, Run"". ",N/A,863,2024-10-18 12:55:15,https://i.redd.it/v3ro9kt8iivd1.jpeg
Not a single like ,vvxxad,861,2024-10-12 04:33:53,https://i.redd.it/nwzcya6c79ud1.png
"Dustborn dev opens up after brutal launch: ""Caught us completely off guard""",Psycho1267,887,2024-10-16 11:18:18,https://www.gamer.no/artikler/dustborn-dev-opens-up-after-brutal-launch-caught-us-completely-off-guard/517905
Looks like theres a dev willing to stand against the SJWs policing their community.,ChargeProper,855,2024-11-25 06:24:23,https://www.reddit.com/r/KotakuInAction/comments/1gzciei/looks_like_theres_a_dev_willing_to_stand_against/
"Bungie Senior Narrative Designer Defends Sweet Baby Inc., Tells Gamers ""You Need To Grow Up"" ",CrimsonOmega80,857,2024-03-08 21:28:17,https://thatparkplace.com/bungie-senior-narrative-designer-defends-sweet-baby-inc-tells-gamers-you-need-to-grow-up/
Former Sweet Baby Inc. Employee Confirms Company Is Doubling Down On Woke Agenda: “They’re Not Gonna Stop Us”,nekcore,859,2024-11-06 15:17:59,https://thatparkplace.com/former-sweet-baby-inc-employee-confirms-company-is-doubling-down-on-woke-agenda-theyre-not-gonna-stop-us/
"Sweet Baby Inc. CEO Kim Belair Defends Company's Work, Says Critics Are ""Part Of The Greater Movement Towards A Lot Of Very Far-Right Thinking""",Sliver80,858,2024-09-07 20:46:03,https://boundingintocomics.com/2024/09/07/sweet-baby-inc-ceo-defends-companys-work-says-critics-are-part-of-the-greater-movement-towards-a-lot-of-very-far-right-thinking/
The people who support IGN and defend SBI have been continuously defaming the development team of Black Myth: Wukong. Is this a coincidence?,ChemistryTall9757,847,2024-06-22 18:38:02,https://i.redd.it/r9xmgfvr368d1.jpeg
"In just two days, Stalker 2 sold more copies than Dragon Age The Veilguard sold in 23 days
",PopularButLonely,842,2024-11-23 13:40:03,https://www.reddit.com/r/KotakuInAction/comments/1gxzu9a/in_just_two_days_stalker_2_sold_more_copies_than/
Japan finally responds to woke harassment over art ,Individual_Ad_4899,845,2024-10-13 15:07:04,https://x.com/thelegalmindset/status/1845366847194988852?s=61
Content warning before starting Rise of the Ronin.,dandrixxx,840,2024-03-23 18:43:41,https://i.redd.it/2b8mg3mqp4qc1.jpeg
Sweet Baby Inc. Employee Who Tried To Cancel Gamer Over Boycott List Gets X Account Limited,AboveSkies,878,2024-03-05 11:54:45,https://thatparkplace.com/sweet-baby-inc-employee-who-tried-to-cancel-gamer-over-boycott-list-gets-x-account-limited/
They're absolutely seething.,SickusBickus,840,2024-05-30 10:17:46,https://i.redd.it/rjttvnsmhj3d1.jpeg
Twitch streamer offers $30K to make man (Grummz) “disappear” over Stellar Blade disagreement,DarkSkyAboveUs,842,2024-05-01 13:03:07,https://www.dexerto.com/twitch/twitch-streamer-offers-30k-to-make-man-disappear-over-stellar-blade-disagreement-2670479/
Settings in Life is Strange: Double Exposure,Few-Dealer66,840,2024-10-16 07:15:00,https://i.redd.it/47ez14tbj2vd1.jpeg
BioWare Allegedly Scrambles to Remove Gameplay Footage of Dragon Age Veilguard Virtue Cringe,shipgirl_connoisseur,836,2024-10-31 15:19:46,https://thatparkplace.com/bioware-allegedly-tries-to-remove-gameplay-of-footage-of-dragon-age-veilguard-virtue-cringe/
Metacritic is deleting negative reviews for Veilguard,Fuz__2112,895,2024-11-13 19:50:44,https://www.reddit.com/r/KotakuInAction/comments/1gqlrql/metacritic_is_deleting_negative_reviews_for/
The Borderlands movie poster is out… and it looks like complete garbage.,Justbeconfidentbro16,845,2024-02-20 19:22:08,https://i.redd.it/ql82np8ljsjc1.jpeg
"Movie data analyst had come to believe people now hate Forest Gump. Tests hypothesis: Discovers he was wrong; that it remains loved across all ages, genders and political groups, and that the only group who hates it is ""top movie journalists"".",EjnarH,827,2024-11-20 18:33:42,http://www.statsignificant.com/p/do-people-actually-hate-forrest-gump
The way the gaming media is downplaying how disastrous Concord's launch has been is sickening,Juub1990,826,2024-08-25 02:28:34,https://www.reddit.com/r/KotakuInAction/comments/1f0m4cw/the_way_the_gaming_media_is_downplaying_how/
"Furiosa shows similar pattern. Despite having female protagonist, only 28% of female showed up while 72% are male viewers",N/A,826,2024-05-28 13:33:56,https://i.redd.it/2dk1pz1m663d1.png
White VA's cannot voice non-white characters but black VA's can totally voice ancient Nordic women,voidcrack,829,2024-05-22 03:02:07,https://i.redd.it/exwpeexn5w1d1.png
"Absurdly woke, but big budget Homeworld 3 filled with girl bosses and diversity, which released just a few weeks ago is already dead. Funny, the white dudes who played the predecessor 20 years ago didn't like the update for ""modern audiences"". Glad to see capitalism do its work to this studio",SunnySideUp82,824,2024-06-04 23:36:45,https://i.redd.it/7q4cijln4n4d1.png
EA not slowing down on DEI,RainbowDildoMonkey,831,2024-12-02 21:13:43,https://i.redd.it/2g9lo1i22i4e1.jpeg
“It’s a security hole that endangers democracy itself.” NieR creator speaks out against payment processors pressuring Japanese adult content platforms - AUTOMATON WEST,gadesabc,827,2024-11-06 19:23:06,https://automaton-media.com/en/news/nier-creator-speaks-out-against-payment-processors-pressuring-japanese-adult-content-platforms/
"Oh boy, I bet these remasters won't remove or censor any aspects of the games!",otherFissure,824,2024-10-11 21:24:40,https://i.redd.it/g9mkdwgo27ud1.png
IGN Gaslighting in real-time,N/A,818,2024-05-17 14:26:00,https://i.redd.it/paoz78l2yz0d1.jpeg
"""Assassin's Creed Doesn't Care About Historical Accuracy, And Neither Should You"" [Thegamer.com]",N/A,826,2024-05-21 16:50:19,https://i.redd.it/x1x704sg7t1d1.jpeg
Is the average gamer in denial?,ozy31,838,2024-02-10 12:06:36,https://www.reddit.com/r/KotakuInAction/comments/1anew91/is_the_average_gamer_in_denial/
IGN and Kotaku Reviews Aren’t Influencing Game Sales Anymore,TheEternalGazed,821,2024-08-30 21:36:09,https://poptopic.com.au/entertainment/ign-and-kotaku-reviews-arent-influencing-game-sales-anymore/
"From ""Tomb Raider I-III Remastered"" coming out tomorrow",AboveSkies,825,2024-02-13 14:25:24,https://i.imgur.com/Plwi2Y2.jpeg
"IGN France Scrambles To Backpedal After Writing Off 'Stellar Blade' Protagonist Eve As ""A Doll Sexualized By Someone Who Has Never Seen A Woman""",Sliver80,819,2024-04-01 06:04:44,https://boundingintocomics.com/2024/04/01/ign-france-scrambles-to-backpedal-after-writing-off-stellar-blade-protagonist-eve-as-a-doll-sexualized-by-someone-who-has-never-seen-a-woman/
Japanese Fans Are Puzzled That Yasuke Is In ‘Assassin’s Creed Shadows’,Sliver80,811,2024-05-16 03:50:48,https://www.forbes.com/sites/olliebarder/2024/05/15/japanese-fans-are-puzzled-that-yasuke-is-in-assassins-creed-shadows/
Games 4Diversity Tries to Silence YouTubers for Exposing Sweet Baby Inc Connections,Sliver80,786,2024-12-09 21:59:23,https://thatparkplace.com/games-4diversity-tries-to-silence-youtubers/
The discrepancy between Metacritic User and Critic scores for PC games has increased dramatically in the past years,Batattack69,779,2024-09-06 17:06:09,https://i.redd.it/jmt3d1yc08nd1.png
Almost 350k dislikes on the new Assassin's Creed Shadows trailer. From like/dislike ratio of 95% on Mirage to now just 40%. Get fucked Ubishaft hope they lose millions. ,Samagony,786,2024-05-16 20:47:34,https://i.redd.it/mwtu0pznnu0d1.png
Disney Sued for Illegal Discrimination in Casting Rules that Mandate 50 Percent of Characters Must Come From 'Underrepresented Groups',N/A,785,2024-02-18 06:01:06,https://i.redd.it/e1b5iqaiaajc1.jpeg
Womp womp,ping_pong_game_on,778,2024-10-18 05:13:40,https://i.redd.it/a1550mnw7gvd1.png
"New suicide squad character is an activist influencer fighting ""mega-colonizing"" Brainiac",Oceanbia,811,2024-10-01 21:27:53,https://www.youtube.com/watch?v=G80YNWaor6U
Dragons Age: The Veilguard has fallen to number 27 on the steam charts in under 24 hours,Read_New552,779,2024-11-01 09:44:29,https://i.redd.it/csmrhx9xg9yd1.png
"Leigh Alexander - ""gamers are over"" article writer says ""I didn’t join the game industry because I think games are awesome, I did it because I think they should be better""",ManifestedLurker,775,2024-03-16 15:47:41,https://twitter.com/leighalexander/status/1768890911683948778
"I’m Pretty Left-Wing, But Even I’m Fed Up with This Woke Garbage in Games",Cultural-Hamster-215,782,2024-09-01 21:18:26,https://www.reddit.com/r/KotakuInAction/comments/1f6pgt6/im_pretty_leftwing_but_even_im_fed_up_with_this/
Sweet Baby Inc website just got overhauled - Client list is gone,i_a_m_free,769,2024-10-11 04:33:02,https://archive.md/oIgBW
Streamers Critical Of BioWare's 'Dragon Age: The Veilguard' Not Given Review Codes,shipgirl_connoisseur,762,2024-10-26 16:19:54,https://thatparkplace.com/streamers-critical-of-biowares-dragon-age-the-veilguard-not-given-review-codes/
I sense IGN,MrMarxist25,770,2024-10-21 04:38:08,https://i.redd.it/y1vo3brag1wd1.jpeg
Recent Steam reviews for Helldivers 2 have reached Overwhelmingly Negative,CrustyBloke,773,2024-05-05 14:06:31,https://i.redd.it/20v0k4ig7myc1.png
This trend of gigachad jawed women in games is crazy! ,Few-Dealer66,761,2024-06-12 22:51:51,https://i.redd.it/x6swaw0yz76d1.png
That means it's made for people who don't like or play video games.,SickusBickus,761,2024-05-23 19:13:45,https://i.redd.it/hlhrukkv682d1.jpeg
"The pitiful state of woke companies and medias, begging for a ""chance"".",gadesabc,767,2024-08-24 13:59:04,https://i.redd.it/nomww62fbmkd1.jpeg
Update: They've now started banning people from Godot's Github as well.,Calico_fox,761,2024-09-29 19:02:20,https://www.reddit.com/r/KotakuInAction/comments/1fsbxd3/update_theyve_now_started_banning_people_from/
Sick and tired of everything being woke.,muun86,768,2024-12-03 15:56:41,https://www.reddit.com/r/KotakuInAction/comments/1h5qno2/sick_and_tired_of_everything_being_woke/
Sweet Baby Inc. Runs To Kotaku After Their Cancel Campaign Got Destroyed ,CrimsonOmega80,759,2024-03-07 00:18:21,https://thatparkplace.com/sweet-baby-inc-runs-to-kotaku-after-their-cancel-campaign-got-destroyed-and-their-companys-vile-agenda-was-exposed/
"UBISOFT employees Going to strike on October 15, 16 and 17 demanding ""listening to employees opinions by the implementation of a ""social dialogue"" right after UBISOFT Launched an Investigation Into The Company and their CEO said they have no AGENDA to support and will focus on the mainstream gamers.",N/A,758,2024-09-26 15:57:32,https://www.reddit.com/r/KotakuInAction/comments/1fpzn82/ubisoft_employees_going_to_strike_on_october_15/
"'Doctor Who' Showrunner Confirms Upcoming Season To Feature Heavy Focus On Progressive Messaging: ""If You’re Not Writing That In 2024, What On Earth Are You Doing?”",shipgirl_connoisseur,762,2024-05-02 03:21:53,https://boundingintocomics.com/2024/05/01/doctor-who-showrunner-confirms-upcoming-season-to-feature-heavy-focus-on-progressive-messaging-if-youre-not-writing-that-in-2024-what-on-earth-are-you-doing/
can we discuss how this woman single handledly destroyed anime dubs in general,Valuable-Round-8660,770,2024-10-14 00:41:42,https://i.redd.it/j0khq41qbmud1.jpeg
Former Sweet Baby Inc. Client Square Enix Takes a $350 Million Hit in Value as Stock Plummets,gadesabc,758,2024-11-14 13:14:55,https://thatparkplace.com/square-enix-stock-plummets/
Jenna Ortega Says Women ‘Should Have Our Own Franchises’ and Not Just Spinoffs: ‘I Don’t Want Jamie Bond. I Want to See Another Badass’,dandrixxx,758,2024-09-10 11:01:31,https://archive.is/7JE3p
"George R.R. Martin Blames ""Toxicity"" In Fandom And Trump Supporters For His Inability To Complete Game of Thrones",Judah_Earl,760,2024-02-02 16:42:08,https://archive.ph/qigtl
Probably one of the most blatant woke checklist characters made today (World of Warcraft),Zeroinaire,814,2024-06-16 14:25:21,https://i.redd.it/p9bkscu51y6d1.jpeg
[Ethics] Wired's reporting vs. a former Sweet Baby employee in her own words,sodiummuffin,757,2024-03-15 00:36:26,https://i.redd.it/3okpw4a97eoc1.jpeg
"Ubisoft doubles down on DEI Samurai: ""When we self-censor in the face of threats, we hand over our power""",Judah_Earl,753,2024-11-05 07:24:49,https://archive.ph/HAq0I
Ubisoft commented on Elon Musk's tweet about Assassins' Creed Shadows,QForKiwi,783,2024-06-14 12:18:59,https://i.imgur.com/KTlXB2f.jpeg
The poor investment decisions: cattering to handicapped vitiligo ponyself POC noseringed teenagers.,theonewithcats,744,2024-10-09 16:40:03,https://i.redd.it/goobcqp5ertd1.jpeg
F*CK IGN,shipgirl_connoisseur,743,2024-06-15 00:32:23,https://m.youtube.com/watch?v=ghXtEtk9q-Q
"D&D Senior Designer/Project Lead Jason Tondro affirms he cares about the opinion of ""progressives and underrepresented groups who justly took offense at the language of Original D&D"", but he doesn't take criticism from D&D fans/customers seriously even now. They are ""not worth listening to"".",AboveSkies,740,2024-11-28 08:11:26,https://pbs.twimg.com/media/Gdbvs5tawAA1YM5.jpg
"Yasuke ""Bio"" from the Ubisoft AC: Shadows official page",DarkSkyAboveUs,745,2024-05-19 14:21:07,https://i.imgur.com/e6HzzY5.jpeg
"With comments turned off, Naughty Dog has released the trailer for their new game, Intergalactic: The Heretic Prophet",PopularButLonely,751,2024-12-13 07:07:24,https://www.reddit.com/r/KotakuInAction/comments/1hd6ud2/with_comments_turned_off_naughty_dog_has_released/
"Concord launches tomorrow after 8 YEARS of development. Do these Heroes say ""Financial Success"" to you? Sony thinks they do.",Ouch_My_Beans,743,2024-08-22 13:30:47,https://i.redd.it/3agodewct7kd1.png
Many of the low scores for Stellar Blade are because of EVE's body,DarkSkyAboveUs,778,2024-04-25 14:13:03,https://i.imgur.com/JgvMn3p.jpeg
"'NieR' Creator Yoko Taro Voices Concern Over Rise In Credit Card Companies Refusing To Handle Adult Content: ""If They Have Control Of The Clearing House, They Can Even Use It To Control Speech In Other Countries""",shipgirl_connoisseur,743,2024-11-08 13:56:05,https://boundingintocomics.com/video-games/video-game-news/nier-creator-yoko-taro-voices-concern-over-rise-in-credit-card-companies-refusing-to-handle-adult-content-if-they-have-control-of-the-clearing-house-they-can-even-use-it-to-control-speech-in-o/
VISA's Regulation of Adult Content in Japan Discovered to Have Been Conducted by Americans in VISA Japan,Itchy-Pilot-8987,733,2024-11-29 11:17:32,https://www.reddit.com/r/KotakuInAction/comments/1h2jmzz/visas_regulation_of_adult_content_in_japan/
"So... Bioware got rid of heterosexual characters completely in DA. So much for ""representation"". They just straight enforced their alphabet Ideology.",nekcore,734,2024-06-11 19:16:20,https://i.redd.it/r485vcgnsz5d1.jpeg
Square Enix removed from Sweet Baby Inc's list of client companies.,jpuse,754,2024-09-24 10:41:51,https://www.reddit.com/r/KotakuInAction/comments/1fo9eo7/square_enix_removed_from_sweet_baby_incs_list_of/
"Have you ever seen another character or iteration lose all aura and fandom as quick as this?  As soon as this sequel released, everything just seemed to go poof regarding any excitement with this iteration.  It was instantaneous.  Never seen anything like it.",nicemanmeanman,735,2024-12-19 13:14:27,https://i.redd.it/rf3cd4g12t7e1.jpeg
"Capcom Goes ""FULL WOKE,"" Reveals Its Localization Team Alters Video Games For ""Cultural Adaptation, Preserving Context, And Inclusive Storytelling""",ThatGuy1571,731,2024-04-12 14:59:10,https://thatparkplace.com/capcom-goes-full-woke-reveals-its-localization-team-alters-video-games-for-cultural-adaptation-preserving-context-and-inclusive-storytelling/
SkillUp doesn't even recommend Dragon Age Veilguard,ChargeProper,737,2024-10-28 15:19:11,https://www.reddit.com/r/KotakuInAction/comments/1ge4ng3/skillup_doesnt_even_recommend_dragon_age_veilguard/
"Nintendo Of America Manager James Wong Describes Gamers Opposed To Wokeness As ""Angry Bigots,"" Previously Encouraged Racism Against White People",shipgirl_connoisseur,728,2024-06-18 01:44:29,https://thatparkplace.com/nintendo-of-america-manager-james-wong-describes-gamers-opposed-to-wokeness-as-angry-bigots-previously-encouraged-racism-against-white-people/
Black Myth Wukong wins Ultimate Game of the Year at the Golden Joystick Awards,Equilybrium,727,2024-11-21 18:54:52,https://i.redd.it/rgw4bymexa2e1.jpeg
Sweet Baby Inc. Infected 'Alan Wake 2' Has Still Not Recouped Its Development And Marketing Costs,shipgirl_connoisseur,728,2024-11-08 15:37:10,https://thatparkplace.com/sweet-baby-inc-infected-alan-wake-2-has-still-not-recouped-its-development-costs/
Suicide Squad bombed so bad it cost WB $200mil,SwimmingJunky,728,2024-05-09 16:42:32,https://i.redd.it/0dcql4z4jfzc1.jpeg
AC: shadows is proof that sensitivity reading is only done for specific minorities,Tiny_Pie366,724,2024-06-15 20:33:43,https://www.reddit.com/r/KotakuInAction/comments/1dgqy4f/ac_shadows_is_proof_that_sensitivity_reading_is/
Steam is 'an unsafe place for teens and young adults': US senator warns Gabe Newell of 'more intense scrutiny' from the government if Valve doesn't take action against extremist content.,Judah_Earl,733,2024-11-19 12:22:48,https://archive.ph/nVxu9
100% Do Not Buy Star Wars Outlaws,TDSseajay,726,2024-04-09 20:15:06,https://twodashstash.net/2024/04/09/do-not-buy-star-wars-outlaws/
Alan Wake 2 directors Sam Lake and Kyle Rowley admit to with working with Kim Belair of Sweet Baby Inc to 'polish' Saga Anderson,HelloKolla,723,2024-03-05 15:13:01,https://www.gamedeveloper.com/design/why-remedy-entertainment-went-all-in-on-saga-anderson-in-i-alan-wake-2-i-
 Python Bans Prominent Dev for Enjoying the Wrong Old SNL Sketch ,acAltair,726,2024-08-13 04:10:56,https://lunduke.locals.com/post/5985667/python-bans-prominent-dev-for-enjoying-the-wrong-old-snl-sketch
IGN has changed its mind about Veilguard,NAvigatorulX,722,2024-11-11 16:22:09,https://www.reddit.com/r/KotakuInAction/comments/1gow354/ign_has_changed_its_mind_about_veilguard/
"Rumor: 'Assassin's Creed Shadows' Had ""Only About 7% The Pre-Ordered Numbers Of Valhalla During The Same Time Period"" - That Park Place",cesariojpn,725,2024-10-01 06:01:57,https://thatparkplace.com/rumor-assassins-creed-shadows-had-only-about-7-the-pre-ordered-numbers-of-valhalla-during-the-same-time-period/
"Why is it that when minority ppl say ""I want a character who looks like me"" everyone agrees and cheers for them, but white male characters are considered boring and ""not diverse enough""?",SlashCo80,721,2024-10-23 08:29:19,https://www.reddit.com/r/KotakuInAction/comments/1ga5ktw/why_is_it_that_when_minority_ppl_say_i_want_a/
"In less than a week the woke lot have gone from ""Games should include everyone"" to ""We need our own spaces"" and it's glorious to see",Dwavenhobble,738,2024-03-29 05:53:12,https://www.reddit.com/r/KotakuInAction/comments/1bqhv0y/in_less_than_a_week_the_woke_lot_have_gone_from/
Ubisoft Share Falls to 10 year low following Star Wars Outlaws launch,Kadetm93,721,2024-09-09 17:11:20,https://i.redd.it/3pnovsbegtnd1.jpeg
"'Concord' Lead Character Designer Believes ""Whites Must Acknowledge Their Privileged Position, And Then Actively Work For Equality"" Also Claims The Judicial System Is ""White Supremacy""",Sliver80,724,2024-06-04 19:20:49,https://thatparkplace.com/concord-lead-character-designer-believes-whites-must-acknowledge-their-privileged-position-and-then-actively-work-for-equality-also-claims-the-judicial-system-is-white-supremacy/
Call of Duty Black Ops 6 Introduces Non Binary Operative,Read_New552,737,2024-10-23 02:07:57,https://i.redd.it/28g4xd97zewd1.jpeg
"Helldivers Discord Moderator Accuses Mark Kern (Grummz) of Sexual Assault and Harassment, and Calls him a Far-Right Influencer",Argumentium,725,2024-05-05 21:54:46,https://twitter.com/Grummz/status/1787189442689810855
Vocal actor for upcoming Mihoyo game character Feixiao may have just been fired,shinigamixbox,721,2024-09-03 10:18:18,https://i.redd.it/z8gfpo3aikmd1.jpeg
"Lin-Manuel Miranda Says Gamergate Inspired Him To Gender-Swap ‘The Warriors’ For New Concept Album, Describes Event As “Terminally Online Dudes Doxing Women Who Dared To Like Video Games”",Natural-March8839,718,2024-10-24 17:39:14,https://boundingintocomics.com/video-games/video-game-news/lin-manuel-miranda-says-gamergate-inspired-him-to-gender-swap-the-warriors-for-new-concept-album-describes-event-as-terminally-online-dudes-doxing-women-who-dared-to-like-video-games/
Dragon Age just keeps getting worse,shipgirl_connoisseur,723,2024-11-13 13:28:17,https://m.youtube.com/watch?v=AaVctyzUTcU
Warner Bros. Discovery Earnings Reports Reveals 'Suicide Squad: Kill The Justice League' Caused A 41% Loss In Video Game Revenue,shipgirl_connoisseur,721,2024-08-08 05:09:52,https://boundingintocomics.com/2024/08/08/warner-bros-discovery-earnings-reports-reveals-suicide-squad-kill-the-justice-league-caused-a-41-loss-in-video-game-revenue/
"Why companies """"need"""" to raise the price to $80",Nevek_Green,721,2024-10-21 13:47:55,https://i.redd.it/d3tcxi3e64wd1.jpeg
"IGN Brazil is really mad at their readers: ""Gamer, you don't care about historical accuracy in Assassin's Creed, you just don't want black people and women as your main characters.""",Strange-Editor-9987,715,2024-05-19 03:27:58,https://i.redd.it/x9td3tphya1d1.jpeg
"Senior Writer For 'Assassin's Creed Shadows' Declared: ""There's More Than Enough Games Out There With White Men As The Only Playable Characters. Let's Do Better.""",shipgirl_connoisseur,717,2024-05-16 15:22:28,https://thatparkplace.com/senior-writer-for-assassins-creed-shadows-declared-theres-more-than-enough-games-out-there-with-white-men-as-the-only-playable-characters-lets-do-better/
"New ""White Men"" Discrimination Lawsuit* Hits Disney After Diversity Announcement - Inside the Magic",Independent-Stand,726,2024-02-16 18:43:32,https://insidethemagic.net/2024/02/disney-sued-for-discriminating-against-white-american-men-nk1/
"In 2015, Anita Sarkeesian had $300 million donated to DEI initiatives by Intel, given game creation time + games flopping, I do wonder..",Skadiska,712,2024-09-13 21:26:54,https://i.redd.it/8baoia1d9nod1.png
Mods deleting posts that are critical of Ghost of Yotai,Crafty-Interest1336,733,2024-09-27 11:30:25,https://www.reddit.com/r/KotakuInAction/comments/1fqli7n/mods_deleting_posts_that_are_critical_of_ghost_of/
First is after launch. Second is before launch.,kubinka0505,712,2024-10-31 19:32:26,https://i.redd.it/a8h1kvvy85yd1.png
CD projekt dev was bullied into apologizing for critcizing Assassin's Creed Shadows,Lapinal1,713,2024-05-19 18:34:29,https://www.reddit.com/r/KotakuInAction/comments/1cvuz0t/cd_projekt_dev_was_bullied_into_apologizing_for/
I don’t get the censorship and the ugly ass female characters ,Radiant-Usual-1785,710,2024-02-28 22:28:21,https://www.reddit.com/r/KotakuInAction/comments/1b2jjow/i_dont_get_the_censorship_and_the_ugly_ass_female/
