Title,Author,Score,Created_UTC,URL
"X-Men '97 Lead Character Designer Amelia Vidal Confirms Characters Were Redesigned With ""Body Diversity"" In Mind",CrimsonOmega80,527,2024-03-03 03:17:11,https://thatparkplace.com/x-men-97-lead-character-designer-amelia-vidal-confirms-characters-were-redesigned-with-body-diversity-in-mind/
The First Descendant is proof that attractive characters CAN save a mediocre game,N/A,531,2024-07-22 01:27:57,https://i.redd.it/ddf3vhum2zdd1.png
IGNinNutshell,HKJoe,521,2024-09-03 06:11:29,https://i.redd.it/3mmja50ycjmd1.png
Scandalous CD Projekt Play. Men are worse sorted again.,ChargeProper,522,2024-09-18 18:02:27,https://archive.is/E4rt0
"BBC Refuses To Acknowledge Terrible 'Doctor Who' Ratings, Instead Boasts That Series Is Their ""Top Drama For Under-35s This Year""",Sliver80,517,2024-06-29 06:31:23,https://boundingintocomics.com/2024/06/28/bbc-refuses-to-acknowledge-terrible-doctor-who-ratings-instead-boasts-that-series-is-their-top-drama-for-under-35s-this-year/
Lady's design in Netflix's Devil May Cry animated series revealed,RainbowDildoMonkey,524,2024-10-27 19:23:25,https://i.redd.it/1eyy8dbiicxd1.jpeg
"The Guardian - ""The disturbing online misogyny of Gamergate has returned – if it ever left...""",Argumentium,527,2024-06-19 18:14:22,https://archive.ph/UMRmD
Most of the Best Games of 2024 so far were from asian devs,QForKiwi,524,2024-08-27 01:24:14,https://i.imgur.com/HvfBdqx.jpeg
Rings of Power Just Pissed Everyone Off..,shipgirl_connoisseur,531,2024-08-31 03:47:48,https://m.youtube.com/watch?v=qqyKZWP1BC4
Western Localizer Proudly Brags About Butchering Sentai Filmworks' English Localization Of '2.5 Dimensional Seduction',Sliver80,520,2024-08-06 03:20:13,https://boundingintocomics.com/2024/08/05/western-localizer-proudly-brags-about-butchering-sentai-filmworks-english-localization-of-2-5-dimensional-seduction/
"The War on Japanese Gaming: ""Social media backlash over JRPGs is just the latest manifestation of a long-simmering war aimed at the Japanese gaming industry. One that remains very much alive.""",md1957,520,2024-04-04 14:58:10,https://cmdcph.substack.com/p/the-war-on-japanese-gaming-explaining
Dragon Age: The Veilguard Launch: Indie Titles Are Stealing BioWare's Thunder in 2024,Sliver80,517,2024-11-03 21:45:02,https://x.com/DREZZEDNews/status/1853181215261466758?t=lWdfUgaVlJWbjhJo7MCTOg&s=09
13 Years Of Wait Paid Off In A Single Day As 'Space 'Marine 2' Shatters 'Warhammer 40k' Records,shipgirl_connoisseur,522,2024-09-11 15:43:56,https://boundingintocomics.com/2024/09/11/13-years-of-wait-paid-off-in-a-single-day-as-space-marine-2-shatters-warhammer-40k-records/
'Indiana Jones' Director James Mangold Blames Fans for Dial of Destiny's Failure,Sliver80,520,2024-12-07 22:06:42,https://thatparkplace.com/indiana-jones-director-blames-fans/
Capcom censors erotica photography in Dead Rising Remaster,Jyu_Viole_Grace_S,519,2024-08-09 09:23:23,https://www.reddit.com/r/KotakuInAction/comments/1enval0/capcom_censors_erotica_photography_in_dead_rising/
Nintendo Top Selling Video Games Vs Sony Top Selling Video games,N/A,524,2023-12-29 15:18:23,https://i.redd.it/uzktauio399c1.jpeg
"After Gina Carano Sues The Walt Disney Company And Lucasfilm, Roseanne Barr Says She Wants To Sue Them As Well",jftrent1388,516,2024-02-07 16:23:29,https://thatparkplace.com/after-gina-carano-sues-the-walt-disney-company-and-lucasfilm-roseanne-barr-says-she-wants-to-sue-them-as-well/
Woke Gaming Media Begin Narrative Blitz For Upcoming Sweet Baby Inc. Influenced Game 'Flintlock: Siege Of Dawn',shipgirl_connoisseur,516,2024-06-27 00:28:09,https://thatparkplace.com/woke-gaming-media-begin-narrative-blitz-for-upcoming-sweet-baby-inc-influenced-game-flintlock-siege-of-dawn/
"[Ethics] ""The writer of The Verge Gamergate 2 hit piece openly ADMITTED to having a one-sided agenda, they did NOT want to put an accurate timeline of events into the story, so they could depict Sweet Baby Inc as VICTIMS who didn't harass the Steam curator group!!""",B-VOLLEYBALL-READY,517,2024-03-19 00:21:41,https://twitter.com/lobsterlooker/status/1769859963420082196
"People are flat out lying when they say old movies like Terminator 2 and Alien would be ""woke"" today.",AncientKroak,521,2024-01-07 21:20:34,https://www.reddit.com/r/KotakuInAction/comments/1912wxb/people_are_flat_out_lying_when_they_say_old/
Just over a year after its release Saints Slop is being offered for free by Epic.,dandrixxx,514,2023-12-30 19:10:09,https://i.redd.it/6r3rrblv2h9c1.jpeg
"An actual warning you receive during a Halloween event in RuneScape, followed by a prompt confirming that you’re ok with seeing said spider. Imagine wasting time implementing this as a game company for the five people on earth too terrified to see a digital spider ",ComfortableYak2071,517,2024-10-22 00:18:36,https://i.redd.it/85qprmrwa7wd1.jpeg
"You guys like comparisons, so let's compare the two AAA games ""released"" (one still in Beta) on the same day",Remispaive,515,2024-11-01 09:49:09,https://i.redd.it/xccvqw37h9yd1.jpeg
Exclusive interview with Sweet Baby Inc. detected creator: ‘My community is way more diverse than any one of those outlets’,Equilybrium,520,2024-03-21 17:46:37,https://www.theshortcut.com/p/exclusive-sweet-baby-inc-detected-interview
"Screenrant:""Hera Hammerhand was ognored by Tolkien""",Dramatic-Bison3890,515,2024-11-27 23:41:37,https://i.redd.it/onod5rqw5j3e1.jpeg
"Square Enix Shareholder Presses Company President On Relationship With Sweet Baby Inc., Receives Non-Answer In Return.",gadesabc,512,2024-06-28 08:26:49,https://boundingintocomics.com/2024/06/27/square-enix-shareholder-presses-company-president-on-relationship-with-sweet-baby-inc-receives-non-answer-in-return/
Eurogamer is now running defense for Sweet Baby,TheHat2,518,2024-03-07 18:14:17,https://archive.is/pzU3G
"[SocJus] WizKids gender-swaps character from classic D&D cover image, saying that the character is ""purposefully and clearly"" a woman. The artist, Larry Elmore, says otherwise.",JustOneAmongMany,513,2024-05-09 02:13:48,https://www.reddit.com/r/KotakuInAction/comments/1cnm5y7/socjus_wizkids_genderswaps_character_from_classic/
The effects of having Alyssa Mercunte on your show: A high dislike ratio. RIP Giant Bomb RIP Gamespot,OnTheAccountOf,517,2024-06-22 16:16:17,https://i.redd.it/ua7ukyrde58d1.png
Tomb Raider New Board Game will be about going agaisnt Colonialism,DarkSkyAboveUs,517,2024-04-10 00:58:02,https://i.imgur.com/LDUeTrC.png
"Ubisoft director blames gamers, says they've been exposed as 'non-decent humans'
",QForKiwi,515,2024-10-06 00:13:10,https://www.tweaktown.com/news/100855/ubisoft-director-blames-gamers-says-theyve-been-exposed-as-non-decent-humans/index.html
'Furiosa: A Mad Max Saga's' Box Office Disaster Serves As A Stark Warning For Marvel's 'Captain America: Brave New World' And 'Thunderbolts',shipgirl_connoisseur,515,2024-05-27 15:18:51,https://thatparkplace.com/furiosa-a-mad-max-sagas-box-office-disaster-serves-as-a-stark-warning-for-marvels-captain-america-brave-new-world-and-thunderbolts/
People being racist over Black Myth Wukong being a Chinese game..,Seiros_Acolyte,510,2024-08-20 20:22:37,https://www.reddit.com/r/KotakuInAction/comments/1ex5xyn/people_being_racist_over_black_myth_wukong_being/
"The difficult appreciation of things today, between the main message of ""diversity is a strength"", and left medias that praise a game and says that there is nothing political.",gadesabc,517,2024-10-20 09:55:41,https://i.redd.it/rvox424ivvvd1.jpeg
Marvel Comics Appears To Be Introducing Race-Swapped Black Cat In Upcoming Issue Of 'Ultimate Spider-Man',shipgirl_connoisseur,512,2024-08-10 10:59:11,https://boundingintocomics.com/2024/08/10/marvel-comics-appears-to-be-introducing-race-swapped-black-cat-in-upcoming-issue-of-ultimate-spider-man/
Sweet Baby Inc. Employee Chris Kindred Allegedly Contacts Smash JT's Former Employer To Get Him Fired,Sliver80,513,2024-06-13 17:21:38,https://thatparkplace.com/sweet-baby-inc-employee-chris-kindred-allegedly-contacts-smash-jts-former-employer-to-get-him-fired/
"Microsoft Twitter accounts and Gamepass and just logging into your console are littered with ""pride"". However both Sony and Valve/Steam are refreshingly devoid of left-wing identity politics. If you need an excuse to ditch Xbox, they'll never run out of reasons to give you.",SunnySideUp82,510,2024-06-02 02:01:03,https://i.redd.it/15dyhmfhf24d1.png
WTF happened to Bioware !!!! ,Weekly-Gear7954,509,2024-10-14 13:21:28,https://i.redd.it/ib39pz033qud1.jpeg
An industry leak claiming that Snowbreak and Wukong devs were being reported to censorship boards by feminist competitors was recently confirmed by the Chinese government ,shinigamixbox,508,2024-09-01 20:08:51,https://www.reddit.com/r/KotakuInAction/comments/1f6nsl7/an_industry_leak_claiming_that_snowbreak_and/
"Allegedly Senior Concept Artists for Concord are going through an extremely difficult time, and some might no longer want to work in games or design characters after this",AboveSkies,504,2024-09-06 19:25:23,https://www.reddit.com/r/KotakuInAction/comments/1fanms4/allegedly_senior_concept_artists_for_concord_are/
First look of Bella Ramsey for Season 2 of The Last of Us ,DarkSkyAboveUs,505,2024-05-14 00:20:37,https://i.imgur.com/KZ3CIrA.png
"GDC Pro marxism on top of that, they openly admit how much they hate Japanese games",N/A,512,2024-03-18 01:18:52,https://www.reddit.com/r/KotakuInAction/comments/1bhek9e/gdc_pro_marxism_on_top_of_that_they_openly_admit/
"‘Dune: Part Two’ Director Denis Villeneuve Says Zendaya’s Chani Becomes Film’s Main Character, Admits To Changing Frank Herbert’s Novel Because He Didn’t Think It Was “Proper”",jftrent1388,521,2024-01-31 21:22:07,https://thatparkplace.com/dune-part-two-director-denis-villeneuve-says-zendayas-chani-becomes-films-main-character-admits-to-changing-frank-herberts-novel-because-he-didnt-think-it-was-proper/
The Thaumaturge by the devs. Fool's Theory.,gadesabc,506,2024-03-11 10:30:44,https://i.redd.it/2pregjwlmonc1.png
Ubisoft and Disney are bribing youtubers/influencers to give them good reviews for Star Wars Outlaws,Lapinal1,510,2024-08-05 22:06:43,https://www.reddit.com/r/KotakuInAction/comments/1el0nrw/ubisoft_and_disney_are_bribing/
"Former Marvel Editor-in-Chief Jim Shooter Slams The Current State Of Western Comics: “It’s Supposed To Be Entertainment, But A Lot Of It Comes Out Like Propaganda”",Sliver80,507,2024-07-23 04:59:11,https://boundingintocomics.com/2024/07/23/former-marvel-eic-jim-shooter-slams-the-current-state-of-western-comics-its-supposed-to-be-entertainment-but-a-lot-of-it-comes-out-like-propaganda/
"Japanese historians concluded that while it is unclear whether Yasuke was samurai, in reality, he was a bodyguard and entertainer.",jpuse,508,2024-08-05 10:28:56,https://www.reddit.com/r/KotakuInAction/comments/1ekkex9/japanese_historians_concluded_that_while_it_is/
"Grummz claims he spoke to ex-devs at Compulsion Games and Avalanche Studios, says changes like race-swapping main character for South of Midnight were pushed through and Sweet Baby Inc. was hired after Xbox got involved",AboveSkies,505,2024-03-28 18:40:00,https://www.reddit.com/r/KotakuInAction/comments/1bq33xr/grummz_claims_he_spoke_to_exdevs_at_compulsion/
What happened to muh preferred pronouns? Dragon Age The Veilguard after Taash death,PopularButLonely,501,2024-11-30 17:40:02,https://www.reddit.com/r/KotakuInAction/comments/1h3huos/what_happened_to_muh_preferred_pronouns_dragon/
Assassin's Creed Shadows Reveal Trailer Is Already the Most Disliked in Series History,ZeElessarTelcontar,502,2024-05-20 15:51:54,https://archive.ph/GRttw
"English Localizers Furious Over Japanese Publisher Shogakukan's Decision To Use AI Translations For Light Novels: ""They Don't Care About The Works They're Ruining""",Sliver80,504,2024-08-06 01:26:45,https://boundingintocomics.com/2024/08/05/english-localizers-furious-japanese-publisher-shogakukans-use-of-ai-translations-for-light-novels-they-dont-care-about-the-works-theyre-ruining/
Gender-Swapped 'A Knight's Tale' Sequel Shut Down By Netflix Algorithm,shipgirl_connoisseur,507,2024-04-24 00:39:31,https://thatparkplace.com/gender-swapped-a-knights-tale-sequel-shut-down-by-netflix-algorithm/
God of war ragnarok's steam peak player count is almost 3 times lower than God of war 2018,Gareebonkabatman235,506,2024-09-20 17:03:04,https://i.redd.it/y9iozp1wwzpd1.png
"Ahead Of Game's PC Release, 'Final Fantasy VII Rebirth' Director Asks Modders ""Not To Create Or Install Anything Offensive Or Inappropriate""",shipgirl_connoisseur,500,2024-12-18 04:52:08,https://boundingintocomics.com/uncategorized/ahead-of-games-pc-release-final-fantasy-vii-rebirth-director-asks-modders-not-to-create-or-install-anything-offensive-or-inappropriate/
"OMG Disney Tapes | Disney Director Sohrab Makker: 'No Non-White, Non-Jewish' Hires, Calls CEO 'Corrupt'",H31N5T,514,2024-06-26 01:07:14,https://www.youtube.com/watch?v=9Vofr-cCrRU
Is GTA 6 Woke? DEI Employee Certifications Highlight the Quiet Shift Threatening Rockstar,FirstLine1,502,2024-12-04 17:35:47,https://thatparkplace.com/is-gta-6-woke/
Ghost of Tsushima has been officially delisted in Countries where PSN is locked,valk_1234,503,2024-05-10 17:39:46,https://i.redd.it/wgs4wk89ymzc1.jpeg
"According To An Alleged Ubisoft Insider AC Shadows Initially Had An Asian Male Protagonist + The Next AC Game Is supposed to be ""The Gayest Assassin's Creed Yet""",Fine-Vehicle238,505,2024-09-29 18:06:15,https://www.youtube.com/watch?v=dN4WMQARc_A
Kotaku: Sweet Baby Inc. Doesn’t Do What Some Gamers Think It Does,ape_of_god,508,2024-03-06 18:22:41,https://archive.ph/n8Dm5
The acolyte is even worse than you think it is. (spoilers),Ok_Translator4053,506,2024-06-05 14:07:48,https://www.reddit.com/r/KotakuInAction/comments/1d8qtzf/the_acolyte_is_even_worse_than_you_think_it_is/
Bandai Namco Localization Teams Admit They Order Japanese Devs To Censor Their Female Character Designs,CrimsonOmega80,502,2024-01-27 00:16:18,https://boundingintocomics.com/2024/01/26/bandai-namco-localization-teams-admit-they-order-japanese-video-game-devs-to-censor-their-female-character-designs-we-tell-them-that-the-cleavage-is-a-bit-too-exposed-or-the-skirt-is-a-bit-too-sho/
"For anybody that's saying ""It's just a bit of censorship the game is good"" or ""Shut up stop complaining over some clothes you're overreacting.  ",UnstableJester410,525,2024-04-26 20:04:05,https://www.reddit.com/r/KotakuInAction/comments/1cdv2md/for_anybody_thats_saying_its_just_a_bit_of/
Why AC Shadows is much more Racist than RE5,N/A,502,2024-06-16 07:25:30,https://www.reddit.com/r/KotakuInAction/comments/1dh29zn/why_ac_shadows_is_much_more_racist_than_re5/
"Bob Iger now realizing that Gaming is a thing, wants disney to get back in to it...",TrakssX,500,2024-02-09 10:50:55,https://i.redd.it/j2cyxx13ijhc1.png
Why can't games journalists accept DEI even is an issue at all?,damegawatt,498,2024-10-04 23:50:12,https://www.reddit.com/r/KotakuInAction/comments/1fwdcli/why_cant_games_journalists_accept_dei_even_is_an/
It seems like Valve's new game Deadlock has a character with they/them pronouns. Reminder that Sweet Baby Inc. happens to list Valve as one of its clients. Valve also happens to have acquired activist developers Campo Santo back in 2018,iansanmain,502,2024-05-24 11:56:41,https://i.redd.it/xo3lce915d2d1.png
"Niantic tried to restore the hips of female avatars in Pokémon GO, the result is elephantiosis of the legs.",milotic03,504,2024-05-30 00:30:06,https://i.redd.it/tabqfwupkg3d1.jpeg
"Alleged Leaks For Next Animated 'Avatar' Series Reveals Paraplegic Female Protagonist, Confirmation Of Korra As Most Powerful Bender",Sliver80,498,2024-12-07 18:37:35,https://boundingintocomics.com/tv-shows/tv-show-news/alleged-leaks-for-next-avatar-series-reveals-paraplegic-female-protagonist-confirmation-of-korra-as-most-powerful-bender/
Helldivers 2 will now require PlayStation Accounts ,N/A,501,2024-05-03 06:00:15,https://i.redd.it/8x5wkml2j5yc1.jpeg
Remember when the consequence of your game having boobs and skimpy clothing was a pegi 16 rating and not the entire gaming landscape calling for your game to be censored? Yeah I remember those days,HotPepperSauce69,499,2024-04-27 13:22:32,https://i.redd.it/7shqa3b5w0xc1.png
"""Laura Kate Dale"" reveals to have worked as a consultant for Dragon Age: The Veilguard due to Lead Writer Patrick Weekes",AboveSkies,495,2024-10-30 10:02:24,https://x.com/LaurakBuzz/status/1851404080502964398
Based Blue Archive devs fix bad localization of character interaction,Individual_Ad_4899,498,2024-06-12 04:34:00,https://i.redd.it/r2i9hxe5k26d1.jpeg
"In Apparent Attempt To Avoid Causing Offense, Taika Waititi’s ‘Time Bandits’ TV Remake Will Not Feature Dwarfs",damegawatt,500,2024-05-25 22:41:08,https://boundingintocomics.com/2024/05/24/in-apparent-avoid-offense-taika-waititis-time-bandits-tv-remake-will-not-feature-dwarfs/
The Powell Group Deletes Its Associations With Sweet Baby Inc. From LinkedIn And Its Website,Sliver80,499,2024-11-04 19:18:59,https://thatparkplace.com/the-powell-group-deletes-its-associations-with-sweet-baby-inc-from-linkedin-and-its-website/
"Dozens Of Financial Advisors Warn Corporate America That DEI Initiatives Are A ""Liability"" with the upcoming administration",Equilybrium,495,2024-11-19 18:48:33,https://fandompulse.substack.com/p/dozens-of-financial-advisors-warn
"'Indiana Jones And The Great Circle' To Feature Disclaimer Clarifying That Developer MachineGames' Decision To Use Nazis As Enemies ""Should Not Be In Anyway Construed To Condone, Glorify, Or Endorse"" Their Ideology",Sliver80,498,2024-10-31 02:02:12,https://boundingintocomics.com/video-games/video-game-news/indiana-jones-and-the-great-circle-to-feature-disclaimer-clarifying-that-developer-machinegames-decision-to-use-nazis-as-enemies-should-not-be-in-anyway-construed-to-condone-glorify-or-endor/
"Say what you will about Fortnite or Epic Games, but at least it gives us female characters that are both beautiful and feminine (Even the ""modern"" ones)",N/A,497,2024-08-04 00:14:29,https://i.redd.it/9cmq88a2hjgd1.jpeg
"Ghost of Tsushima 2 revealed by sony ""GHOST OF YOTEI"" Female samurai hunter in old japan hunting men Rambo style but with DUAL swords.",N/A,665,2024-09-24 22:45:14,https://i.redd.it/lymz0jli5uqd1.png
Leaked Obsidian Slack Messages Expose 'Avowed' Developer,shipgirl_connoisseur,494,2024-12-07 18:54:06,https://thatparkplace.com/leaked-obsidian-slack-messages/
"Star Wars Director Sharmeen Obaid-Chinoy Declares ""It's About Time We Had A Woman Come Forward To Shape The Story In A Galaxy Far, Far Away""",CrimsonOmega80,489,2024-01-02 22:09:47,https://thatparkplace.com/star-wars-director-sharmeen-obaid-chinoy-declares-its-about-time-we-had-a-woman-come-forward-to-shape-the-story-in-a-galaxy-far-far-away/
"While some western studios are struggling to keep the lights on, all this JPs devs are making cash with Mai. ",DO4_girls,493,2024-12-07 05:09:54,https://i.redd.it/v5o6wr6t0d5e1.jpeg
Kingdom Come: Deliverance II Official Announce Trailer,AboveSkies,495,2024-04-18 18:20:15,https://www.youtube.com/watch?v=wMZFM6JC47Q
Ubisoft Stock Tanks to 10-Year Low After Lukewarm Star Wars Outlaws Launch,Dr_Dribble991,498,2024-09-04 01:46:47,https://insider-gaming.com/ubisoft-stock-tanks/
Games Workshop CFO Sells Two-Thirds Of Her Shares Amid Growing Warhammer Boycott,shipgirl_connoisseur,493,2024-04-23 15:38:01,https://thatparkplace.com/games-workshop-cfo-sells-two-thirds-of-her-shares-amid-growing-warhammer-boycott/
Ubisoft Admits Faking Japanese History For Assassin's Creed Shadow,Lucky_Chainsaw,498,2024-06-14 04:27:25,https://www.youtube.com/watch?v=bqwitaREyd0
"Ubisoft is deleting The Crew from players' libraries, reminding us we own nothing",ThatGuy1571,495,2024-04-13 00:51:09,https://archive.ph/Etrzf
"Some failed writer posed as a Ubisoft whistleblower in messages to Grummz. Rather than run with the story without doing due diligence, Grummz asks for verification. According to this melt and his woke followers this is a massive own somehow...",SickusBickus,489,2024-06-16 22:16:53,https://i.redd.it/hqvkvxefd07d1.jpeg
"[Drama] Spencer Baculi - ""US Government-Funded Non-Profit 'Take This' Responds To Sweet Baby Inc. Backlash By Calling On Video Game Industry ""To Clearly And Unequivocally Denounce Gamergate""""",B-VOLLEYBALL-READY,495,2024-03-12 10:59:01,https://boundingintocomics.com/2024/03/12/us-government-funded-non-profit-take-this-responds-to-sweet-baby-inc-backlash-by-calling-on-video-game-industry-to-clearly-and-unequivocally-denounce-gamergate/?_thumbnail_id=233967
Saying that removing sexy content doesn't matter because porn exists on the internet is a terrible argument,SkyAdditional4963,490,2024-08-14 03:53:24,https://www.reddit.com/r/KotakuInAction/comments/1errxvl/saying_that_removing_sexy_content_doesnt_matter/
"Kotaku Editor, Alyssa Mercante, E-begging for Multiple Lawsuits",PolishTamales,490,2024-08-21 17:26:16,https://x.com/MasteroftheTDS/status/1826269987113492790
Dragon Quest creator isn’t happy with censorship in Dragon Quest III HD-2D Remake,TheEternalGazed,490,2024-09-30 09:41:17,https://nichegamer.com/dq-creator-unhappy-dragon-quest-iii-hd-2d-remake-censorship/
Gamers Begin Cancelling PlayStation Network Subscriptions To Free 'Stellar Blade' From Censorship,shipgirl_connoisseur,489,2024-04-28 01:35:02,https://thatparkplace.com/gamers-begin-cancelling-playstation-network-subscriptions-to-free-stellar-blade-from-censorship/
Layoffs at Kotaku,Lhasadog,487,2024-11-07 18:13:25,https://www.reddit.com/r/KotakuInAction/comments/1glx0a5/layoffs_at_kotaku/
IGN already interrogating Warhorse about diversity in KcD2.,Nokoo44,498,2024-04-18 20:00:25,https://www.reddit.com/r/KotakuInAction/comments/1c7cyq9/ign_already_interrogating_warhorse_about/
Pokemon Go fans livid as avatar update “nerfed” women,CigaretteSmokingDog,487,2024-03-26 21:55:01,https://archive.is/KwORQ
"Amazon-bought ""Tolkien Professor"" continues his gaslighting campaign insisting there is ""no Tolkien Canon""",esmeros,488,2024-10-26 05:29:11,https://youtu.be/R5zluV_XrZg?si=JGj-13YHDIpU8x5t
Yasuke’s Japanese intro changed from liberating Japan from oppressors to fighting those plotting behind. Why UBI? I wonder.,kimisawa1,492,2024-05-22 13:25:29,https://i.redd.it/zte6x2xtbz1d1.jpeg
Japanese YouTuber Discovers Ubisoft Is Hiring Native Japanese Localization Tester In China,shipgirl_connoisseur,487,2024-10-03 15:20:08,https://thatparkplace.com/japanese-youtuber-discovers-ubisoft-is-hiring-native-japanese-localization-tester-in-china/
"‘Stellar Blade’ Director Rejects Microtransactions, Promises Game “Will Not Require Players To Spend Any Additional Money Beyond What They Paid For The Package”",shipgirl_connoisseur,484,2024-04-05 10:53:40,https://boundingintocomics.com/2024/04/05/stellar-blade-director-rejects-microtransactions-promises-game-will-not-require-players-to-spend-any-additional-money-beyond-what-they-paid-for-the-package/
"I guess women aren't allowed to wear thongs in the world of Dragon's Dogma 2. Funny, because in the first game G-strings were 'customary attire'.",doomraiderZ,488,2024-03-23 23:49:18,https://i.redd.it/nj7z0eq486qc1.jpeg
"'Halo' Star Pablo Schreiber Continues To Defend Series' Decision To Regularly Show Master Chief's Face: ""If You Don’t Agree With The Helmet Coming Off In The Show, You Don’t Like Our Show""",CrimsonOmega80,491,2024-01-24 18:42:14,https://boundingintocomics.com/2024/01/24/halo-star-pablo-schreiber-continues-to-defend-series-decision-to-regularly-show-master-chiefs-face-if-you-dont-agree-with-the-helmet-coming-off-in-the-show-you-dont-like/
"Actor Matt Smith Bemoans ""Policing"" of Stories Through Trigger Warnings",voidcracked,479,2024-09-02 21:15:22,https://deadline.com/2024/09/matt-smith-bemoans-policing-through-trigger-warnings-house-of-the-dragon-1236075566/
Krabutus seems to be working on a website to track down consultants,DarkSkyAboveUs,485,2024-03-07 22:33:09,https://i.redd.it/dhq9cby5ozmc1.jpeg
"Electronic Arts CEO Confirms Company Actively Working To Put Advertisements ""Inside Our Game Experiences""",shipgirl_connoisseur,488,2024-05-10 01:46:40,https://boundingintocomics.com/2024/05/09/electronic-arts-ceo-confirms-company-actively-working-to-put-advertisements-inside-our-game-experiences/
Rolling Stone ‘Stellar Blade’ Review: A Teenage Boy’s Idea of the Perfect Video Game,AboveSkies,480,2024-04-24 16:55:26,https://archive.is/qFf70
"[PCGamer] - ""Warhammer 40,000 has slightly more women in it now and the neckbeards aren't happy""",DrJester,492,2024-04-19 17:06:24,https://archive.ph/IAeXw
"Warner Bros. Discovery Chief DEI Officer Endorses Discriminating Against Employees Who Disagree With DEI Ideology: ""They'll Leave Themselves, Which Is Great",Natural-March8839,484,2024-03-08 00:52:12,https://boundingintocomics.com/2024/03/07/warner-bros-discovery-chief-dei-officer-endorses-discriminating-against-employees-who-disagree-with-dei-ideology-theyll-leave-themselves-which-is-great/
Dragon Age The Veilguard is on sale for 35% off just 40 days after release,PopularButLonely,482,2024-12-12 01:12:40,https://www.reddit.com/r/KotakuInAction/comments/1hc9ghi/dragon_age_the_veilguard_is_on_sale_for_35_off/
Helldivers 2 has been PurchaseRestricted on Steam from 177 countries,AboveSkies,480,2024-05-05 00:56:05,https://steamdb.info/sub/137730/history/?changeid=23416542
Neil Gaiman Appearance Canceled in Wake of Sexual Assault Allegations,Own_Dig2105,481,2024-07-24 10:59:29,https://bleedingfool.com/blogs/neil-gaiman-appearance-canceled-in-wake-of-sexual-assault-allegations/
Gina Carano BEATS Disney (Huge Courtroom Victory),RoryTate,480,2024-07-25 14:18:20,https://youtu.be/cLUl_W_Eom0
I don't see much hope for this.,HulkPower,480,2024-11-04 05:20:11,https://i.redd.it/kzure9djktyd1.jpeg
