Title,Author,Score,Created_UTC,URL
guys I think this game is too OP,send-me-kitty-pics,1494,2024-10-07 18:37:13,https://i.redd.it/mqml4cp3pdtd1.png
There's no way 😭,Linothepro,1496,2024-11-22 20:20:32,https://i.redd.it/mbdu5hwkhi2e1.jpeg
Average light thought process,Additional-Berry-946,1541,2023-12-28 21:56:02,https://i.redd.it/1ok05evtx39c1.jpeg
The tag on my Ospuze T-shirt,jxxnvs,1503,2024-08-20 11:18:13,https://i.redd.it/onheurm5zsjd1.jpeg
Your daily reminder to PTFO,Nate2247,1502,2024-03-17 16:33:42,https://i.redd.it/ugibvew89xoc1.jpeg
I may have captured the coolest cinematic ending ever. ,Bolinghouse,1485,2024-06-07 20:39:12,https://v.redd.it/wss3lc7sn75d1
Should the R .357 revolver have a finger gun skin?,BluKir0,1490,2024-03-24 13:45:17,https://i.redd.it/pb0bkewmcaqc1.png
The new free set in all its glory.,MasterAenox,1493,2024-01-31 15:25:16,https://www.reddit.com/gallery/1afkcin
I gooed to hard ,TwoNutsInASalad,1474,2024-11-09 23:29:31,https://v.redd.it/v5mb7g7gnyzd1
"""Welcome to Kyo-""",4everdrowninginpools,1475,2024-12-22 07:09:20,https://i.redd.it/m4c1aa1pnc8e1.jpeg
Please let me equip watches and gloves together its literally on the promo art ,Animator_Gas_Mask,1465,2024-09-27 14:53:12,https://i.redd.it/duvlnvn58drd1.jpeg
"The ""Nuke C4"" throwing distance in Patch 1.5.0 update",Arrench_numb2,1505,2024-01-17 17:21:44,https://v.redd.it/0cgjmp5pa1dc1
This sub lately ,SabsWithR,1496,2024-03-28 08:52:03,https://i.redd.it/4ovnh1swg1rc1.jpeg
I’m glad we’re known as a “Really Passionate” community XD,Free_Jelly614,1480,2024-06-10 17:03:49,https://v.redd.it/5tpoa1u20s5d1
Are you serious?,ItzMeloDeath,1490,2024-03-28 02:01:10,https://i.redd.it/pbof3isjfzqc1.png
What's your favorite Arena Throwable?,shadowslasher11X,1466,2024-09-30 04:47:58,https://i.redd.it/6jeofqwrmvrd1.png
Absolutely Based Announcer ,Dv6_KEK,1454,2024-11-29 09:40:23,https://i.redd.it/o5yyo2xr9t3e1.jpeg
The Finals is being betrayed,Hamerine,1489,2024-06-11 21:43:36,https://www.reddit.com/r/thefinals/comments/1ddq18p/the_finals_is_being_betrayed/
Can We Like Patch This Or Something Bro?,Endless_Aspire,1459,2024-03-07 21:22:13,https://i.redd.it/f7e1c39ibzmc1.jpeg
PSA: The backpack game is playable,typothetical,1453,2024-07-03 14:27:14,https://v.redd.it/plmh6mm4dbad1
I'm tired of pretending that these cosmetics don't obliterate other games.,1DoobieDoo,1467,2024-06-14 17:57:36,https://www.reddit.com/gallery/1dfx02o
“RPG” 165 < 150 < 140 and now only 100 damage 😅🤣,Lovleybullet,1722,2024-09-23 18:49:43,https://i.redd.it/84a0qnkpulqd1.jpeg
How are we feeling about this?,Vinod_cr7,1794,2024-08-21 16:55:54,https://i.redd.it/rl2ru4abs1kd1.gif
OH MY GOD... This is the moment I rank up to Emerald. MY HEART BEATS INSANELY FAST OMG WHAT A MOMENT,oguzcanbilirdonmez,1458,2024-09-06 02:21:27,https://v.redd.it/yxwzk0kqm3nd1
This is how powerful Light can be when you can hit headshots.,N/A,1469,2024-02-03 16:28:29,https://v.redd.it/hv5kzj40degc1
Found a way to use cannons,Dae_Dude,1444,2024-09-19 13:45:42,https://v.redd.it/d5g4prhlsrpd1
So apparently you can charge while stealing.. And it is indeed still lethal.,StaringAtPlants,1443,2023-12-30 16:50:04,https://v.redd.it/pcs2ryiuog9c1
ı hate this gun,Baba4nneGurmesi,1467,2024-09-30 16:14:07,https://i.redd.it/uz3q9dz71zrd1.png
my friend made a meme in our discord and i thought you need to check it out,ENDRAER,1444,2024-07-29 22:25:26,https://i.redd.it/d2ykua55ajfd1.png
"A couple days ago I asked this sub what your dream map locations would be, here are your WORST suggestions",Tommys_Mom,1442,2024-02-07 20:05:37,https://www.reddit.com/gallery/1alc7hq
The wich is actually crazy lmao,Geomerty26,1438,2024-06-14 05:41:11,https://v.redd.it/40g6nzt81h6d1
The Halloween duck shows embark truly cares,frontpageroadrage,1433,2024-11-02 09:52:55,https://i.redd.it/l010txdengyd1.jpeg
What if Scotty and June were unhinged?,N/A,1439,2024-06-02 15:40:39,https://v.redd.it/7vjxchdgh64d1
They reconnected...,InferiorLynxi_,1420,2024-11-08 06:17:36,https://v.redd.it/0tgo32seemzd1
The amount of time I died because it won't let me in is hilarious,Vinod_cr7,1439,2024-10-16 13:53:42,https://i.redd.it/6pllowyui4vd1.jpeg
"This game is practically begging for a ""Gun Game"" mode.",bajungadustin,1438,2024-01-01 12:29:54,https://www.reddit.com/r/thefinals/comments/18vvtys/this_game_is_practically_begging_for_a_gun_game/
Girlfriend got me the cashbox for my birthday. ,Opening-Message-9712,1423,2024-07-26 07:24:28,https://i.redd.it/aw3bohvneted1.jpeg
So chill didn't even rage,West-Bit1634,1416,2024-10-10 14:12:53,https://i.redd.it/07tsh47tsxtd1.gif
What if Tokyo Square?,Ok_Physics4681,1422,2024-03-02 19:57:45,https://www.reddit.com/gallery/1b4x51y
"Ohh, flavorful daily contract on 9/11.",Calls_u_out,1412,2024-09-12 04:06:13,https://i.redd.it/5kkbux42zaod1.jpeg
The Palworld Dev response to articles about losing playerbase applies 100% to our community,itsmahveltime,1431,2024-02-15 21:02:26,https://i.redd.it/wynfzo2ictic1.png
"If you are a fan of the 1887, try investing in a square crosshair",NIGHTFURY-21,1413,2024-08-23 15:05:19,https://v.redd.it/07ulbz5cifkd1
How often do you die like this,Helpful_Tiger2077,1416,2024-07-27 17:27:50,https://i.redd.it/c591u7b8j3fd1.png
I channeled my anger into making this.,xLotusThunder18,1419,2024-12-20 13:10:27,https://i.redd.it/kjf0npde608e1.jpeg
To the win 1 tournament complainers,Samuel_T01,1425,2024-04-10 10:29:07,https://i.redd.it/p4oqd6mwpmtc1.jpeg
Somehow clawed back a victory after all my teammates had given up.,TheTurkeySandvich,1412,2024-12-07 02:42:35,https://v.redd.it/ytwi432cac5e1
thanks game very cool 🫠,averagesophie,1408,2024-07-03 09:07:23,https://v.redd.it/sil6h2szr9ad1
"Medium Places ""Worst Zipline Ever"", Asked to Leave the Shock & Awe",DrBahlls,1402,2024-11-26 01:51:06,https://i.redd.it/tvgmfyv8j53e1.png
"I cannot defeat ""GeneralGoo""",SavageHorror,1402,2024-07-19 03:47:32,https://v.redd.it/rwc7nb17dedd1
So much for attracting new players Embark...,XxMooNxX7,1410,2024-06-13 20:55:42,https://www.reddit.com/r/thefinals/comments/1df9hsn/so_much_for_attracting_new_players_embark/
"Damien Vossler, CEO of DISSUN",jxxnvs,1403,2024-12-09 15:06:54,https://i.redd.it/6xsnmy529u5e1.jpeg
Weapon ideas for Heavy,reddit_bot21,1408,2024-11-03 20:32:06,https://www.reddit.com/gallery/1giwhc2
"So, why i am alone?",We12haupt,1403,2024-11-19 21:45:11,https://i.redd.it/x9zo2ozyhx1e1.jpeg
"no job, no kids, tough grind but worth it imo",v4ffel,1398,2024-12-08 11:31:50,https://i.redd.it/g5l8dpks1m5e1.png
New jump pad trick nearly killed my whole team then killed an entire team after us...,N/A,1406,2024-01-06 20:40:41,https://v.redd.it/y6jqfk8lsvac1
When you realize you don't know the layout of the new map,helloflitty,1405,2024-03-18 17:35:22,https://i.redd.it/xrmz5c2xo4pc1.gif
Vehicles in The Finals!?,Subject_Commercial96,1403,2024-02-12 09:31:18,https://v.redd.it/lj20oruji4ic1
"I present to you the: ""I'm getting kind of bored of ranked. These guys try way too hard. Lets play quick cash.""",gvm11100,1402,2024-02-09 20:04:29,https://i.redd.it/pjxmr5rc8mhc1.jpeg
they're called the bias wreckers for a reason,maxatnasa,1394,2024-09-28 22:24:52,https://i.redd.it/hqf8t17ilmrd1.png
Watchmojo's top 10 worst experiences,bag_o_fetuses,1400,2024-06-28 13:14:22,https://i.redd.it/dmph5lzgbb9d1.jpeg
"They burned down my defenses, so I let my defenses burn them",Erhixon8,1392,2024-01-21 03:44:50,https://v.redd.it/p3g80ddsspdc1
Shout out to this guy I just queued up with,tyinro,1396,2024-04-22 17:57:43,https://i.redd.it/4u2ia4frk2wc1.jpeg
Can’t make this up,alevandrov,1392,2024-06-03 02:07:30,https://v.redd.it/3awom2jsl94d1
This is how you get the highest cashout possible,Odd-Ad-8197,1395,2024-04-02 08:00:21,https://v.redd.it/ltykcdetv0sc1
The said it couldn’t be done,Hot_Clock217,1386,2024-03-06 13:18:08,https://i.redd.it/hyb4igvbspmc1.jpeg
And they say goo gun is useless,Scared-Tangelo-1771,1386,2023-12-29 11:48:25,https://v.redd.it/jy7hi88q089c1
loving the halloween update so far,jimmyshill69,1382,2024-10-25 01:15:13,https://v.redd.it/cq2b37wpzswd1
"We triggered the Dolphin Charm!! The redemption code is: 913aeef8-023d-41fd-8993-f114a8f915d7 I'll put everything in a video, but you can now trigger the dolphins on the sunset variation of SYS$HORIZON and the code appears on a block near the dolphins. Well done to all the easter egg hunters!",RockhoundBlack,1389,2024-09-05 00:09:37,https://i.redd.it/g1wozeh2uvmd1.jpeg
I DIDN'T KNOW THIS WAS POSSIBLE! Grappling an Arrow,DmpWolFix,1379,2024-11-06 20:30:16,https://i.redd.it/wnc22pzjcczd1.gif
98 Days Left. Am I Cooked?,SoVeryConfucius,1382,2024-12-13 01:57:16,https://i.redd.it/6xcnv8wwvi6e1.jpeg
"Not to copy that other guy but woah, the map really is accurate.",Iridilum,1361,2024-07-24 14:21:45,https://www.reddit.com/gallery/1eb2p5c
The Winch-Claw Experience™,gamefreako,1373,2024-12-06 11:32:55,https://www.reddit.com/gallery/1h7zcxg
point just decided to leave i guess ☠️,0ltermann1,1359,2023-12-31 14:28:56,https://v.redd.it/m3yne8cs4n9c1
IDK how I got away with this revive...,Soreloser1,1362,2024-09-10 03:38:48,https://v.redd.it/5ieqaik8kwnd1
this is how i play the heavy class:,scoopyw,1384,2024-07-10 12:29:46,https://v.redd.it/fp7r97kiqobd1
I just created this today😂 Let me know what you think!,FinalsBestPlays,1353,2024-01-10 19:50:06,https://v.redd.it/4z0wmpw13obc1
New VAIIYA background goes hard 🔥,Tauros2481,1352,2024-12-12 13:41:39,https://i.redd.it/m56ok96o8f6e1.jpeg
New suspended structures look INSANE,Strange_Copy7952,1352,2024-12-09 23:51:40,https://www.reddit.com/gallery/1hao6l9
"After showing Dual Blade clips I’ve been challenged to show full plays to see how the round really goes, here ya go!",ChaseTacos,1367,2024-12-19 00:03:15,https://v.redd.it/mk3j7a0s4p7e1
How it feels to be the only one on the platform as heavy ,Faelzor,1358,2024-11-14 14:42:24,https://i.redd.it/20w0h6kzpv0e1.jpeg
"So now, that the Model has been nerfed, the game is perfectly balanced right? You guys are not gonna complain about a different weapon in a few days time… right?!",Delicious_Option4914,1577,2024-10-30 12:50:10,https://i.redd.it/6kq3z9ea4wxd1.jpeg
Take recon out and give mediums the portal gun,recallingmemories,1348,2024-02-09 02:10:02,https://i.redd.it/qs0tw1zcxghc1.png
Ig there’s vehicles in the game now ,Nothingbutpain1400,1355,2024-06-27 03:47:37,https://v.redd.it/kaw8epkid19d1
POP. POUR. PERFORM. with the Custom OSPUZE Grenade Launcher!,D3MON1C_WOLF_,1338,2024-10-29 00:38:24,https://www.reddit.com/gallery/1gei13s
Opened a post and got the perfect ad,ReffiComics,1331,2024-09-26 00:23:42,https://i.redd.it/17lhy65zr1rd1.jpeg
"season 4 has barely even started yet and im already having way more fun than i did in season 3, i will love this game for as long as i am alive",TaintedEdenGaming,1346,2024-09-26 13:14:48,https://v.redd.it/53j625lel5rd1
It felt alot longer then it was but its over.,CrystalFriend,1346,2024-02-01 05:37:04,https://i.redd.it/2kgwpze2vwfc1.png
How the Sponsor Showdown is going:,Broccoli_dicks,1331,2024-12-02 17:36:24,https://i.redd.it/exj6zesf1h4e1.jpeg
I'm bad at the game OK?? ,JaqueLeKappa,1323,2024-10-23 07:15:03,https://i.redd.it/i2f5j2c4igwd1.jpeg
Terminal Attack no longer a requirement for new players,vaughnegut,1328,2024-06-18 11:46:12,https://imgur.com/FJ09KMK
I'm just gonna say it,FormalShark,1330,2024-03-17 18:56:42,https://i.redd.it/35ytrferyxoc1.jpeg
Follow the glitter ,AGLORIOUST90,1327,2024-11-21 21:02:56,https://i.redd.it/rg5zcqj0kb2e1.jpeg
goobrained,Secret_Mink,1323,2023-12-30 23:40:50,https://i.redd.it/2o9lrtd8qi9c1.png
Seems insane but you never know.,Mayonnaise06,1324,2024-09-05 10:48:00,https://i.redd.it/j9lo9e990zmd1.png
The invis light when I'm about to steal:,cloudboyistrash,1311,2024-12-09 21:27:27,https://v.redd.it/xia089if2w5e1
As it always was,Jakel_07Svk,1343,2024-10-03 06:51:23,https://i.redd.it/daf7js3onhsd1.jpeg
Introducing Season 5 — THE FINALS,Black-_-Phoenix,1386,2024-12-03 16:06:54,https://www.reachthefinals.com/patchnotes/s5teaser
"Horrors of The Finals #23 - being smashed by 200cm, 120 kilo, Engimo fan with room temperature IQ",ENDRAER,1314,2024-11-23 19:07:23,https://v.redd.it/9uoyzkd89p2e1
Time to buy a lotto ticket,azureking32123,1312,2024-01-03 13:29:32,https://v.redd.it/zgp3dv8u88ac1
the riot shield is perfect the way it is,noggfeller,1323,2024-10-14 10:28:12,https://v.redd.it/ogrqdwed8pud1
Instant karma is crazy,PendrickLamar78,1309,2024-12-23 03:40:54,https://v.redd.it/1gbtjg3gri8e1
So when is the next ban wave?,Dae_Dude,1321,2024-04-04 18:05:14,https://i.redd.it/1z2t5num5isc1.png
HE HAD ONE JOB 🤦‍♂️,Z-Mitico,1313,2024-01-05 16:56:05,https://v.redd.it/zntzmb1kjnac1
Craziest thing ive seen in this game XD (obviously unintentional),New-Adeptness-6497,1303,2024-09-23 22:13:36,https://v.redd.it/x3pytgizumqd1
I knew my teammate jumping into a dome shield with two heavies was a bad idea but I didn’t expect this 💀 the hell happened in there,N/A,1303,2024-02-01 20:17:05,https://v.redd.it/ljmmzf9z71gc1
shoutout to my fellow students,Grammy-Norma-ASMR,1297,2024-12-11 17:35:15,https://i.redd.it/abbi9otf996e1.jpeg
I sent him flying to his own death🤣,Any_Lion626,1294,2024-07-07 19:47:51,https://v.redd.it/f1mk2f2zh5bd1
'Free' exclusive skins coming to PS,turbobuddah,1301,2024-02-28 16:57:37,https://i.redd.it/ns55c2j3xclc1.jpeg
Oscar announces that Cashout will be ranked in Season 4!,Raid36,1303,2024-09-04 17:15:23,https://v.redd.it/kezqmcnhstmd1
New unskippable emote just dropped,SwaggotR,1276,2024-12-08 15:51:17,https://v.redd.it/7jg20gv4cn5e1
Has anyone had their cashout building just launched into orbit like this? LOL,solar-jutsu,1284,2024-09-13 17:02:00,https://v.redd.it/ay193cs6ylod1
".. I mean it's pretty obvious we need this now, right? ",Winternatten,1273,2024-09-13 08:21:48,https://i.redd.it/a9l3qcfjdjod1.jpeg
I don't think I'd be able to get it stuck like that again if I tried,CactuSauna,1270,2024-10-03 21:46:04,https://v.redd.it/o4xoull93msd1
4 man squads for season 2???,CALL_ME_JIG,1278,2024-03-04 22:16:38,https://i.redd.it/wvodfyuk6emc1.jpeg
Beards are coming! Discord leak,Powerful-Setting2494,1280,2024-07-25 13:29:38,https://v.redd.it/p4sg37cv2oed1
This is me right now,Seobjevo,1271,2024-04-18 11:42:03,https://i.redd.it/8231644968vc1.png
The new update is insane,ImSimplySuperior,1268,2024-11-09 08:33:14,https://i.redd.it/2pywn6wi7uzd1.png
"I Have 300 hours and hit the top 500, Here is what i learn so far,",ttvimShinyatheninja,1267,2024-01-12 13:43:25,https://www.reddit.com/r/thefinals/comments/194vd9u/i_have_300_hours_and_hit_the_top_500_here_is_what/
Thefinals.jpeg,Curott,1267,2024-01-15 17:38:22,https://i.redd.it/h7og60k64ncc1.png
This is what happens if you grab the vault midair while grappled to it,Odd-Ad-8197,1259,2024-01-07 22:44:38,https://v.redd.it/k1wnre9lj3bc1
Iseul-T car is designed in NFS Heat,Delicious_Option4914,1259,2024-11-26 10:45:23,https://www.reddit.com/gallery/1h090zt
When I get paired with another medium not running defibrillators.,King_Kahn_,1269,2024-01-21 19:59:22,https://i.redd.it/rua1bd9wmudc1.jpeg
Idea for new medium class weapon. I really like SMG but I hate playing light class.,gxsiv,1262,2024-07-26 12:17:41,https://i.redd.it/6i2pqz6nsued1.jpeg
Goo gun brain THINK FAST,Scarmellow,1259,2024-03-05 13:21:23,https://v.redd.it/aw457qqynimc1
Don't forget what we used to call them,adoormarkedprivate,1261,2024-10-07 19:15:35,https://i.redd.it/l50896qrvdtd1.jpeg
Saw this review on Xbox,Odd_Motor3734,1254,2024-11-19 16:38:53,https://i.redd.it/soj3lcrbzv1e1.jpeg
New meta: closing the door,DLXII,1245,2024-04-17 16:58:27,https://v.redd.it/zeq7coq9i2vc1
I was wondering if it was a bug lol,UnpaidLandlord_9669,1252,2024-12-16 07:47:54,https://v.redd.it/oaxx9br6167e1
"Chrome Zone, yes or yes?",frontpageroadrage,1250,2024-10-11 20:55:02,https://i.redd.it/nyr55r4hx6ud1.jpeg
Music Player intcoduced in S5 sucks. So I made everything about it better!,vertopolkaLF,1249,2024-12-18 04:33:00,https://www.reddit.com/gallery/1hgtu1r
lights punching the air,Alarming_Nobody4803,1277,2024-01-21 07:09:51,https://i.redd.it/09amjoqltqdc1.jpeg
Hey.. You okay buddy?,Nesquikill,1252,2024-03-22 09:40:53,https://i.redd.it/j8rgpum5wupc1.png
I’ll just leave this here ,bunkyhd,1242,2024-12-15 22:43:50,https://i.redd.it/jmncklk4c37e1.jpeg
Wife designed this hoodie and it could pass as some official merch (there will be no reprints) ,AdorableParty8849,1241,2024-12-20 22:36:31,https://www.reddit.com/gallery/1hivoaw
"""Deal X damage from X range or more"" challenges are the worst thing that has ever happened to this game",NEZisAnIdiot,1252,2024-05-10 09:53:19,https://i.redd.it/w7czjkfvmkzc1.png
This sub in a nutshell ,Competitive-Art,1238,2024-11-29 14:19:47,https://i.redd.it/kiywf2jmnu3e1.jpeg
Light POV in Season 5,Starbi,1237,2024-12-03 16:43:12,https://i.redd.it/iuyn58lqwn4e1.gif
Umm Embark I don't think that's how it's supposed to work,Classic_Furry_Trash,1241,2024-11-01 18:45:16,https://v.redd.it/wyt6cq8f5cyd1
Lost so many times because of this,meirlislife,1237,2024-11-30 21:08:01,https://i.redd.it/rmmwykddt34e1.jpeg
New skin set: Skill Issue - Earn via discord event,Adminisitrator,1242,2024-04-02 17:01:38,https://i.redd.it/4o4z7rbok3sc1.png
We need a set of comically wrong weapon skins,Kalter_Keks,1237,2024-11-15 14:37:52,https://i.redd.it/zi47qm43u21e1.jpeg
"Embark, can we pretty please use 5,000 VRS to buy a ticket??",frontpageroadrage,1240,2024-11-05 21:26:36,https://i.redd.it/1fo2qcbwh5zd1.jpeg
Improvise. Adapt . Overcome. ,dflex15,1237,2024-12-16 16:50:36,https://i.redd.it/lr02zdx0q87e1.jpeg
Can't Believe I Headshotted This,TruceBrian,1232,2024-09-11 14:50:33,https://v.redd.it/knhiqb5y07od1
Me and my homies hate the overdogs,Redimrr,1237,2024-01-09 17:33:39,https://i.redd.it/7dld04fy9gbc1.jpeg
My buddies went to Sweden and found the studio ,beastierbeast,1225,2024-06-04 13:16:36,https://i.redd.it/v8vs6wg32k4d1.png
*hype* first e1 in the world (yes i have no life),VonSteu,1230,2024-10-01 03:07:21,https://i.redd.it/8hd7gggs92sd1.png
Season 2 trailer is #4 on Trending!,PrstNekit,1231,2024-03-12 11:08:01,https://i.redd.it/tu69epkiyvnc1.png
"So, can someone explain to me what is going on with the spawns lately?",username_put-in,1231,2024-03-04 15:45:03,https://v.redd.it/vmsyv15p8cmc1
Doug Dissun Owner of the Dissun Dissudome,Adventurous_Honey902,1224,2024-12-13 14:54:57,https://i.redd.it/dqv5xetnqm6e1.jpeg
New Gadget Idea: Materialization Grenade! (Structural Damage Repair) ,Xetotorian,1225,2024-08-15 02:36:11,https://i.redd.it/e8maruygpqid1.png
Finals Season 2 Trailer ,PlayTed,1221,2024-03-11 16:03:49,https://youtu.be/hVdKBnmvOLE?si=DlapSf-GkrlI2skZ
"Is it just me, or is the Data reshaper more of a random cool concept than something actually useful? ",ShadeVex,1235,2024-03-26 14:13:01,https://i.redd.it/b4k1kxqcsoqc1.jpeg
How's your guys' experience with the wheel been so far?,Pyrouge1,1214,2024-11-01 00:58:32,https://i.redd.it/umlfr5z4v6yd1.png
i hit my peak already it's over,Academic-Hand6134,1218,2024-01-20 23:38:29,https://v.redd.it/2kcpdrjlkodc1
Check your e-mails for a 1st Anniversary Tee code!,Time_Finger_5426,1217,2024-12-12 12:28:47,https://i.redd.it/jbdtbxskve6e1.png
They should remove this limit or put something new on store,Fly1ng_nem0,1217,2024-01-08 18:08:03,https://i.redd.it/8mnwvx96b9bc1.jpeg
SERIOUS PSA: It's been reported that EAC games (i.e. The Finals) may have a vulnerability allowing hackers to run Remotely Executed Code on your computer (bricking your PC and/or risking personal data and passwords) - Stop playing any EAC games until more is known.,_SaucepanMan,1215,2024-03-18 12:01:40,https://twitter.com/AntiCheatPD/status/1769532511057584576
"I don't mean to get political, but... ",JaqueLeKappa,1212,2024-10-22 04:54:10,https://i.redd.it/hjtyhar2o8wd1.jpeg
These new Holtow skins are pretty epic,Phoenix-909,1210,2024-11-06 10:49:19,https://i.redd.it/4iy0mpw3h9zd1.jpeg
The Finals Weapons Tier List. Hit Diamond a couple of weeks ago using all three classes. This is all just my own opinion. (Ordered in each category HML),fallout1541,1215,2024-02-19 23:52:20,https://i.redd.it/tbjinpvgqmjc1.png
Nobody:                                                              The Finals player:,Xipeng_,1211,2024-05-11 12:18:32,https://i.redd.it/m5u6cq0vhszc1.jpeg
Hot take: defib should revive all classes to 100hp,sguepuz,1208,2024-05-12 23:25:29,https://www.reddit.com/r/thefinals/comments/1cql25q/hot_take_defib_should_revive_all_classes_to_100hp/
Hating is overrated,chicozana,1212,2024-06-19 22:10:49,https://v.redd.it/nubj7jb2rl7d1
"EMBARK!! quick, you gotta revert the change making people play 5 matches of terminal attack before quick cash. You will lose all the players gotten from twitch rivals and ads.",Striking_Scholar8465,1199,2024-06-17 18:37:34,https://www.reddit.com/r/thefinals/comments/1di5es5/embark_quick_you_gotta_revert_the_change_making/
You have my thanks…,reallyrehan,1195,2024-10-15 22:53:40,https://i.redd.it/qbj1t9da20vd1.jpeg
This is what 550 hours of playtime looks like.,HEzGodly,1191,2023-12-31 00:38:19,https://v.redd.it/lsfy8hplzi9c1
Embark is stepping up their content game!,Old-Ad885,1202,2024-09-14 03:01:13,https://v.redd.it/g7pjg43axood1
U got new mic? Nice,DaggerJKS,1198,2024-08-16 23:30:42,https://v.redd.it/8vp2pmzt14jd1
in the finals culture that is considered a dick move,Maroonpirate,1199,2024-11-08 11:44:19,https://i.redd.it/p6zsrywq0ozd1.jpeg
you can destroy walls with pretty much any weapon,Lofus1989,1201,2023-12-29 03:39:06,https://v.redd.it/ou21aikym59c1
Schadenfreude Iseul-T,shadowslasher11X,1188,2024-11-07 11:39:43,https://i.redd.it/louwolpqugzd1.png
"[Concept art] Some RPGs ideas, because I can.",SulfurousDragon,1187,2024-08-20 13:59:36,https://i.redd.it/3shj146xrtjd1.png
Gggrrrrraaaaahhhhhh!!!!,Chaoslava,1191,2024-05-09 13:43:44,https://i.redd.it/z7v9zsk8nezc1.jpeg
My best throw yet. ,ErosHD,1184,2024-06-20 15:18:11,https://v.redd.it/ffjl8yw1uq7d1
Revert the font changes asap and bring back the death tracker ,New_Bad_1504,1179,2024-07-14 18:06:21,https://www.reddit.com/gallery/1e38sww
Gotta love Cod players that are allergic to the objective.,Broccoli_dicks,1183,2024-12-11 15:54:04,https://i.redd.it/liemarwdr86e1.jpeg
Me after seeing another update with no revolver buff ,GodzillasScrotum,1184,2024-10-10 14:29:27,https://i.redd.it/boqj4itrvxtd1.jpeg
I see you u/dudaladen and raise you this,MrTsfree,1178,2023-12-26 20:19:28,https://v.redd.it/vy95qt9m6p8c1
Get season 2 starter pack THEN the Battle Pass! The starter pack comes with enough coins to get the battle pass as well. Just a friendly tip for anyone who did not know :). Sorry if this was posted already.,itzofficialvaz,1180,2024-03-15 17:06:51,https://i.redd.it/olxj8j7btioc1.png
POV: You just joined Holtow,NJShadow,1174,2024-10-03 19:13:32,https://v.redd.it/o9egp8h1clsd1
Unfortunate Stadium,EnChou,1170,2024-12-08 22:15:50,https://i.redd.it/7qkcy2bo8p5e1.jpeg
Destroy lobbies with this simple exploit! 😲 How could this happen!?!? 😱,Ven_n,1170,2024-09-02 21:41:27,https://v.redd.it/gelbw98ztgmd1
I think balaclavas should be facewear so we can combo them with more helmets...,ReffiComics,1169,2024-12-02 18:46:39,https://i.redd.it/vcaxvh7rdh4e1.png
I dont know guys but this drip,Legitimate_Elk3659,1169,2024-12-19 11:56:42,https://i.redd.it/y8nm3jvbos7e1.jpeg
I thought this was something I’d only see on Reddit,Mike_Hunty,1164,2024-01-26 19:04:40,https://v.redd.it/eev4zkyn1uec1
Has anybody else been using this method for this cashout?,N/A,1173,2023-12-30 09:55:45,https://v.redd.it/ajwo8ig0ne9c1
What are they doing up there?,Difficult-Deer5680,1163,2024-04-19 12:04:35,https://i.redd.it/tnfyudcbffvc1.png
The Finals Offline Event in Tokyo Was Incredible! ,iA2K10,1158,2024-10-27 06:50:35,https://www.reddit.com/gallery/1gd53ap
What do you guys think of this strategy?,jdbatx,1162,2024-10-18 23:28:48,https://v.redd.it/oo9c68aanlvd1
New Vaiiya sponsor drip is insane...,ReffiComics,1153,2024-12-03 22:16:15,https://i.redd.it/pdjx9b48kp4e1.png
Let the marketing begin! ,Highsenberg199774829,1154,2024-05-05 21:02:24,https://i.redd.it/3v29yhru9oyc1.jpeg
These are way too hard to slide/drop down into,ServerOfTheAltar,1178,2024-04-13 13:16:15,https://i.redd.it/joxcelqmy8uc1.jpeg
This game has the worst directional audio of any game I've ever played,N/A,1156,2024-01-07 00:27:00,https://www.reddit.com/r/thefinals/comments/190es46/this_game_has_the_worst_directional_audio_of_any/
Reasons No. 69 and 420 as to why the Goo Gun is the best gun,Dave6334,1156,2024-11-01 01:45:50,https://v.redd.it/st9mtem537yd1
I was promised sights. The restrictions are very disappointing,kasuyakema,1148,2024-09-27 21:40:26,https://i.redd.it/7qaum8dp8frd1.png
Manage to pull of this legendary double team kill thanks to the new hook,N/A,1155,2024-06-16 20:41:07,https://v.redd.it/yj63ozebwz6d1
New heavy specialization,Worldly_Law_4473,1151,2024-11-26 22:55:16,https://i.redd.it/8cfuc10vsb3e1.jpeg
" I chose The Finals over these games, was I right?",black_baguette,1154,2024-11-24 21:22:48,https://www.reddit.com/gallery/1gz1xa0
"Bro wrote a whole gaslight essay to defend sword, just for Embark to nerf it the very next day.",CactusCalin,1169,2024-11-06 14:20:50,https://i.redd.it/ly5n0hpwhazd1.png
I hate this game,New_Bad_1504,1171,2024-01-27 21:55:59,https://v.redd.it/c4d1rdb512fc1
I like the GOO Gun the most as i'm too slow for this game to play with normal weapons,UHDArt,1148,2024-01-19 18:45:29,https://v.redd.it/wbi3uew3zfdc1
Heavy life - simple life,_Guccifer__,1151,2024-07-01 15:24:44,https://i.redd.it/q6uj8fgkdx9d1.jpeg
"Embark plans to take The Finals far, and I'll be there to support them every step and misstep of the way. Some communications with Rob in twitch chat :) *Psst, if you're watching this Rob, DO THAT AMA PLEASE* ",TheRealRhin0,1158,2024-09-07 00:34:32,https://i.redd.it/xdi6gs3g7and1.png
