Title,Author,Score,Created_UTC,URL
"If you look at the edges of the las vegas map, you can actually see the las vegas sphere",Outrageous_Home_326,4564,2024-02-25 09:50:26,https://i.redd.it/61as6ul5epkc1.jpeg
Smoke + Jpad is LETHAL. Can't believe this worked lol,LordSpencer101,3351,2024-09-29 07:33:40,https://v.redd.it/g1ln9ddgbprd1
Very unfortunate ,YoYo_ismael,3291,2024-04-15 20:00:21,https://i.redd.it/wpqoedsj8puc1.jpeg
Cashout alarm clock that requires you to steal to stop it,Webber-414,3527,2024-06-18 06:23:48,https://v.redd.it/jfbnhhq6x97d1
I still can't get over how good the coin effect looks,james___uk,3621,2024-01-05 00:29:57,https://i.redd.it/atkazrjgniac1.gif
Feeling BOLD after a win streak like...,SleepDivision,3246,2024-12-01 12:50:46,https://v.redd.it/5csrwrmjh84e1
Just had a fuckin' anime fight lol,BBUCKLESS,3277,2024-09-15 06:24:21,https://v.redd.it/1eq9gdnb2xod1
So I Went to monaco,Faithfullfang,4848,2024-07-07 19:41:47,https://www.reddit.com/gallery/1dxoy0o
the most fluid demat of my life,thesuperjfj,3012,2024-10-31 07:53:08,https://v.redd.it/7y6eukt5s1yd1
"GOATED Devs, The Finals S4 BIG SUCCCESS!",AhSawDood,5026,2024-10-01 15:56:01,https://i.redd.it/n6aez5az26sd1.png
Embark really listens to the community ,Highsenberg199774829,3103,2024-03-20 10:43:21,https://i.redd.it/1vmfub0hxgpc1.jpeg
This weapon is actual trash,InitialAge5179,3381,2024-01-13 16:06:12,https://v.redd.it/g8tpityzd8cc1
And also Hello when the game starts,cloudboyistrash,3012,2024-09-10 17:36:52,https://v.redd.it/thsarlvrp0od1
My '' guys it's real'' post ,Astral_photo,2923,2024-11-15 15:21:28,https://www.reddit.com/gallery/1grypd4
Just me being PRO 💯,LocksmithOld4360,2956,2023-12-27 17:50:06,https://v.redd.it/aryanwbzkv8c1
"I found this when looking through the game files, it was just added in today's update",coyotepetersun,3094,2024-01-31 17:37:23,https://v.redd.it/yx0j4m6katfc1
"Oceania servers are so small, you can recognize everyone by name, so i made a video slandering every Oce player BY NAME",Puzzleheaded_Low825,5086,2024-10-13 04:35:43,https://v.redd.it/pgsk8m1kcgud1
iPad Kid Falls Off Bridge And Dies,Autumm550,2731,2024-09-23 19:47:43,https://v.redd.it/96a0jygz4mqd1
I was birthday-gifted this bag because it reminded my family of the ‘the game I play’ on the living room TV 😻,ImpossibleRatio7122,2678,2024-09-02 05:51:09,https://i.redd.it/sttmp3854cmd1.jpeg
My girl brought me a Finals themed birthday cake,dadavyd,2754,2024-09-30 22:33:50,https://www.reddit.com/gallery/1ft8ohn
Do I play this too much?,UnaskedShoe359,2628,2024-02-18 22:43:59,https://i.redd.it/pxkqay8s9fjc1.jpeg
unlocked all 4 funny symbols the other day,BiRacialThumbsDown,2620,2024-12-04 14:36:08,https://i.redd.it/v7ljr75vdu4e1.png
Why did the crowd stop cheering when they got to us,Opposite_Excitement2,2594,2024-01-09 12:43:38,https://v.redd.it/umkfutp6uebc1
Just grab this 💀,youngcarlos424,2580,2024-10-15 05:41:39,https://v.redd.it/6itux9y5yuud1
New Tech: The Goo Surf!,Lethal_Lime_,2610,2024-09-22 09:25:46,https://v.redd.it/uzoiatr4xbqd1
I blame Gamers more than I blame Embark,propit777,2868,2024-09-17 16:24:57,https://i.redd.it/89vvpguebepd1.jpeg
Getting Tricky With it🎯,TruceBrian,3120,2023-12-26 22:13:10,https://v.redd.it/h1zcz3zvqp8c1
I’m the BEST player in this game…,Few_Fan_2662,2559,2024-01-15 20:26:24,https://v.redd.it/apgkc515yncc1
No more recon sense for medium,severe_009,2796,2024-03-13 16:22:42,https://i.redd.it/b33wb3ymn4oc1.jpeg
"Please people, is not much to ask",SeveredWig,2629,2024-10-11 08:44:52,https://i.redd.it/brf39b83b3ud1.jpeg
Gigachad Engimo CEO,KingKeltron,2528,2024-09-26 23:35:48,https://i.redd.it/jr0hrdffo8rd1.jpeg
#OnlyOnTheFinals (Ignore the bad aim),Classic_Furry_Trash,2553,2024-10-30 19:09:59,https://v.redd.it/0jqjk4txzxxd1
Anyone Notice This Glitch With The New FlashBang Option?,rolliepollie454,2503,2024-11-21 00:41:57,https://v.redd.it/pphcrk8ci52e1
Holtow got the big kahuna's ,stimpy-t,2480,2024-10-05 23:12:17,https://i.redd.it/2xkxwg08s0td1.jpeg
My team quit the game on first round of Ranked and I managed to reach THE FINALS alone,Hankobrad,2498,2024-04-07 09:32:16,https://www.reddit.com/gallery/1by0f4n
I think we should leave before it's too late,lKeyBootl,2439,2024-11-12 13:51:42,https://v.redd.it/2q9sdofs6h0e1
I hate this game,Merhat4,2470,2024-01-26 16:47:25,https://v.redd.it/yqtrbjt6dtec1
This Game is a Movement God's Playground,Away_Aspect_9166,2538,2024-01-29 20:38:04,https://v.redd.it/vq1z561vwffc1
The holtow hammer does the printing playername thing ,Pietjes13,2531,2024-10-09 15:32:41,https://i.redd.it/wz8wt6g02rtd1.jpeg
Is this true with the finals? ,NoReason880,2445,2024-10-27 16:38:49,https://i.redd.it/9gug7chcubxd1.png
My nephew wanted The Finals themes birthday part.,deadliestfurniture,2376,2024-11-24 20:04:14,https://i.redd.it/9zrnxmqiow2e1.jpeg
So I went to Kyoto,Apex1-1,2393,2024-07-08 09:32:57,https://www.reddit.com/gallery/1dy4p7o
I call this the Ospuze Predator,Adventurous_Honey902,2354,2024-09-27 06:25:47,https://i.redd.it/6flib2rkpard1.png
You can now install sights on weapons,Armroker,2428,2024-09-20 19:20:40,https://i.redd.it/lt6efyodl0qd1.png
must be a skill issue,Sixx_1,2571,2024-01-19 20:49:58,https://i.redd.it/aah7zol3mgdc1.jpeg
"Yea, that's you little guy. It's your season to shine.",ChrisWreckOnYou,2340,2024-12-18 02:37:36,https://v.redd.it/50641xvnri7e1
The Finals was nominated for the Golden Joystick Award for Best Multiplayer Game,coldrolledpotmetal,2336,2024-10-04 14:53:26,https://www.reddit.com/r/thefinals/comments/1fw12rr/the_finals_was_nominated_for_the_golden_joystick/
so my friends and i hijacked the win screen,N/A,2318,2024-02-26 21:43:46,https://v.redd.it/ac8rv6j720lc1
Season 5 Skin Teaser shown at the Golden Joystick Awards,Oliver_Woods,2472,2024-11-21 17:26:48,https://i.redd.it/1r7tik3pha2e1.jpeg
why is this so hard for people to understand,vystz,2619,2024-01-01 18:54:49,https://i.redd.it/qq3zt4r1lv9c1.png
Better start running,Difficult-Deer5680,2311,2024-04-16 12:50:51,https://i.redd.it/qhm4hj1u8uuc1.png
I can now destroy my grandma's restaurant in the finals,Glittering-Sell6160,2314,2024-12-15 21:18:00,https://www.reddit.com/r/thefinals/comments/1hf2mue/i_can_now_destroy_my_grandmas_restaurant_in_the/
Not sure if this was posted here yet,Consistent_Ratio2581,2329,2024-12-10 13:40:02,https://www.reddit.com/gallery/1hb1ylo
how to deal with sword players ,Pietjes13,2295,2024-11-21 11:09:27,https://v.redd.it/rhrrcll8m82e1
Nobody said that you need to DROP the cashbox.,TommyWobinson,2302,2024-09-20 12:02:22,https://v.redd.it/2evsf4n9fypd1
Steals are too easy with this technique,nightrainlane,2260,2024-06-28 07:01:28,https://v.redd.it/cy2mtusug99d1
Nukes are OP pls don't FIX,Eldris69,2356,2024-01-09 20:48:03,https://v.redd.it/y3gdpfqb8hbc1
I love this game ,New_Bad_1504,2261,2024-10-17 12:48:17,https://v.redd.it/z5ngtxy0cbvd1
Holtow insurance better not deny any claims..,psymbionic,2223,2024-12-06 06:35:23,https://i.redd.it/cew0ykc5b65e1.jpeg
"Oh my, I never thought in a million years that would go in",TRTArctic,2244,2024-10-29 04:05:23,https://v.redd.it/oq9kgexgdmxd1
Visual Recoil is Fixed in Season 5!,BBUCKLESS,2306,2024-12-09 20:06:55,https://v.redd.it/d6bz5qsiqv5e1
Gamemode Idea: Vaiiya vs Vandals,ReffiComics,2233,2024-04-16 19:08:46,https://www.reddit.com/gallery/1c5og2n
Next week’s patch notes leaked 🤯,N/A,2397,2024-04-17 16:49:13,https://i.redd.it/gp6y43w9k2vc1.jpeg
Winch Claw skin??,JosephChester5006,2230,2024-10-04 19:11:33,https://i.redd.it/6kb3ivmmgssd1.jpeg
Here have one..,vishaalgp,2158,2024-11-08 13:03:58,https://i.redd.it/299co07yeozd1.jpeg
is this just me?,dicktoot,2204,2024-09-30 16:51:12,https://i.redd.it/2u45oxux7zrd1.jpeg
"“2 steps ahead, I’m always 2 steps a head” ahh post ",JoeBotskie,2178,2024-10-09 18:30:44,https://v.redd.it/ncokqaluxrtd1
Do I look like I'm ready for The Finals?,CompedyCalso,2125,2024-07-09 18:20:15,https://www.reddit.com/gallery/1dz9ik9
I noticed there's not many mine skins so I thought I'd throw my concept out there,send-me-kitty-pics,2123,2024-09-06 19:48:16,https://i.redd.it/wmza59ngt8nd1.png
I had way too much fun with the Snuke! Hope you enjoy,N/A,2186,2024-01-18 20:24:32,https://v.redd.it/i31wugfac9dc1
"Hear me out, amusement park map. ",koi_da_lowkz,2126,2024-09-21 20:07:20,https://www.reddit.com/gallery/1fmbnvp
Noooooooooooooooooooooo...,Lofus1989,2080,2024-10-16 12:34:17,https://v.redd.it/dsrbskgm44vd1
Straight up cartoon sceen bro 😭,oguzcanbilirdonmez,2049,2024-10-23 19:51:35,https://v.redd.it/ql6rlsah8kwd1
When the whole squad has to share one brain cell.,Rydden,2021,2024-01-02 04:47:54,https://v.redd.it/fpevzfbfiy9c1
Has anyone seen this before? I couldn’t believe what i was witnessing haha ,MulletMaxPicks,2015,2024-10-12 12:59:53,https://v.redd.it/gy59gpdipbud1
This Throwing knives skin is crazy due!  ,Legitimate_Elk3659,2014,2024-08-31 17:23:15,https://v.redd.it/z83o6g7ba1md1
Skins dispersion is awful,New_Bad_1504,2169,2024-10-17 07:53:29,https://i.redd.it/5imsdhaiv9vd1.jpeg
Introverted players when their mates start talking instead of using pings,Sera_gamingcollector,2058,2024-02-22 09:08:50,https://i.redd.it/nv2nw210s3kc1.jpeg
"Rest in peace, you won't be missed",Vinod_cr7,2039,2024-10-17 14:03:15,https://i.redd.it/z8zu32bhpbvd1.jpeg
"They hated him, for he spoke the truth. 🙏",Knooper_Bunny,2472,2024-10-03 01:12:07,https://i.redd.it/4ip5qlonxfsd1.png
41k people playing and it’s not even the weekend or prime time of the day,UltimatePikmin,2031,2024-03-14 14:08:00,https://i.redd.it/tm28csoi4boc1.jpeg
Especially when you have 3 seconds left until respawn,Toilet_Bomber,2013,2024-01-21 02:35:36,https://v.redd.it/v8499b8ogpdc1
"With the Mexican season, there could not be a more PERFECT time….",propit777,1994,2024-12-03 17:07:18,https://i.redd.it/ysklp1r51o4e1.jpeg
My new favorite hobby is toying with people using the Goo Gun,IN_MY_PLUMS,1996,2024-01-02 17:00:20,https://v.redd.it/qwgkhfuw42ac1
My artistic interpretation of Scotty and June ,ReffiComics,1958,2024-10-28 20:47:57,https://i.redd.it/8pk4a3v77kxd1.png
"Dear teammate, I thank you for the revive",N/A,1975,2024-01-27 10:23:32,https://v.redd.it/7hgfzrnllyec1
really thought we wouldn't notice smh,N1cknamed,2133,2024-03-12 13:02:59,https://i.redd.it/sz6d89xriwnc1.png
Threw cashbox in FTW,MaddaPak,1952,2024-07-20 16:55:41,https://v.redd.it/3v5d9j7qepdd1
Newton's First claims another soul,Lad_of_the_Lake,1937,2024-10-03 05:20:10,https://v.redd.it/321bv2lb7hsd1
"Yo guys, my official The Finals merch just dropped! 👀",TibuEasy,1918,2024-10-19 18:22:46,https://www.reddit.com/gallery/1g7f75a
Animations for Stick Revolver,VoxVixAndAFox,1954,2024-03-27 17:57:36,https://v.redd.it/y05o91o71xqc1
Light and heavy art,ohno1337,1937,2024-11-21 06:26:36,https://www.reddit.com/gallery/1gw9vva
I miss The Finals so much,UseBags,1945,2024-11-16 15:56:23,https://www.reddit.com/r/thefinals/comments/1gsq88l/i_miss_the_finals_so_much/
this is why i love this game,That-Confection5577,1907,2024-12-16 18:59:36,https://v.redd.it/zfemm5g1d97e1
My teammates kept dying so I locked in :p,TheNxxr,1944,2024-11-01 06:25:21,https://v.redd.it/jqfk1jegh8yd1
i deserve some style points for this cashout,Thepureog,1894,2024-01-22 01:56:54,https://v.redd.it/wrm4tgalewdc1
CNS hacked The Finals YouTube account.,Sm4sh_y,2084,2024-03-08 18:01:29,https://i.redd.it/wkdkfcs5g5nc1.png
This is why I love this game. You can't make plays like this anywhere else but in THE FINALS!! ,Birkeland1992,1880,2024-10-23 22:31:01,https://v.redd.it/ty4w2m7j1lwd1
Post-patch controller players,Dizzy_Map_9184,2221,2024-01-11 17:23:17,https://v.redd.it/zff6zhfxhubc1
Any idea what happened here?,bash-smash,1895,2024-10-13 15:55:43,https://v.redd.it/y1g60tvvpjud1
reject the primitive and revolting barricades and return to the goo,TaintedEdenGaming,1857,2024-11-08 08:09:49,https://i.redd.it/6kwyq6raymzd1.png
"THE FINALS Major $100,000 tournament announced!",TheHiddenGFX,1883,2024-12-07 18:52:42,https://v.redd.it/wco4f9qk3h5e1
My game looks a little different….,EthanCM505,1849,2024-10-05 18:01:23,https://i.redd.it/3ivnjex09zsd1.jpeg
Is This Actually The BEST Weapon?,Away_Aspect_9166,1900,2024-01-05 21:05:45,https://v.redd.it/ulg98qboqoac1
⚠️DEAD CONTESTANT SPOTTED IN THE FORTUNE STADIUM⚠️,_yeeternice,1854,2024-09-29 13:13:21,https://www.reddit.com/gallery/1fs424b
"ive had multiple people downvoting me and telling me otherwise so here it is: riot shield does block melee, even winch claw",Tigersenpai,1836,2024-11-17 16:45:07,https://v.redd.it/1kh0hy6aqh1e1
Yeah... I didn't want to get that cashout anyways,MessBusiness397,1835,2024-10-02 17:35:59,https://v.redd.it/vxl5gi1npdsd1
"New ""Invert flashbang color"" option",JinkoNorray,1831,2024-11-20 18:18:14,https://v.redd.it/4yzhrdfxl32e1
Teammate revived me into a completely different match,asdk304,1834,2024-05-11 14:59:00,https://v.redd.it/skfssqhhatzc1
Anyone else unlock this new sight yet?,Wang_Wranglin,1844,2024-10-17 22:06:07,https://v.redd.it/vn6drwpf3evd1
Made some Finals Decals for my bike,SQUIDAHH,1825,2024-12-15 00:02:50,https://www.reddit.com/gallery/1heg66f
Sooo gravity vortex?,Cellularnuke,1800,2024-12-13 16:57:23,https://v.redd.it/ps4knp5dcn6e1
"(FOR NEW PLAYERS) how to get good at the finals, meta loadouts 2024 (guide)",DeltaXero,1806,2024-11-02 21:53:37,https://i.redd.it/adb1w7yy7kyd1.png
Count your fucking days Embark💀,PerpetualPermaban2,1850,2024-11-12 04:24:27,https://v.redd.it/wz36z5bsde0e1
Another 3 months of an extremely red main menu :'),ShadowJerry,1774,2024-12-16 17:42:02,https://i.redd.it/nv9zugh4z87e1.png
Sponsors for next season looking great! ,MoonK1P,1773,2024-12-03 22:26:07,https://i.redd.it/2bd8r9e1mp4e1.jpeg
You gain no advantage for destroying equipment if the cooldown starts on placement.,Chaoslava,1806,2024-04-07 22:53:37,https://www.reddit.com/r/thefinals/comments/1byi0mj/you_gain_no_advantage_for_destroying_equipment_if/
This buff goes crazy. Anyone else see this? ,Every-Day-Is-Arm-Day,1809,2024-11-06 20:14:49,https://i.redd.it/dvk7xm40aczd1.jpeg
The Finals celebrates its 1st birthday in 6 days! 🥳,Worldly_Law_4473,1768,2024-12-02 23:49:22,https://i.redd.it/nhv43y9zvi4e1.jpeg
There is no in-between (maybe except sledge),Iliteral,1752,2024-02-20 14:11:25,https://i.redd.it/r8zgb9p40rjc1.png
I needed to do It ,NoProtection6220,1745,2024-07-13 15:30:21,https://i.redd.it/us6gu9ai1bcd1.jpeg
THE FINALS | Season 3 | Trailer,TheyCallMeCajun,1768,2024-06-07 22:23:27,https://www.youtube.com/watch?v=8kWYWa3Jv2Q
I made a 1:1 size model of an exploding mine!,Proper_Display7431,1745,2024-11-22 17:14:43,https://v.redd.it/dsi2xpc5kh2e1
But there's a new weapon coming out ig,niqdisaster,1771,2024-01-02 04:34:14,https://i.redd.it/35y5urqigy9c1.jpeg
Happy 1 Year Anniversary to THE FINALS!,ReffiComics,1745,2024-12-07 12:23:20,https://www.reddit.com/gallery/1h8rdlw
Somebody stop him!,Cokacondaa,1740,2024-12-05 15:24:25,https://i.redd.it/7q9idgmms15e1.jpeg
I just smashed my TV in front of 30 guests at my party because of the changes to World Tour. My wife just took our crying kids and said they’re all spending the week at a hotel. The Emerald sweats ruined my life and my party. I can’t handle this anymore. Goodbye The Finals. I am no longer a fan.,shoelover46,1745,2024-08-10 22:13:42,https://i.redd.it/7pwq230yuwhd1.jpeg
Am I the only one who uses smoke and thermal view,luiszinck,1737,2024-10-04 11:32:08,https://v.redd.it/n4nx313g6qsd1
So you're telling me it does 17 more dmg AND it has 4 shots in mag?,Dae_Dude,1738,2024-09-28 16:41:49,https://i.redd.it/uo52637vvkrd1.png
someone at embark has a good laugh every time they pull this.,No-Ambassador2874,1732,2024-11-25 22:34:18,https://i.redd.it/beze1o76k43e1.png
"I am become light build, destroyer of the fourth wall",Lord-Chunk555,1735,2024-01-17 04:24:39,https://i.redd.it/iksaadehgxcc1.jpeg
"Well, that’s one way to win a tournament",dreams1ckle,1720,2024-10-25 05:00:42,https://v.redd.it/5ahrzxzy3uwd1
Was afk cause I had diarrhea and came back in time to shit on that little dude,The-Foolish-Samurai,1722,2024-10-06 10:50:50,https://v.redd.it/7i80t1e094td1
Only game I need,HotPumpkinPies,1707,2024-10-06 00:18:09,https://i.redd.it/zd1gtzs841td1.jpeg
"just a reminder that ""nukes"" have appeared in almost all trailers for the game.",JISecond,1780,2024-01-08 18:53:40,https://i.redd.it/h6i2bbdwi9bc1.png
"Friendly reminder: Please ALWAYS grab statuettes, don't just walk to them. They can be grabbed from like 200 km away, just try!",HypatiaSansPro,1706,2024-01-10 18:39:42,https://v.redd.it/5lrld6w5qnbc1
"its finally here, thoughts on the new abilities/gadgets/guns?",DeltaXero,1732,2024-03-11 16:10:33,https://www.reddit.com/gallery/1bc6vah
Charge n slam tip I see no one using ,The-Foolish-Samurai,1695,2024-10-05 23:49:34,https://v.redd.it/mplb63i3z0td1
"Oceania servers are so small, you can recognize everyone by name, so i made a video slandering every Oce player AGAIN (merry christmas oce)",Puzzleheaded_Low825,1851,2024-12-24 12:53:47,https://v.redd.it/52c0kaupms8e1
"JackFrags is streaming the game right now, paid or not is definitely good for the game, specially for how people are leaving cod and apex atm",Highsenberg199774829,1700,2024-12-20 20:21:27,https://i.redd.it/sh2dctlab28e1.jpeg
I really can’t believe it all started as a meme lmao,INDOM1NU5,1697,2024-09-13 06:03:37,https://i.redd.it/y5oeiuxwoiod1.jpeg
Every single match I see that kid,lmiol,1675,2024-10-27 00:33:16,https://i.redd.it/llcqrhd227xd1.png
"We got some new HUD icons, Nice",ZZHIFTY00,1658,2024-09-19 12:26:51,https://i.redd.it/3jnmyzwqerpd1.png
I mean it is true...,gingerwhiskered,1684,2024-12-14 18:07:18,https://i.redd.it/syq4jamrtu6e1.jpeg
In-game billboards now show the highest performing player in the match!,BBUCKLESS,1663,2024-12-09 17:40:34,https://www.reddit.com/gallery/1hafdx1
Encountering low sensitivity players,ZeroOne_01,1668,2024-11-04 14:05:48,https://v.redd.it/vvvjghp96wyd1
It finally happened… ,Realistic-Map450,1654,2024-10-16 06:58:06,https://i.redd.it/ntnxenspg2vd1.jpeg
"I also visited the Monaco map in real life, but this time I photographed more noticeable locations of the map",Shir_man,1654,2024-11-14 23:35:06,https://www.reddit.com/r/thefinals/comments/1grilpx/i_also_visited_the_monaco_map_in_real_life_but/
We both gave up and had a civilized discussion mid-match instead,N/A,1654,2024-08-12 23:34:04,https://v.redd.it/ax7peay0jbid1
Skill issue I guess,DuckQuackBeans,1673,2023-12-28 14:38:18,https://i.redd.it/4sh1vpiqr19c1.jpeg
"Two community's, 2 options about the visual recoil removal ",ReboIred,1660,2024-12-13 08:21:44,https://i.redd.it/0gcws8cisk6e1.png
Mediums when they see a slight angle on the ground,Sorry_Reason4347,1651,2024-11-15 19:49:34,https://v.redd.it/i5f1m4cod41e1
Decided to give my airsoft Ak an OSPUZE sponsorship ,BuntyScrungus,1652,2024-11-11 13:33:21,https://www.reddit.com/gallery/1gos9ws
How are they ALL bangers???,ReffiComics,1655,2024-06-19 23:37:55,https://v.redd.it/v8794b326m7d1
Some more Finals cosplay shenanigans at AX,CompedyCalso,1643,2024-07-10 17:01:43,https://v.redd.it/la2u4xi03qbd1
Accessories now morph around clothes,Illustrious-Arm-1282,1644,2024-06-27 18:36:08,https://v.redd.it/an8zd941s59d1
"please ""👋hello"" back",Aruovap,1640,2024-06-03 13:41:59,https://v.redd.it/0e7ohqmn1d4d1
New riot shield bug? Why is the riot shield the size of a building?,MarshmallowSquishy,1631,2024-03-19 01:05:12,https://v.redd.it/xmh607r4x6pc1
Every. Single. Time.,zakk_archer_ovenden3,1632,2024-09-02 03:39:12,https://i.redd.it/bp3q6id4hbmd1.jpeg
Attack & Defend Gamemode Reveal tomorrow,N/A,1630,2024-04-28 15:07:24,https://i.redd.it/oxrm9ny4k8xc1.jpeg
I've been gatekeeping this for a week. Thought it's time to share.,Caddap,1645,2024-06-24 16:18:24,https://v.redd.it/ufz46981oj8d1
The Giga Nuke Incident (01/28/2024),Familiar-Opposite473,1629,2024-01-28 22:50:00,https://v.redd.it/nf0c1fbjf9fc1
I present the Snail Nuke.,N/A,1622,2024-01-17 19:47:37,https://v.redd.it/wblc1nz212dc1
Cathedral strikes back,la2eee,1613,2024-11-12 13:33:35,https://v.redd.it/fp72jmms3h0e1
The Vaiiya CEO is a robot!?,CthulhuZX,1628,2024-12-09 18:55:24,https://i.redd.it/v26bfxqvdv5e1.png
Stereotypical Heavy Teammate,GoldenRush257,1627,2024-03-28 20:30:38,https://i.redd.it/7vie0ht6x4rc1.png
Anyone else feel this way?,Own-Confusion7813,1638,2024-02-12 15:39:23,https://i.redd.it/cgz2prdkc6ic1.jpeg
I will give my life for this dubious little creature,Kaxology,1623,2024-10-01 17:55:39,https://v.redd.it/oknz3yb9o6sd1
Free Engimo guardian turret (& multibucks),RELOADEATH,1621,2024-09-26 17:36:48,https://i.redd.it/ycxbn0lfw6rd1.jpeg
i will never financially recover from this,Kitsune_800,1597,2024-12-16 12:49:27,https://i.redd.it/pxk57g70j77e1.jpeg
The Finals got an Official Nominee Spot for the Steam Awards ,redderwood51,1607,2024-12-17 18:55:30,https://i.redd.it/twlemjx7hg7e1.png
“Slim Sledgy isn’t real. He can’t hurt you.” Slim Sledgy:,dual-ity,1619,2024-01-16 13:02:22,https://v.redd.it/mh009suvvscc1
"Eh, boys, do you like the stick I found?",Gellix,1599,2024-09-26 10:39:52,https://i.redd.it/r08wn6p0u4rd1.png
This is my most badass moment in World Tour,Dacrowx,1587,2024-07-02 14:40:17,https://i.redd.it/ocorukbia4ad1.jpeg
I am so sorry heavy mains (shotgun nerf was my fault),the-mountain14,1590,2024-03-21 23:10:48,https://v.redd.it/c5twsw1mrrpc1
I hope HOLTOW has you covered on whatever scam this is.,SulfurousDragon,1586,2024-09-21 15:52:34,https://i.redd.it/0no3o8r9p6qd1.png
"Which way, Embark?",LukeTheGeek,1940,2024-01-13 05:03:21,https://i.redd.it/1k86fxyl35cc1.png
The Finals rewards you for your creativity ⬆️,muskygmrgrlftstench,1591,2024-03-22 08:40:50,https://v.redd.it/eyfqrukflupc1
Heavy out of nowhere,Amatertu,1580,2024-11-24 17:17:48,https://v.redd.it/of6clxgmuv2e1
How i imagine light mains,PosidensDen,1581,2024-09-16 04:26:37,https://i.redd.it/bwp33wdcm3pd1.jpeg
They finally did it! | Store Update 2.5.1,Xovier,1580,2024-04-24 08:40:23,https://i.redd.it/vrz6v6ub3ewc1.png
Can we stop the sponsor racism and appreciate the game?,banana-ita,1586,2024-09-29 13:38:49,https://i.redd.it/4py60mmp4rrd1.jpeg
Won a twitter contest with this clip lol,TTV-EquAZN,1581,2024-01-30 15:01:22,https://v.redd.it/mptx4mxqdlfc1
I see nobody talking about Embark dropping Leon set ,N/A,1576,2024-11-06 13:22:45,https://i.redd.it/lt6l1b708azd1.png
The Finals Exams,RED219521,1576,2024-04-01 06:10:54,https://i.redd.it/cbd9sl5t7trc1.jpeg
"I drew some gadget ideas, 1 for each class.",ReffiComics,1571,2024-08-27 02:31:27,https://i.redd.it/1l6pwk74b4ld1.png
Time to post this meme,ZH9c418,1568,2024-09-24 11:16:52,https://i.redd.it/sov9d6stqqqd1.jpeg
This is new...?,Vilesyder,1576,2024-02-29 12:13:29,https://i.redd.it/1mmbbe9umilc1.jpeg
Gateaway skin concept ,New_Bad_1504,1563,2024-11-05 13:41:24,https://i.redd.it/3inpbnew63zd1.jpeg
Remember poggers for data reshaper order,ilovedream10-02-22,1568,2024-04-07 17:58:55,https://i.redd.it/b04rgj1ej3tc1.png
Manifesting the Pop Tart gun for Season 4,Funny_Debate_1805,1566,2024-09-14 00:28:10,https://i.redd.it/2affpl7z5ood1.jpeg
Yall so bad they had to nerf the challenges LMAO,N/A,1813,2024-04-10 10:21:02,https://i.redd.it/5iz8xuzmomtc1.png
Season 4 sponsors,AsukaiByakuya,1550,2024-09-28 11:52:36,https://i.redd.it/2d7m63yngjrd1.jpeg
"I've got 656 hours played and I JUST realized the finals logo is an angled ""F""",Intelligent-Road3754,1552,2024-12-01 18:07:28,https://i.redd.it/ks82m4i22a4e1.jpeg
Is this pay to win already or not yet?,SandwichItDelicious,1530,2024-09-29 20:38:39,https://i.redd.it/4ytm7m916trd1.gif
"How funny is it that they removed the medium ability that everyone has been calling ""wall hacks"" and replaced it with literal wall hacks.",awakeperchance,1542,2024-03-13 20:45:24,https://www.reddit.com/r/thefinals/comments/1be2aho/how_funny_is_it_that_they_removed_the_medium/
I painted my school parking spot,PootisBird001,1533,2024-08-17 13:54:03,https://www.reddit.com/gallery/1euia3b
"Play how you want, but not that way",GloriousInternetUser,1547,2024-03-19 21:14:43,https://i.redd.it/lgh0t7n4xcpc1.jpeg
PSA: Teammates are still useful as statues,M_RiGGz,1534,2024-01-12 20:23:15,https://v.redd.it/kvnaq61ti2cc1
Always something new to learn thanks to y’all,propit777,1510,2024-10-21 15:11:48,https://v.redd.it/2wls2ikik4wd1
Certified light moment.,Sablm,1548,2024-11-29 19:11:30,https://i.redd.it/ont7j64o3w3e1.png
Lowkey sad the media don’t pay attention to the finals ):,Yakiisauce,1520,2024-12-17 12:46:33,https://i.redd.it/31cv5hcene7e1.jpeg
I showed The Finals to a girl at work,Kollishun,1519,2024-07-18 10:05:02,https://www.reddit.com/r/thefinals/comments/1e67r34/i_showed_the_finals_to_a_girl_at_work/
How heavy players feel rn ,Tkachenko,1512,2024-10-01 16:53:36,https://i.redd.it/o5rk7pp9d6sd1.jpeg
This place is laggy af,Tom_Clancys_17_Again,1507,2024-12-07 06:22:52,https://i.redd.it/yxr4g59rdd5e1.jpeg
the new meta unlocked,El-hammudi21,1558,2023-12-28 16:35:35,https://v.redd.it/2cs326cic29c1
What an unfortunate way of losing,AlanK_15,1504,2024-07-19 21:57:05,https://v.redd.it/bl1ttbgyrjdd1
Game breaking discovery credit to jinko for idea ,The-Foolish-Samurai,1514,2024-12-15 10:37:32,https://v.redd.it/0hu6210gqz6e1
when 3 CEOs singlehandedly breathed fresh air into new conversation around the finals instead of  complaining about the game.,No-Ambassador2874,1496,2024-09-29 15:00:55,https://i.redd.it/1pr77vn8jrrd1.png
Trapping people in the finals,Long_Beach09,1505,2024-03-17 12:48:04,https://v.redd.it/egckncoz4woc1
"I think the skins being locked behind challenge is a good thing, oscar did say it was to prove you are a true master of the finals.",No-Ambassador2874,1503,2024-04-04 15:46:44,https://i.redd.it/xf3mhp01hhsc1.png
Finals in 3 hours and I still can't do this 😭. Help me team.,SabsWithR,1506,2024-04-01 12:25:13,https://i.redd.it/2t7od8p92vrc1.png
