Title,Author,Score,Created_UTC,URL
Battle Pass thoughts,shidfard72,964,2024-03-11 00:24:51,https://i.redd.it/2wa1ipaxmlnc1.jpeg
“Do you support the finals?”,Born_Solution_6828,971,2024-12-12 15:29:05,https://i.redd.it/um9ftm5urf6e1.jpeg
It must be held together by duct tape,NIGHTFURY-21,971,2024-10-09 09:41:19,https://i.redd.it/ynqvi4vfbptd1.gif
When the finals brain rot sets in,Intempore,967,2024-02-25 09:40:12,https://v.redd.it/5ovc7cy9cpkc1
Thank you embark 🙏,New_Bad_1504,968,2024-06-19 09:58:43,https://i.redd.it/gr8mp5qg4i7d1.jpeg
When is snow coming back !! ,ghost_00794,956,2024-11-30 16:13:21,https://i.redd.it/4drbugosc24e1.jpeg
It wasn't him...,lostpasts,965,2024-04-09 13:32:30,https://i.redd.it/utzwg9yvhgtc1.jpeg
DUAL BLADES HAS BEEN BUFFED✊🏻,Mambosaurio,961,2024-12-12 11:31:45,https://i.redd.it/d1zgkvkhle6e1.png
A player message me this,Highsenberg199774829,964,2024-03-04 03:25:41,https://www.reddit.com/gallery/1b60oa2
Leaving a tourney after your teammates have left is no longer penalized,Blu_Moon_216,967,2024-02-03 10:20:08,https://i.redd.it/mazbu4kcjcgc1.png
How did I deal 100 damage to myself with my main gun? (Ignore my username),FinnOtron,962,2024-02-02 16:18:10,https://i.redd.it/xa1e3x9a67gc1.png
I hope Embark realizes this challenge turned us into monsters,AGH8,961,2024-05-10 21:56:09,https://v.redd.it/734xqxsq7ozc1
I Killed A Troll. He was jumping around the whole map with the vault and wouldn't put it in the cash out. So I decided to ambush him.,BallisticTurtle_fart,959,2024-02-10 17:47:00,https://v.redd.it/uxmfknm7pshc1
"Now at 1,500 votes. We need 10,000!",MasterFish19,959,2024-05-06 15:14:55,https://i.redd.it/c6miz59gotyc1.png
Now I am become HEAVY.. ( Original post= u/Eazymoney88),Nukerion,956,2024-01-04 11:28:28,https://v.redd.it/k6qw1r4oqeac1
Sniper Vs RPG  ,FoxFireCode,958,2024-06-10 12:58:17,https://v.redd.it/cspa5al0sq5d1
Current state of the game,Armroker,957,2024-07-15 18:40:19,https://i.redd.it/7qjxd2n79qcd1.png
Halloween event tease from Oscar?,Powerful-Setting2494,954,2024-10-18 15:25:40,https://i.redd.it/nq3undg39jvd1.jpeg
Can we talk about how awesome sponsor career is??,Charmest,959,2024-09-12 15:23:51,https://i.redd.it/t3gj436ybeod1.jpeg
"These are the rewards for each sponsor, which will you sign with?",truthseekerscottea,954,2024-09-25 18:54:48,https://i.redd.it/det88knf50rd1.jpeg
"I love seeing this and I'm seeing it more and more. New players what ever you may think of them, are the live blood of this game.",stimpy-t,951,2024-10-13 22:53:16,https://i.redd.it/a5d2rkr3slud1.jpeg
Whats this build called? Leavy? Hight?,LawsonLevi,954,2024-05-19 18:13:01,https://i.redd.it/zhpk6y6ecf1d1.jpeg
Does this skin give advantage? ,Mr-Invincible3,952,2024-10-22 14:02:13,https://i.redd.it/aed6s7oudbwd1.jpeg
For all the people who will buy this,Aggravating-Tip69,949,2024-10-23 18:11:25,https://i.redd.it/bhgwj908rjwd1.png
I’m glad I get to use these before the inevitable Nerf into nonexistence,Traditional-Pea-2379,955,2024-09-26 15:19:42,https://i.redd.it/alllrk6z76rd1.jpeg
Can you reach.. the final piece of cake?,x3d0sx,946,2024-12-18 23:17:01,https://i.redd.it/59ateqgswo7e1.jpeg
"Guy named NOTEDSCORE, light console player…",SnooCompliments794,953,2024-10-11 15:10:42,https://www.reddit.com/r/thefinals/comments/1g1c2d3/guy_named_notedscore_light_console_player/
"kinda bumbed out with this one. I thought you got actual winged shoes for your contestant when you maxed evasive dash, not a trinket.",Zalantra,951,2024-02-01 14:11:35,https://i.redd.it/lv7bnrzoezfc1.png
this is probably my career highlight,Apprehensive_Skill31,952,2024-11-14 01:09:47,https://v.redd.it/2rcrss1por0e1
"The Embark animation team have outdone themselves, lol",Incunabuli,952,2024-03-14 14:47:59,https://v.redd.it/2hqz3z9jbboc1
SEASON 2 map and music just leaked.. by CNS?!,MasterFish19,948,2024-03-02 15:54:55,https://www.reddit.com/r/thefinals/comments/1b4remk/season_2_map_and_music_just_leaked_by_cns/
"With the gravity cube, creation of ""mechs"" is now possible! (discovered by youtuber EkaZo)",Iliteral,949,2024-03-22 13:38:10,https://v.redd.it/vccbrcje2wpc1
"Just in time, I love the data reshaper",SklydeM,952,2024-12-23 23:09:51,https://v.redd.it/plvllz9xjo8e1
Teammate with the jump pad assist,APPLECORN-,945,2024-12-14 08:29:57,https://v.redd.it/4iuy4h6uyr6e1
Do you remember season 2?,Baba4nneGurmesi,946,2024-11-08 17:47:28,https://v.redd.it/ee4sm73jtpzd1
Medium Weapon Time-to-Kill Comparison,Knooper_Bunny,956,2024-03-26 04:16:19,https://v.redd.it/b3loamwntlqc1
You now will be informed if a player has been banned after you reported them. Big W,Armroker,948,2024-06-15 13:52:36,https://i.redd.it/0rc4h0gqpq6d1.png
Embark music producers are still cooking🔥🔥🔥,Vovancheg31,949,2024-03-02 16:17:00,https://v.redd.it/a6aftbsk4ylc1
"Game on the line… in the final seconds. Im not even angry at him, all I could do was just laugh 😂",Illustrious_Lie573,949,2024-12-03 02:15:56,https://v.redd.it/rnqglz54mj4e1
Embark just ruined the gunplay,illuminacegg,947,2024-01-17 19:49:25,https://www.reddit.com/r/thefinals/comments/1995t1l/embark_just_ruined_the_gunplay/
The amount of time I'm playing Kyoto is driving me insane.,CactusCalin,944,2024-10-12 12:35:09,https://i.redd.it/wusliy7xkbud1.png
"Holtow plebs, your move.",_TimApple_,945,2024-10-02 18:29:08,https://i.redd.it/54rd31q8zdsd1.jpeg
Thoughts on Fortune Stadium?,shig3o_kag3yama,946,2024-09-28 00:27:50,https://i.redd.it/sgwf0w3d2grd1.png
The Official Wiki is now offering FREE daily gameplay tips for any contestant who visits the main page!,smashel_was_here,945,2024-07-05 12:00:13,https://www.reddit.com/r/thefinals/comments/1dvwab1/the_official_wiki_is_now_offering_free_daily/
Double Heal for The Steal!!,NB_Leo,950,2023-12-31 18:35:10,https://v.redd.it/qw3p1maqco9c1
You were like a week too long and I'm getting antsy for season 3 but you were a good season.,No-Ambassador2874,944,2024-06-06 03:29:45,https://i.redd.it/qxzi2rupev4d1.png
I played a Dubstep show in my Finals merch ! ,navals94,948,2024-10-21 01:12:47,https://www.reddit.com/gallery/1g8e4gw
Steam Awards nominations are live! Vote The FINALS for Most Innovate Gameplay Award and Best Soundtrack Award!,shadowslasher11X,940,2024-11-27 18:23:40,https://i.redd.it/c78nv127lh3e1.png
RPG max damage is 140. Max self-damage is 252. I think this is overtuned....,BillyRaw1337,971,2024-01-21 15:47:24,https://www.reddit.com/r/thefinals/comments/19c67wb/rpg_max_damage_is_140_max_selfdamage_is_252_i/
This sub in a nutshell,DeusExPersona,945,2024-08-02 12:28:41,https://i.redd.it/jc4mf2g6v8gd1.png
god I'm loving this game so far,The_Next_Legend,945,2023-12-30 20:51:34,https://v.redd.it/pt1dsnv2wh9c1
The Duality of Light,propit777,943,2024-09-05 05:59:12,https://i.redd.it/yfoia92ukxmd1.jpeg
Buff the revolver damage on 50m+ range you cant even kill a medium hitting every shot,New_Bad_1504,947,2024-07-28 12:58:55,https://v.redd.it/7syealh4c9fd1
most feared light,Aruovap,940,2024-11-29 13:15:48,https://i.redd.it/5x2y3mu4cu3e1.png
There have been major advancements in the field of goo-propelled cranes,JuhoSi,938,2024-12-05 19:54:49,https://v.redd.it/khljjwcl435e1
"0 bucks spent. Good luck, guys!",Quorit,934,2024-11-07 17:33:37,https://www.reddit.com/gallery/1glw1ki
Another contribution to the Goo Gun supremacy agenda,IN_MY_PLUMS,937,2024-01-02 16:34:58,https://v.redd.it/6eeqe0tv02ac1
Finally tried playing Light last night,tehghettosmurf,941,2024-01-01 15:01:11,https://i.redd.it/vlv755kcfu9c1.jpeg
Steal cancelled by contestant statue :(,Scarmellow,943,2024-12-22 02:23:12,https://v.redd.it/o0oweu7q8b8e1
The Finals Suspending Balloons IRL,_Artrex,937,2024-11-29 19:35:23,https://www.reddit.com/gallery/1h2tuz5
I didn’t know toxic gas was this effective…,SilentMC25,937,2024-01-08 19:33:00,https://v.redd.it/tcf2j7kaq9bc1
Dematerializer is better,DrDankensteinx,934,2024-03-25 20:02:57,https://i.redd.it/o1xla4cmdjqc1.png
"Different dead figures for different classes (for example, so that the light knows for sure that it is necessary to heal first of all the mid, who can faster revive the heavy with a defibs)",ENDRAER,933,2024-03-11 09:51:45,https://i.redd.it/je4xli2xfonc1.jpeg
Can we get a massive appreciation for Embark/The Finals?,mobile-legends-ta,934,2024-06-01 18:31:07,https://www.reddit.com/r/thefinals/comments/1d5thuj/can_we_get_a_massive_appreciation_for_embarkthe/
I’m only joshing. ,DontPostOn_r_gaming,937,2024-03-18 17:22:23,https://i.redd.it/ldq7guhum4pc1.jpeg
How would you rank the seasons so far?,MovinReddit,928,2024-12-04 11:50:00,https://i.redd.it/ktgmj9kglt4e1.jpeg
IRL GOO CANISTER 🗣️🗣️,ABoredSpanishPerson,926,2024-07-04 12:40:33,https://i.redd.it/j8uf47vzyhad1.jpeg
3 Days. What are you most excited for?,MasterFish19,932,2024-03-11 21:02:08,https://i.redd.it/u1i4g55krrnc1.png
"Embark please double down on world tour. I don't care what you do with ranked, world tour is the best.",No-Ambassador2874,929,2024-06-14 17:06:49,https://i.redd.it/libjmsz8kk6d1.png
Mid-Season Update 1.6.0 — THE FINALS,hm9408,1108,2024-01-31 13:00:21,https://www.reachthefinals.com/patch-notes-10
What kind bullshit it this 💀,PT750,925,2024-10-05 09:39:33,https://i.redd.it/glegk2ohrwsd1.jpeg
"Unbiased meme, just factual information ",Mambosaurio,929,2024-09-29 19:43:22,https://i.redd.it/lfw6e9ckxsrd1.png
What this sub feels like ,beetle8209,926,2024-10-28 14:20:28,https://i.redd.it/t2clgbneaixd1.jpeg
How unranked players sleep at night ,waeli30,925,2024-08-10 13:31:21,https://i.redd.it/d91anlvs9uhd1.jpeg
We need more FLUFFY,ShockandTwitch,929,2024-11-17 16:39:33,https://i.redd.it/h26j2g2jph1e1.png
Massive W for light players,DrDankensteinx,934,2024-01-17 14:09:46,https://i.redd.it/mmzck2ivc0dc1.jpeg
This post brought to you by iseul-t gang. ,ShyGuySkino,930,2024-10-01 11:14:40,https://i.redd.it/8wdezq8to4sd1.jpeg
"""DON'T DO IT OR WE LOSE"" *does it anyway* ",JinkoNorray,929,2024-07-12 17:45:49,https://v.redd.it/06soaejok4cd1
"His teammates left in the first round, so we made it our mission to protect the lone marine and get him the win, This games community is so good <3 o7",SilusTheCreator,929,2024-10-12 21:46:08,https://i.redd.it/4yjanut9beud1.png
"10 days, 1200 points later…",coastlywest,925,2024-12-05 09:57:14,https://i.redd.it/qzc0f859605e1.jpeg
"Contestants, the hype is unreal🔥",Vinod_cr7,928,2024-09-25 14:43:29,https://i.redd.it/7qq699elwyqd1.jpeg
Iseul-T Fashion? More like an Insult-To Fashion.,shadowslasher11X,920,2024-09-28 04:23:01,https://i.redd.it/vsozfjii8hrd1.png
This was my main takeaway from the teaser: ,ReffiComics,923,2024-09-17 23:44:02,https://i.redd.it/6gjwpxpnhgpd1.png
*Sees the Pro Circuit Reward*,ReffiComics,923,2024-07-12 22:46:16,https://i.redd.it/8u8knfq326cd1.png
"“Nerf this nerf that” nah, fuck it, buff everything",KO_Stego,925,2024-02-12 17:51:19,https://www.reddit.com/r/thefinals/comments/1ap62bi/nerf_this_nerf_that_nah_fuck_it_buff_everything/
The finals needs prop hunt.,OkUnderstanding650,916,2024-11-11 22:02:46,https://i.redd.it/1o87iohthc0e1.jpeg
can I just give compliments to the gorgeous home visuals; compared to the red void we had. ,heinous_legacy,917,2024-03-15 01:53:22,https://v.redd.it/irtqd9bcmeoc1
Sticky Situation for Heavy (Animation),BobertoBoo,919,2024-01-12 13:03:36,https://v.redd.it/nfkp05ucc0cc1
What’s everybody’s opinion on the current meta and balancing?,jackbutrehab,977,2024-02-05 22:54:20,https://i.redd.it/8xz1zy6sjugc1.jpeg
Never thought I'd see this in a modern game.,ErikErikJevfelErik,919,2024-06-13 09:40:57,https://i.redd.it/4sn61ppt7b6d1.jpeg
People in 2020 Zoomcall meetings ,ReboIred,917,2024-12-13 13:14:12,https://i.redd.it/wzwl2ann8m6e1.png
New charm works great!,shimontec,910,2024-04-24 10:01:09,https://v.redd.it/wq9191cqhewc1
It only takes 2,Ladydragon0,915,2024-09-25 10:13:19,https://i.redd.it/2jisehn7kxqd1.png
"You’ve heard of glitch trap, now meet the bell trap",vulpix94,910,2024-09-11 13:46:03,https://v.redd.it/49iv6eclp6od1
Update from Embark on upcoming Season 3 features,tron3747,918,2024-06-08 15:13:19,https://www.reddit.com/r/thefinals/comments/1db55c9/update_from_embark_on_upcoming_season_3_features/
Official Season 3 Teaser: REBOOT REQUIRED,MasterFish19,924,2024-05-21 19:52:21,https://www.reddit.com/gallery/1cxh12r
Here is a riot shield skin that would go hard,ReaperWTGun,918,2024-03-15 03:49:51,https://i.redd.it/axjh35147foc1.png
I'm losing this game aren't I?,miszczu037,915,2024-03-05 21:52:56,https://i.redd.it/79feoui97lmc1.png
Essence of Reversal,thesuperjfj,914,2024-11-30 17:53:08,https://v.redd.it/06laankku24e1
"Imagine chilling in deathcam and suddenly you witness your random SoloQ-Light murder 2 full hp MMH-teams, back-to-back, all by himself and with a baseball bat.",YungPunpun,915,2024-04-17 22:27:38,https://v.redd.it/3s1ubyvc74vc1
THIS NEEDS TO BE FIXED THIS WEDNESDAY!!!!! You can trigger mines while flying around the map as a spectator.,Seobjevo,911,2024-04-15 09:35:52,https://v.redd.it/ajkho6d84muc1
Player Count could go higher? ,Ok_Physics4681,913,2024-12-15 13:12:52,https://i.redd.it/zgbjdnn9i07e1.jpeg
Okay I deserved that one….,Novel_Bad_3719,906,2024-01-09 21:34:51,https://v.redd.it/thcj277ughbc1
So my gf and I were looking at our Ospuze shirts and... ,brattiky,908,2024-08-24 11:25:53,https://www.reddit.com/gallery/1f030xv
PSA: placing a grav cube on these pads does not give you a boost!,sauceyabeans,904,2024-09-24 19:20:08,https://v.redd.it/c704kjl05tqd1
I think you are NOT fans of THE FINALS,kaic_87,909,2024-06-08 14:55:39,https://www.reddit.com/r/thefinals/comments/1db4rhk/i_think_you_are_not_fans_of_the_finals/
OSPUZE website is kinda scary...,Execsama,907,2024-05-27 16:09:35,https://www.reddit.com/gallery/1d1v3ia
"If your weapon of choice is not in the state you want it to be, maybe run with a different weapon for now?",wokenoodle,909,2024-08-28 12:12:07,https://i.redd.it/g0deq3hibeld1.png
"Unpopular opinion, there should be skill based matchmaking in WT ",Classic_Furry_Trash,907,2024-10-30 18:33:44,https://i.redd.it/swi1w3ydtxxd1.png
A Victorian/Bloodborne style map will go hard in this game.,jessieS1212,902,2024-11-03 16:12:05,https://i.redd.it/z3lp3jnynpyd1.jpeg
People who left me in ranked ,wortmother,907,2024-10-20 22:22:40,https://www.reddit.com/r/thefinals/comments/1g8aruz/people_who_left_me_in_ranked/
This is what happened when the timer expired FYI,SSMblackjack,903,2024-03-14 00:03:04,https://i.redd.it/mn7h04npx6oc1.png
The Finals on PS4,Mambosaurio,902,2024-11-22 18:31:27,https://i.redd.it/yzebme55yh2e1.png
"Welp, solo bank it is EXACTLY what we thought it would be.",King_Kahn_,901,2024-01-17 14:49:23,https://www.reddit.com/r/thefinals/comments/198y8va/welp_solo_bank_it_is_exactly_what_we_thought_it/
The TV shows static when you get glitch grenaded is there no limit to Embark's attention to detail holy shit,Blu_Moon_216,900,2024-03-24 14:07:28,https://i.redd.it/059uf57ehaqc1.jpeg
Official Player-count (minimum) figure from Embark!,MasterFish19,901,2024-05-09 09:19:40,https://i.redd.it/b4lznzd0adzc1.png
heavies in the crane when they see someone is stealing be like:,Icy-Success-69,897,2024-11-16 02:10:39,https://i.redd.it/guuedn6o961e1.jpeg
The most satisfying squad wipe you'll see today,valxntineee,899,2023-12-29 21:32:54,https://v.redd.it/0nqyy5acya9c1
Moments like this are why I play ,GlobalVehicle5615,906,2024-10-16 22:56:57,https://v.redd.it/afv8k6bq77vd1
Season 4 Battle Pass,GrapeTheFox,898,2024-09-20 20:52:23,https://www.reddit.com/gallery/1flmabp
Here’s an idea for increasing mines rate of kaboom,lightshadower,895,2024-04-04 17:03:54,https://i.redd.it/fje3f9m1vhsc1.jpeg
Y’all are complaining about the tournament. Meanwhile…,BloodDeathGore,898,2024-03-29 03:06:16,https://i.redd.it/tj4dppt4w6rc1.jpeg
My most epic finish with emote 😩❤️‍🔥,Illustrious_Lie573,893,2024-08-16 14:16:27,https://v.redd.it/z0vicncbb1jd1
When they hand deliver the cash out to you ,Dallasfan5521,898,2024-10-25 15:02:10,https://v.redd.it/2mhrre7a3xwd1
Again Embark Developers need a sloppy head for this creative design! You guys are showing others how cosmetics should be done! (This spray is lenticular!),zex_99,893,2024-07-13 09:57:47,https://v.redd.it/izbk9f85e9cd1
Like shooting fish in a barrel.,MasterAenox,886,2024-02-04 17:25:03,https://v.redd.it/pfc4ofq2slgc1
What 100hrs of dagger does to you,BizarreBandit,885,2024-05-03 15:41:54,https://v.redd.it/u8v9ywbld8yc1
"POV You’re Light, being chased by two Recon Users",himarmar,890,2024-01-16 14:30:55,https://v.redd.it/qwj7lpbpbtcc1
Using the force to eliminate a non-HOLTOW sponsored contestant,CaptainNightt,887,2024-11-01 00:34:41,https://v.redd.it/te5kav9vq6yd1
New Map of Season 2,PlayTed,891,2024-03-11 16:23:21,https://www.reddit.com/gallery/1bc76ss
Can we have a weapon skin that is as stupid as this?,Thamozeru,891,2024-06-05 08:07:08,https://v.redd.it/ht67u9jsnp4d1
Thank god they nerfed nukes 🤡,PonchoFreddo,891,2024-01-28 00:43:15,https://v.redd.it/gt9w5pc0v2fc1
This the only merch I got🥲,Live_Raccoon_8481,881,2024-12-12 01:52:31,https://www.reddit.com/gallery/1hca8yo
"Hey if I'm 5 seconds away from respawn and you're last alive, please don't run into a gunfight just to die and reset our spawn timer",N/A,890,2024-01-03 20:32:56,https://www.reddit.com/r/thefinals/comments/18xt9s2/hey_if_im_5_seconds_away_from_respawn_and_youre/
The cheetah print is uhh... is kind of uhh,UnderScoreLifeAlert,884,2024-12-02 16:44:47,https://i.redd.it/3nto0u52sg4e1.jpeg
This the greatest fucking game I ever played 😭,LOCKEDOWN_,894,2024-06-15 04:37:02,https://www.reddit.com/r/thefinals/comments/1dg9z3p/this_the_greatest_fucking_game_i_ever_played/
"PSA: quick reminder: You can ""defuse"" grenades with data reshaper",KingTeXxx,886,2024-04-11 21:06:28,https://v.redd.it/rciiqy5n0xtc1
The TV charm shows what event is currently on.,1stPKmain,887,2024-03-22 20:39:38,https://i.redd.it/nx4q03ko5ypc1.jpeg
How do people play COD when games like the finals are out?,Objective-Day9689,896,2024-10-28 17:28:39,https://www.reddit.com/r/thefinals/comments/1ge7vr7/how_do_people_play_cod_when_games_like_the_finals/
Stop fucking crying.,MoodMaggot,888,2024-04-18 08:45:25,https://www.reddit.com/r/thefinals/comments/1c6ygxn/stop_fucking_crying/
The 1st Emerald 1 in the world.,ggDolan,882,2024-12-18 00:22:14,https://i.redd.it/sdtt51jgyh7e1.png
“this weekly challenge is so hard why cant i complete it in 2 games”,catinabighat,884,2024-11-12 01:53:00,https://i.redd.it/gyusuz7wmd0e1.jpeg
"WAIT, THEY ARE HANDING OUT FREE MULTIBUCKS FOR COMPLETING THE CIRCUITS NOW?? This is actually insane",Syxtaine,881,2024-03-14 10:15:03,https://i.redd.it/jiigbc5yy9oc1.png
Me patiently waiting for the recon senses nerf,GreasyMustardTiger_,879,2024-02-08 20:49:22,https://i.redd.it/jznzuu18cfhc1.png
This could be huge,ChrisWreckOnYou,886,2024-09-14 11:53:40,https://i.redd.it/yqi7552akrod1.png
My goo gun strats are forever evolving,ChronoTrader,878,2024-01-01 04:15:52,https://v.redd.it/p8yxc41n7r9c1
"The finals Hotfix 1.5.1, ads bloom fixed!",joshant18,882,2024-01-19 09:54:43,https://www.reachthefinals.com/patch-notes-8
Hi everyone I'm Michael Jackson ,EndSsiy,879,2024-09-26 17:43:54,https://www.reddit.com/gallery/1fq2769
we should totally start beefing each other,DeltaXero,877,2024-09-12 20:33:03,https://i.redd.it/bmlgxyy2vfod1.png
United by music,Nirxx,882,2024-01-28 02:09:32,https://v.redd.it/y40pmi8ea3fc1
People leaving COD or Apex need to try this game,Erasmus86,875,2024-12-20 14:26:32,https://www.reddit.com/r/thefinals/comments/1hikww8/people_leaving_cod_or_apex_need_to_try_this_game/
Guess what did they patch without telling us,The-Foolish-Samurai,882,2024-10-27 07:00:03,https://v.redd.it/2odt2vgsy8xd1
You can see all the new weapons in the teaser!!,Capt_R0FLC0PTER,878,2024-09-12 15:05:09,https://i.redd.it/nuclfccm8eod1.jpeg
big respect to the heavy who protected me during these trying times,honbeee,878,2024-06-24 22:21:49,https://v.redd.it/nmsa43lchl8d1
Grappling Hook Superiority,ReffiComics,877,2024-03-24 00:08:09,https://i.redd.it/ixi3yv8qb6qc1.png
Diabolical Movement & Dematerializer Outplays,SanguineNightsTV,875,2024-03-23 15:16:44,https://v.redd.it/ychhb4jwo3qc1
New skins leaked,Dreamburger,880,2024-07-30 15:01:27,https://www.reddit.com/gallery/1efvlfs
"After a bit, the weapons currency is kind of useless. I feel like they should have another use, like buying cosmetics that aren't in bundles, or cosmetics that are generic?",Sebastin290,876,2023-12-28 18:27:51,https://i.redd.it/1tnnrvvlw29c1.png
WHAT DID CNS DO?! I don't want to play this...,SocksFishy,878,2024-11-24 08:53:23,https://i.redd.it/x09w9a3uct2e1.jpeg
"""God, let me make one more""",Proper_Display7431,874,2024-07-07 15:29:39,https://www.reddit.com/gallery/1dxj4zk
Can we please get a sword and shield skin :(,7sun_,877,2024-03-01 00:19:10,https://i.redd.it/ff6u4vls8mlc1.jpeg
Smartest Heavy Sledge User,Zephyr4813,883,2024-01-30 18:16:52,https://v.redd.it/zbhd4vmpcmfc1
Their mines can kill. NOT GOOD.,We12haupt,877,2024-10-21 20:00:33,https://i.redd.it/n9oappcv06wd1.jpeg
How to counter lights dashing away from you after a hook:,ErosHD,872,2024-06-17 00:13:02,https://v.redd.it/ip4oltk0y07d1
"The game is devolving into nonsensical C4 nuke fights. Inb4 ""run around with a 2m radius APS all the time"".",Seismicx,883,2024-01-12 18:10:48,https://v.redd.it/f2ldnh71v1cc1
Got this amazing angle.,Charmest,876,2024-10-08 07:01:57,https://i.redd.it/c1c2p7z3ehtd1.jpeg
This Contract can suck itself,helladap,869,2024-10-22 17:00:10,https://i.redd.it/zazilvkj9cwd1.png
My idea for a 93r buff. Make it shoot out miniature sledge heavies.  ,RecoverOver175,873,2024-09-15 00:29:02,https://i.redd.it/htuedetwavod1.jpeg
"""The Finals is dying"" videos are a big problem",cloudboy_08,874,2024-04-23 18:30:28,https://www.reddit.com/r/thefinals/comments/1cbc1br/the_finals_is_dying_videos_are_a_big_problem/
Promo for new sledge skin that got removed from files this update,demerf,877,2024-05-22 19:00:49,https://i.redd.it/fulwphvzy02d1.png
Cartoon Ahh Death,DizzyPangolin2363,871,2024-01-26 21:15:08,https://v.redd.it/dhuj1n1cnuec1
The only change I want...,Intelligent-Road3754,876,2024-11-29 07:18:01,https://i.redd.it/6reiaridks3e1.jpeg
Game winning buzzer beater shot,kade0potato,872,2024-08-10 22:48:59,https://v.redd.it/1frel5761xhd1
Googun skin idea,Shrekidishrunk,871,2024-06-01 13:45:33,https://v.redd.it/704yb7qisy3d1
Hail Mary (Fanart Sketch),Claykicker,868,2024-11-14 20:02:46,https://i.redd.it/q4k0i935bx0e1.png
These dudes were holding the game hostage in the funniest way possible,Legal_Many_7036,874,2024-01-24 21:10:33,https://v.redd.it/bmjeb8hbegec1
All hail the true king. ,Stoner_Worm,870,2024-10-07 12:49:38,https://i.redd.it/2fxxamq0zbtd1.png
Apex Legends new map looks a lot like it was heavily inspired by The Finals.,xenn64,871,2024-02-13 20:02:26,https://i.redd.it/1wmzbgsxreic1.png
Average player ENGIMO Now,DeLagCola,868,2024-12-03 12:56:47,https://i.redd.it/2b7pv93gsm4e1.jpeg
A True Saviour-,Himuks,873,2024-12-23 12:01:04,https://v.redd.it/0ynyy58i8l8e1
"The red and black eyes visible in the pro circuit completion reward are a separate cosmetic! I was very pleasantly surprised by this, as they actually stand out. Thanks embark!",No-Ambassador2874,873,2024-05-03 01:11:18,https://i.redd.it/qm6vmm7i34yc1.png
"So, are you siding with Holtow, Engimo or ISEUL-T?",UomoRaga,863,2024-09-12 16:15:49,https://i.redd.it/e8rve638leod1.jpeg
Glitched vault in the final round of the game…,Jakub_O,870,2024-10-19 23:09:28,https://i.redd.it/x0emga4rosvd1.jpeg
I wrote to Embark bc of the challenge and this happened,Brilliant-Cod7835,870,2024-11-13 15:59:11,https://i.redd.it/ehjhz0vryo0e1.jpeg
This game needs killcams.,Chaoslava,863,2024-10-15 10:54:45,https://www.reddit.com/r/thefinals/comments/1g44vw9/this_game_needs_killcams/
Am I playing too much?,zelgart,864,2024-04-07 21:13:46,https://i.redd.it/grpgkswci4tc1.jpeg
Can we stop with this?,Slanky00,860,2024-04-04 12:00:19,https://i.redd.it/phdkvnpvcgsc1.jpeg
Got trolled by the jump pad,ryddiz,866,2024-11-13 01:39:35,https://v.redd.it/h3isl3uepk0e1
Played with a griefer last night..,ImplicationOfDanger_,867,2024-01-01 19:58:58,https://v.redd.it/24gkz8ixvv9c1
How to use plant pot,DarKCroX,863,2024-12-14 19:41:14,https://v.redd.it/wza9xuzgav6e1
No matter what i do.,theartisticraven,859,2024-09-08 12:07:57,https://v.redd.it/9f4lg7r8tknd1
Fuck the lights,Few_Commission_4488,862,2024-05-16 19:14:21,https://v.redd.it/tshdrbxi8u0d1
suddenly many high rank streamers are gone...?,Intelligent_Top_268,871,2024-01-11 17:23:41,https://www.reddit.com/r/thefinals/comments/19471v6/suddenly_many_high_rank_streamers_are_gone/
Honestly though,Dn434,864,2024-06-12 17:14:58,https://i.redd.it/cg3yoazwb66d1.jpeg
"Actuality, the sword has a range of 12 meters.",ShockandTwitch,869,2024-10-28 08:44:00,https://v.redd.it/3v67xwr8mgxd1
Like bro if you’re gonna TBAG then at least do it after getting a funny kill ,Coyotepetersun2,863,2024-12-23 19:15:53,https://i.redd.it/wl2770laen8e1.gif
Probably the best clip I have on this game lol,N/A,858,2024-01-07 07:36:32,https://v.redd.it/xq7tu2al1zac1
Noticed a few things in the teaser ,Bennshharpie,863,2024-11-22 01:25:02,https://i.redd.it/ubc6zuq0vc2e1.jpeg
Why is edging in this game so hard?,Sethdrew_,859,2024-08-05 17:42:46,https://www.reddit.com/r/thefinals/comments/1eku26u/why_is_edging_in_this_game_so_hard/
Sometimes my intelligence is frightening...,TickleTipson_11,859,2024-07-28 11:20:53,https://v.redd.it/pb9tg0thu8fd1
"“Oops, I lost our vault.”",Longjumping_Candy_17,858,2024-10-30 15:01:52,https://i.redd.it/yjhdpx8prwxd1.png
Guys I guess what the meta class is right now ,oui_uzii,862,2024-10-06 23:50:52,https://i.redd.it/8krf60ga48td1.jpeg
Here we go again…,Zealousideal_Act9476,857,2024-09-27 10:53:35,https://i.redd.it/zp319l1d1crd1.jpeg
