Title,Author,Score,Created_UTC,URL
Oh really Heavy on me? Didn’t notice,New_Bad_1504,1147,2024-06-29 17:00:08,https://v.redd.it/8nrpjv5rkj9d1
skin idea for the riotshield,CVLVMVR,1148,2024-04-06 04:04:05,https://i.redd.it/bk86bxxczrsc1.jpeg
My new favorite way to push people...,ThatGuyDes,1148,2024-01-14 14:43:09,https://v.redd.it/fr4rkijp3fcc1
Can you stop stunning me...for 5 minutes!?!,Random_Falcon96,1139,2024-10-11 15:02:23,https://i.redd.it/xytf7b6k65ud1.jpeg
"While other games lack christmas updates, like Valorant, CS2, ect, Thank you Embark for putting priority on making the game fun and refreshing.",hyperswyper,1145,2024-12-15 11:04:21,https://i.redd.it/ytxa8b90vz6e1.png
This game is pure comedy,OkeeYokee,1145,2024-09-23 05:32:43,https://v.redd.it/qkihxlf8whqd1
Found my classmate casually chilling with an ospuze sticker,Candid-Bad2223,1141,2024-10-07 13:42:01,https://i.redd.it/l23yskrk8ctd1.jpeg
the finals has proved society is broken,Ok_Concentrate_9861,1154,2024-06-12 23:17:03,https://i.redd.it/fpq72igi486d1.jpeg
*sad heavy noises*,Tkachenko,1141,2024-08-21 18:03:08,https://i.redd.it/6j8dgrgb42kd1.jpeg
The funniest way to steal a cache just dropped,88224646BAS,1137,2024-11-06 02:37:45,https://v.redd.it/oiwaoy8817zd1
I kind of broke the pagoda,NeedModdingHelp1531,1143,2024-08-19 19:38:23,https://v.redd.it/53b57nwt9ojd1
It was a ranked TA...,Caninystic,1183,2024-06-22 18:52:11,https://i.redd.it/mp3w0k9a668d1.png
Do Better Please,Independent-Mud6613,1138,2024-12-16 18:57:36,https://i.redd.it/1y40hhqoc97e1.jpeg
My Halloween Costume for this year! ,WaffleMiner,1135,2024-10-26 22:01:57,https://www.reddit.com/gallery/1gcw2x6
Can I get a pad? ,Unhappy-Yak-4874,1125,2024-11-16 17:20:04,https://i.redd.it/5m7bi0rxra1e1.jpeg
"This is not COD, PLEASE ",spicyburntmeatball,1138,2024-09-29 16:12:56,https://www.reddit.com/r/thefinals/comments/1fs7zs2/this_is_not_cod_please/
I’m slowly losing my mind,CALL_ME_JIG,1159,2024-02-11 10:40:20,https://v.redd.it/4au1gmoaqxhc1
"New player here, first impressions after 6h",RedGrimm05,1141,2024-05-22 15:06:08,https://i.redd.it/ma2lij8stz1d1.jpeg
Please move the AKM's Sticker position slightly as half of it is now lost under the new sight mount,VileRocK,1120,2024-10-01 10:45:05,https://i.redd.it/1c84sv2gj4sd1.png
I run revolver and miss half my shots like a real man 😎,USAtoUofT,1126,2024-01-22 17:29:48,https://i.redd.it/r8p5bi2u01ec1.jpeg
I think the Riot Shield may be a little busted… I counted nearly 20 shots that should’ve hit,CALL_ME_JIG,1130,2024-02-16 02:51:07,https://v.redd.it/rl9j4you2vic1
and finally...the POWER RANGERS!,smooboi,1124,2024-09-16 07:42:04,https://v.redd.it/f4mffea7l4pd1
Now I just look needy and desperate for friends…,propit777,1125,2024-09-20 05:11:03,https://i.redd.it/37qw2g2xdwpd1.jpeg
This is so much fun,__SeeiRaptor__,1136,2024-01-01 15:15:29,https://v.redd.it/ir2elqywhu9c1
"With the destructible environment, I think The Finals would make an awesome Zombie game.",lukehooligan,1138,2024-08-29 21:30:22,https://i.redd.it/0yad0rbc8old1.png
I made chocolate finals coins ,RaidNineSHARK,1121,2024-11-12 21:55:12,https://i.redd.it/qzjdrqodlj0e1.jpeg
"VAIIYA signees are weird, dude....",GoofballGregory,1117,2024-12-10 15:34:42,https://i.redd.it/42bse5zpi16e1.png
Season 2 trailer has reached almost 3 million views in 1 week,Highsenberg199774829,1121,2024-03-18 15:09:04,https://i.redd.it/dfoobi82z3pc1.jpeg
Behold my level 6 dual blades,No_Job2485,1121,2024-10-21 13:23:22,https://www.reddit.com/gallery/1g8pkzm
Yoooo Finals Nintendo Switch gameplay just dropped,RecoverOver175,1120,2024-11-23 14:40:04,https://i.redd.it/y8kn6nsrxn2e1.jpeg
Nah bruh what is this ,Polarbite-,1113,2024-08-24 02:04:34,https://i.redd.it/d4m8tnb0sikd1.png
Please Nerf Goo,Bbow21,1111,2024-10-04 19:29:42,https://v.redd.it/321u126vjssd1
[Concept art] Someone said the MGL had no skins...,SulfurousDragon,1111,2024-08-15 17:13:52,https://i.redd.it/r3vjbcm02vid1.png
LITTLE THIEF TOOK MY CASH(box) AND RAN AWAY,EchoBlur,1106,2024-11-09 07:44:49,https://v.redd.it/v1uvt4lsytzd1
The light experience,Shaquille-_-Oatmeal_,1120,2024-05-27 22:29:17,https://i.redd.it/eorhd0qep13d1.png
"""Nukes are fair and balanced.""",Pink_Sink,1118,2024-01-07 22:33:56,https://v.redd.it/04nun0brf3bc1
The Filmbreakers Set Concept Trailer,Hairball567,1109,2024-06-06 13:58:52,https://v.redd.it/t4mfch2djy4d1
"Call me crazy, but…",Horizon_Reddit,1112,2024-01-02 11:01:40,https://www.reddit.com/r/thefinals/comments/18wmvrv/call_me_crazy_but/
DoorDash for the High Notes,DaggerJKS,1111,2024-07-03 22:52:53,https://v.redd.it/dp8evdqbrdad1
Everything thats coming in Season 2,AmarHassan1,1111,2024-03-11 16:17:36,https://store.steampowered.com/news/app/2073850/view/4130435365862894609?l=english
Seoul demat big brain,90sPaperCup,1109,2024-10-21 22:20:41,https://v.redd.it/n1fevgkup6wd1
Leaked gameplay footage of the Nintendo Switch port for the game,coyotepetersun,1107,2024-06-24 13:55:42,https://v.redd.it/km8roppazi8d1
The Finals is definetly taking the #1 spot for in-game cosmetics,xenn64,1113,2024-03-01 21:20:55,https://i.redd.it/ut488uowhslc1.jpeg
i love the finals ❤️,Aruovap,1106,2024-12-04 09:18:49,https://i.redd.it/mxulpz4hus4e1.gif
Uuuuuhhh did they do something different with the goo this update? 🤣😂🤣,Double0Kills,1097,2024-01-14 10:33:11,https://v.redd.it/fjiqyuf5vdcc1
Y’all ever qualify by $1 before?,ShyShannon732,1103,2023-12-27 23:33:19,https://i.redd.it/2idancl9ax8c1.jpeg
Using the UFO to take the cashout & GTFO,SinisterCanuck,1095,2024-10-30 04:02:07,https://v.redd.it/zqxkd96whtxd1
Item concept - Adrenaline-shot,N/A,1106,2024-02-28 21:09:39,https://i.redd.it/kpnz9lj26elc1.png
RUNNING vs WALKING vs CROUCHING speeds comparison for all 3 classes,JinkoNorray,1097,2024-07-09 07:50:54,https://v.redd.it/qpana77r7gbd1
Fighting against MMM is a never ending battle…,Imhappyyyy,1097,2024-10-11 14:56:06,https://v.redd.it/6nf0uiid55ud1
JFYI there's a new AKM skin,FuZZiiOn_Clown,1096,2024-02-21 17:20:36,https://i.redd.it/z0ogb1pt2zjc1.png
This sound lives rent-free in my head,Blackbeerdo,1099,2024-01-08 13:57:13,https://i.redd.it/3elfxxif28bc1.png
Fun fact: The level 6 mastery skin for the FCAR has worn off near the mag because of how much you guys sweat in matches,Blu_Moon_216,1108,2024-02-26 11:25:28,https://i.redd.it/9qzy8rokzwkc1.png
Around 60% of the time it works every time,CeladonCityNPC,1097,2024-01-28 12:15:46,https://v.redd.it/gnio5l9ka6fc1
That RPG change though..,HotPumpkinPies,1102,2024-01-20 01:07:47,https://i.redd.it/eab7qxi3whdc1.jpeg
There is going to be a spinning stage on the new map.,tundrdlt,1088,2024-12-07 09:04:47,https://i.redd.it/42tlifwp6e5e1.jpeg
What do yall think this means? 👀,PootisBird001,1093,2024-10-02 19:34:44,https://i.redd.it/cs7950pxaesd1.jpeg
I got the Fatal Florist achievement! 👀,Sevolorred,1089,2024-09-25 20:45:56,https://v.redd.it/v4ax3e36p0rd1
why are there melee weapons 😭😭,Tuvastik,1089,2024-11-07 16:59:10,https://i.redd.it/swedq62wfizd1.png
This needs to be a sledgehammer skin ,Constant-Still-8443,1094,2024-09-19 21:36:27,https://i.redd.it/7masyg9t4upd1.jpeg
New weapon idea,Superb-Sound7755,1088,2024-03-22 17:44:12,https://i.redd.it/qtihg0udaxpc1.jpeg
"I have committed a cardinal sin, i'm sorry for what I've done :'(",Stoner_Worm,1083,2024-09-19 09:02:49,https://i.redd.it/ylwwol89eqpd1.png
There's a NUKE in the teaser for Season 4,Xovier,1086,2024-09-12 15:24:53,https://i.redd.it/z4vqtbo0ceod1.jpeg
Heavys be like in my matches,FinalsBestPlays,1083,2024-01-23 16:36:50,https://v.redd.it/1c1zln4fw7ec1
"Happy Monday, I hope S4 weapons are OP and change the Meta",propit777,1101,2024-09-16 17:37:18,https://i.redd.it/u6y5hsnej7pd1.jpeg
Vaiiya slander. ,tundrdlt,1085,2024-12-14 06:18:10,https://v.redd.it/hfh759jcbr6e1
Sponsor beef in the community rn:,lukedri,1084,2024-09-28 12:32:08,https://i.redd.it/li1p7vhwnjrd1.jpeg
Would it make any sense?,Polikosaurio,1096,2024-01-26 09:58:44,https://i.redd.it/pwaotcx8crec1.png
Trying to catch someone while playing melee heavy be like,Blu_Moon_216,1083,2024-09-15 12:25:43,https://i.redd.it/e6e6okjpuyod1.jpeg
all that remains is not to die before release of the season,ENDRAER,1080,2024-09-12 16:30:13,https://v.redd.it/ioboomp0neod1
You were all WRONG calling finals a shooter game,ENDRAER,1078,2024-11-04 08:40:24,https://i.redd.it/x7e8dh9akuyd1.png
New weapon leaked by CNS???? ,ShadeVex,1078,2024-03-05 10:23:08,https://i.redd.it/vagkvvi6shmc1.png
Trailer tier transition ,Phrog_19,1080,2024-11-02 00:36:38,https://v.redd.it/l3on27j5wdyd1
This skin reminds me of something...,dawidf06,1078,2024-12-18 11:12:15,https://www.reddit.com/gallery/1hgzdqe
Peak Movement,nava94_,1085,2024-01-06 01:21:22,https://v.redd.it/2ukydnwg0qac1
"Goddammit Embark, why is this game so drippy!?!",TheCowhawk,1071,2024-03-30 08:19:06,https://i.redd.it/ndj2ruwukfrc1.jpeg
Most used button on my keyboard,inexplicability,1073,2024-12-10 20:19:57,https://i.redd.it/6e610jcxn26e1.jpeg
"Yesterday you would be dead! Only 10hp less damage, but it makes a big difference.",Seobjevo,1111,2024-01-18 08:59:59,https://v.redd.it/18pmr068y5dc1
Update/I got a The Finals tattoo!,Stancedx,1073,2024-11-03 15:21:27,https://www.reddit.com/gallery/1gip8nm
"It’s all good, even when its not",gr8y22,1069,2024-11-20 15:29:50,https://i.redd.it/myjqk52xr22e1.jpeg
If you hate players that defib just as you're finishing reviving a teammate watch this video,AlanK_15,1072,2024-11-19 05:39:52,https://v.redd.it/pa6ankaqps1e1
Allow Us to Progress Old Battle Passes,TruthParadox_Real,1073,2024-12-21 22:19:15,https://www.reddit.com/gallery/1hjkni5
"Block this, sword boy",Confusionitus,1070,2024-12-22 23:34:31,https://v.redd.it/cys836gjjh8e1
"Cheater using lewis gun like mortar. It's just sad, honestly.",lazylaunda,1071,2024-04-05 19:03:49,https://v.redd.it/qiz8nh34lpsc1
That feeling when you encounter a Sledge Heavy,Armroker,1067,2024-07-01 21:39:39,https://v.redd.it/qad6jao78z9d1
"Heavy players with costumes in my team, emoting after 1 shotting light",oguzcanbilirdonmez,1067,2024-09-16 12:57:13,https://v.redd.it/gpo1yn6456pd1
the grass is greener,hidingmyidentities,1065,2024-10-15 21:10:37,https://i.redd.it/xw7o3rwpjzud1.png
Rob teases Season 4 music and map variant: S4_autumn_is_coming.mp4,MasterFish19,1063,2024-09-06 17:49:21,https://v.redd.it/vwhbkxps78nd1
The finals gods will never bless me like this again.,N/A,1060,2024-01-21 18:41:43,https://v.redd.it/jqievxc19udc1
Dematerializer is pretty fun,realFallenWolf,1059,2024-03-14 19:03:48,https://v.redd.it/7upbrmr3lcoc1
YESSS IM SO HAPPY!!! They really deserve it!!!,SocksFishy,1066,2024-12-22 12:45:00,https://v.redd.it/r7kbe6xnbe8e1
This new cloak buff has lights perched like gargoyles ,lukehooligan,1057,2024-12-14 20:34:04,https://v.redd.it/qph8qd92kv6e1
Alright take a  timeout lil bro,Candid-Bad2223,1059,2024-11-02 09:39:09,https://www.reddit.com/r/thefinals/comments/1ghstum/alright_take_a_timeout_lil_bro/
world best gateway user,buNekocid,1061,2024-11-07 00:53:15,https://v.redd.it/g5qu141mndzd1
The Grit & Glory animations are glorious,LeoTek,1057,2024-10-03 22:37:35,https://v.redd.it/eru54dvecmsd1
Oh what a wonderful Christmas we shall have!,Broccoli_dicks,1060,2024-12-18 18:58:41,https://i.redd.it/r2s59kapmn7e1.jpeg
Jump pad skin improved concepts (spring and trampoline),frontpageroadrage,1062,2024-12-01 08:53:47,https://www.reddit.com/gallery/1h3z7ml
Clear than Cashout!!!,Neenolaflairisgod,1058,2024-10-08 10:37:44,https://i.redd.it/aj50q1ylgitd1.jpeg
you are a gamer now,nukiepop,1131,2024-12-24 15:06:44,https://i.redd.it/asyci0niat8e1.png
"Don't stop fighting! You can still win after it says ""Eliminated""",cheesemaestro,1051,2024-04-21 14:25:34,https://v.redd.it/o3hm2ac8euvc1
The best customization of any FPS...,HotGarbage_FMJ,1054,2024-11-03 14:07:27,https://i.redd.it/l68h2a5q1pyd1.png
Embark's official response to why they removed their recent video showcasing the S5 weapons and gadgets:,RGisOnlineis16,1048,2024-12-11 20:44:00,https://i.redd.it/r6ulamxz6a6e1.png
Never thought I'd beat the coins out of 3 mediums but here we are.,TheTurkeySandvich,1050,2024-11-26 19:27:35,https://v.redd.it/lt7cmt8ora3e1
I just realized the CNS face paint is anti AI facial recognition design!,TsarGermo,1048,2024-05-02 14:30:19,https://www.reddit.com/gallery/1cih4f6
The game getting ready to send my team as far from the last cash out as possible ,Mambosaurio,1050,2024-10-05 22:02:02,https://i.redd.it/wxw7xbjyf0td1.jpeg
Heavy nerfs are getting out of hand,L_Kuips,1050,2024-08-30 15:36:20,https://i.redd.it/cefysjzbmtld1.jpeg
hello developers are you on crack perchance?,nukiepop,1057,2024-11-12 16:30:16,https://i.redd.it/syia1p9dzh0e1.png
Defib spawn protection needs to be changed / removed...,Cue262,1051,2024-01-13 12:13:10,https://v.redd.it/5y05jas487cc1
"Bro sent me this clip, I couldn’t stop laughing.",Prior-Fish4681,1043,2024-10-19 16:40:05,https://v.redd.it/y7ig3z0arqvd1
A Gas mine skin that has to be in the game...,MurkyMegagoat,1049,2024-04-12 19:41:49,https://www.reddit.com/gallery/1c2i9va
Introducing: The Goo Plane!,Lethal_Lime_,1049,2024-05-11 05:02:54,https://v.redd.it/6km4pmj0cqzc1
"Phew, that was close... wait what?",Knooper_Bunny,1044,2024-10-04 07:04:22,https://v.redd.it/dld60ixluosd1
Yoooo PS4 gameplay dropped,Coyotepetersun2,1045,2024-11-23 12:55:57,https://v.redd.it/219t3zy6fn2e1
How to counter lights dashing away from you after a hook (part 2):,ErosHD,1046,2024-11-13 03:33:10,https://v.redd.it/nk6z325e8l0e1
What do you guys think about the new Mil Sim Skin?,PartyRooster,1045,2024-01-16 23:05:36,https://i.redd.it/8yc9c9ahvvcc1.png
A peak of a video I'm making,Ven_n,1038,2024-08-17 15:31:13,https://v.redd.it/gzdeskjft8jd1
Hopefully this game never dies.,N/A,1040,2024-03-17 02:50:50,https://www.reddit.com/r/thefinals/comments/1bgn9af/hopefully_this_game_never_dies/
I cropped and trimmed the trailer to be a steam banner (: ,W-person362,1032,2024-12-02 17:49:50,https://v.redd.it/zunfit6o1h4e1
smoothest plug oat ,______________G9,1033,2024-12-11 04:55:37,https://v.redd.it/j4pi905wh56e1
Skin Concepts / Home Appliances Edition,RedMa5k,1034,2024-05-26 16:33:54,https://www.reddit.com/gallery/1d158ot
Streamer chases me down every life after I kill him twice...and he says I'M the one that's obsessed,Worldly-Passage-936,1043,2024-07-10 23:53:04,https://v.redd.it/gfklhoh14sbd1
Season 5 RPG For Medium Class? (Did Embark Just Confirm This?) ,IZEDEPTIC,1043,2024-11-17 13:53:59,https://v.redd.it/u1lq4b81wg1e1
Why is no one talking about this? There is a new credit screen every season,Ok_Concentrate_9861,1029,2024-09-08 16:10:09,https://v.redd.it/hw1halzh0mnd1
Goo Barrel doing Goo Barrel things sigh,OkeeYokee,1032,2024-10-18 16:25:08,https://v.redd.it/x6s2r1tmjjvd1
Hear me out.. this wheel could use a “Sorry” “My bad” button,Illustrious_Lie573,1024,2024-10-14 16:32:09,https://i.redd.it/0fdfad5b1rud1.jpeg
Why don't they give light a revive button too?,Arjannn,1030,2024-01-07 14:36:32,https://www.reddit.com/r/thefinals/comments/190tgk9/why_dont_they_give_light_a_revive_button_too/
Me whenever I see a red canister,KineticEnergyFormula,1023,2024-09-18 18:58:16,https://i.redd.it/np2ba5jl7mpd1.jpeg
This new crosshair update is peak.,Mawntee,1026,2024-08-21 09:48:51,https://v.redd.it/yvtnpfv3ozjd1
New s5 content!,OswaldTicklebottom,1022,2024-12-08 14:15:57,https://i.redd.it/r74gw235vm5e1.jpeg
Not the sharpest oppponents but a 1v5 clutch is a 1v5 clutch,iiskiiee,1024,2024-07-08 06:23:18,https://v.redd.it/hess4fb7n8bd1
Stupid light gets market gardened by a pro gamer,PootisBird001,1020,2024-12-10 01:25:25,https://v.redd.it/62o8cy3fbx5e1
Did he just 9/11 the platform?,AccomplishedSuit2518,1023,2024-06-25 08:59:50,https://v.redd.it/zb0nb6k9no8d1
"This is who you're teabagging at, if you even care",Mambosaurio,1018,2024-06-05 20:12:05,https://i.redd.it/5g1mcdu49t4d1.png
Going from The Finals to XDefiant...,Fabulous_Cat2691,1029,2024-05-22 10:31:45,https://www.reddit.com/r/thefinals/comments/1cxx0vl/going_from_the_finals_to_xdefiant/
The Worst Play You'll See Today...,TruceBrian,1016,2024-03-31 18:05:58,https://v.redd.it/i0kizcmemprc1
A Heavy's Determination,TURNUP159,1018,2024-01-24 21:28:20,https://v.redd.it/wqqb3h1ghgec1
Oh boy I’m gonna look so cool with my urban operative set!,PapaStalin924,1025,2024-01-08 23:48:53,https://i.redd.it/5c614gszzabc1.jpeg
Is it too much or an over statement to say The Finals is the best shooter out right now or at least the most creative/fresh?,Zilly_JustIce,1019,2024-10-24 16:55:19,https://www.reddit.com/r/thefinals/comments/1gb7fqd/is_it_too_much_or_an_over_statement_to_say_the/
There's no changing them,typothetical,1016,2024-04-29 18:27:18,https://i.redd.it/uzkfs3mpogxc1.jpeg
When a heavy learns about terminal velocity,Insanopatato,1016,2024-11-25 18:02:36,https://v.redd.it/qf0k4hyj733e1
People that get mad at you for using an off-meta loadout in an unranked game mode all look like this: ,AnotherAverageGamer_,1015,2024-09-18 15:35:07,https://i.redd.it/bbuiweof7lpd1.jpeg
What listening to The Finals soundtrack feels like,No-Veterinarian-1775,1011,2024-06-29 17:55:57,https://v.redd.it/utuqbp1ltj9d1
Powershift is so fun ,Coookiephoenix,1016,2024-09-06 13:14:20,https://i.redd.it/mxb54fidv6nd1.png
Contestants be like:Hell yeah,TrapStylez,1010,2024-10-10 07:25:15,https://i.redd.it/68s36623svtd1.png
Already missing it💔,Mambosaurio,1014,2024-05-22 00:42:43,https://i.redd.it/tk8dj9qqjv1d1.png
Jump pad coaster,Saucy-Nipples,1007,2024-11-02 09:49:46,https://i.redd.it/23zbs74umgyd1.jpeg
I know they just added the cardboard riot shield but hear me out… little times riot shield,Thin-Storage3364,1009,2024-03-20 18:14:34,https://i.redd.it/5xd78zaz5jpc1.jpeg
Finals is the best shooter out right now,Cultural-Doubt1554,1013,2024-03-15 00:57:54,https://www.reddit.com/r/thefinals/comments/1bf1f6g/finals_is_the_best_shooter_out_right_now/
Me when m11 player,pigeonier,1010,2024-12-18 19:57:15,https://i.redd.it/evtbfpj5xn7e1.gif
Nostalgia for my favorite game mechanic... 🥹,Keylonar,1009,2024-12-09 09:08:48,https://v.redd.it/fe1a74vsgs5e1
I think the defibb nerf worked 😂🤣,Gullible-Ear-4495,1003,2024-01-25 04:15:50,https://v.redd.it/42x9jm05iiec1
Deagle Inspect animation Bug,Suspicious-Common-82,1006,2024-11-13 19:19:22,https://v.redd.it/xhfj0crgyp0e1
Reminder to give the win to solo contestants ,Sorry_Reason4347,1003,2024-09-18 09:51:53,https://i.redd.it/68cebs07ijpd1.png
Fair and balanced,EasyAntiYeet,1040,2024-01-02 16:43:14,https://v.redd.it/yb48gvxb22ac1
Unpopular opinion: You people are delusional about cosmetics (a bit of a rant),ninoski404,1004,2024-11-13 11:26:58,https://www.reddit.com/r/thefinals/comments/1gqarf2/unpopular_opinion_you_people_are_delusional_about/
New Nerfed Defibrillator in The Finals Season 2,ottrboii,1005,2024-03-13 16:48:00,https://v.redd.it/5f6j82u0s4oc1
My mum has been painting hightops for me close to 10 years. Here's her latest work: THE FINALS,Kronzo888,1003,2024-03-30 20:18:47,https://www.reddit.com/gallery/1brr8m8
2.0.0 Patch Notes,TrxSv,1002,2024-03-14 10:35:39,https://www.reachthefinals.com/patchnotes/200
Ive played dash for 400h in this game ,New_Bad_1504,1034,2024-07-24 11:24:22,https://v.redd.it/jp70kcnkbged1
"""Go play Bank It, you'll get 1K fans per game"" ",callilol,1001,2024-11-23 16:23:07,https://i.redd.it/nxf7ofu0go2e1.png
New crosshair options are pretty cool,StainsMountaintops,1005,2024-08-22 15:54:00,https://i.redd.it/oentnmi3m8kd1.png
Figured the new revolver skin needed a little...something more.,FrostBumbleBitch,1003,2024-11-01 16:40:00,https://i.redd.it/4whw7oh3jbyd1.png
Theyre gonna cry when the sun blows up.,ColonelBag7402,1000,2024-09-28 13:54:16,https://i.redd.it/h9l1xj2i2krd1.png
Best part of the 1 year anniversary video 🤣,BBUCKLESS,995,2024-12-07 20:39:38,https://v.redd.it/w2xhimkjmh5e1
Me whenever I see an enemy turret,Platyplysm,1005,2024-01-16 16:27:44,https://i.redd.it/22w02mrgwtcc1.png
"had a cheater in my match last night, woke up to this",hyperswyper,996,2024-11-28 15:06:06,https://i.redd.it/y1mwad1vqn3e1.png
"At last, the trio is complete..",ReffiComics,999,2024-07-24 23:17:22,https://v.redd.it/vco7s4soujed1
This is how some of y'all's posts read.,DiscombobulatedDunce,1001,2024-05-14 18:34:23,https://i.redd.it/u86i1b3hrf0d1.jpeg
I don't care what class you main. Everyone should experience cannonballing off the crane into a cashout at least once.,SmeachThePeach,996,2023-12-26 22:43:52,https://v.redd.it/6ywnym68wp8c1
$26 tips for heavy! (Motion Sensor),Xetotorian,995,2024-07-04 18:50:52,https://v.redd.it/jyazwln2tjad1
Gravity Cube Tip #1: Slide jump to reach high buildings faster ,Chata_da_god,992,2024-12-02 02:53:24,https://v.redd.it/omqam7hwnc4e1
Anyone else notice this?,habihi_Shahaha,996,2024-01-28 18:35:52,https://www.reddit.com/gallery/1ad9hkd
Nerf riot shield.,OPL11,999,2024-11-03 12:56:53,https://v.redd.it/d4v1aq1uooyd1
Visited Embark HQ,frontpageroadrage,991,2024-09-07 02:53:58,https://v.redd.it/6py8ybrkxand1
Actually love this grenade skin!,Wheatleyarts,993,2024-02-08 14:51:11,https://v.redd.it/xgesgek7kdhc1
The most underrated change this patch:,ShadeVex,1000,2024-10-10 09:17:22,https://i.redd.it/7uiq0yd3cwtd1.png
Make Me Proud Little Guy,Endless_Aspire,988,2024-10-25 21:13:52,https://i.redd.it/v1g6mk5hxywd1.jpeg
"If Heavy gets nerfed again, his specialization will just be an apology letter.",gr8y22,995,2024-10-24 07:35:59,https://i.redd.it/ry4d82qrqnwd1.jpeg
Ive had this quest for weeks now and i still can't get it done (im going insane),Me_how5678,985,2024-04-27 11:14:54,https://i.redd.it/tzjgf1hl90xc1.gif
Some of you make me sick,N/A,991,2024-03-23 12:40:08,https://i.redd.it/x1gfs1q1x2qc1.jpeg
Goofy ahh physics.,Siqka,980,2024-11-25 14:05:45,https://v.redd.it/98w91yz8123e1
"The Finals is “too much for the COD brain”, Shroud claims",faizyMD,989,2024-01-08 18:49:22,https://www.theloadout.com/the-finals/shroud-call-of-duty
Challenge accepted,lowkeyyy444,982,2024-05-16 17:23:28,https://i.redd.it/820d1sgtot0d1.jpeg
Situational light moment,christophoroos,981,2024-02-18 12:16:26,https://v.redd.it/3o95dngs5cjc1
Ranked solo Q be like…,Highsenberg199774829,982,2024-03-08 04:34:59,https://i.redd.it/r25f4rdtg1nc1.jpeg
folks at embark deserve the sloppiest head when they wake up 🎀,obsidian1212,983,2024-06-13 11:52:14,https://v.redd.it/2ijwelg4vb6d1
This was on the final round of world tour btw,gorilla_fan,985,2024-07-20 12:48:49,https://v.redd.it/g5io3k327odd1
Trade Offer from a certified medium,SuperGhostGun,982,2024-10-19 18:10:42,https://i.redd.it/1dm4uqdd7rvd1.png
Pro tip: enemies can't legally nuke you without your consent!,GoldenRush257,982,2024-05-06 15:16:06,https://v.redd.it/u88k9wxtotyc1
He called the Avengers on me,DimentioGaleksie,978,2024-10-16 17:21:05,https://v.redd.it/q2h01qwjj5vd1
"The Finals now has youtube adds, Hopefully this will bring the playercount up quite a bit",SadAthlete747,986,2024-04-30 20:54:21,https://i.redd.it/a4e3l1mmjoxc1.png
"Best skins ever incoming, praise be to Embark",caterpillar_t70c,980,2024-03-27 11:39:53,https://i.redd.it/z9elblzx5vqc1.jpeg
Nostalgia hit me in the eye,Fuzzy-South-599,982,2024-12-08 17:09:11,https://i.redd.it/mu1qrcu1qn5e1.jpeg
Made a little something on the 3D printer ,EDG16_17,986,2024-10-28 03:35:31,https://i.redd.it/kctye5bi3fxd1.jpeg
"Body blocking a stealing teammate like,",New_Bad_1504,980,2024-11-02 21:58:23,https://i.redd.it/2g1ypg0u8kyd1.jpeg
FOR NEW BEST MAP,Craselinov,981,2024-09-15 18:18:16,https://www.reddit.com/gallery/1fhj85e
Embark you need better name bans,Upset_Possession_533,983,2024-10-13 20:22:09,https://i.redd.it/z0lhxvdf1lud1.jpeg
Wholesome solo queue moment,maxperhour,975,2024-09-14 20:25:18,https://v.redd.it/b7uf63ve3uod1
I wiped entire team with crane falling apart,R4CCOON1,973,2024-08-26 16:06:50,https://v.redd.it/x6kw2oo381ld1
"Spotted in Northgate, anyone know what it’s about?",WalicoWoe,974,2024-07-12 06:08:36,https://i.redd.it/nhcvm8hwu0cd1.jpeg
New emote in The Finals - Um Actually ☝🤓,Meskotur,979,2024-11-10 21:07:02,https://v.redd.it/zekfk8kx250e1
The finals community just reached $250B ,lSkyrunnerl,976,2024-03-06 06:41:52,https://i.redd.it/5yy761rmtnmc1.jpeg
This is how I always imagined Scotty and June,jadenAWD,976,2024-10-07 20:42:41,https://i.redd.it/q4eu53hmbetd1.jpeg
Everyone plays to win. We play to snap,itsmahveltime,980,2024-01-22 21:56:32,https://v.redd.it/d6629d3lc2ec1
16$ for a FUCKING BLUE? This garbage is so low effort you can speedrun it under 5 seconds...,MrCreamCoffee,975,2024-12-04 15:08:01,https://v.redd.it/y3em39wtju4e1
how it feels half the time dealing with lights,TimothysFruad,988,2024-01-08 23:23:05,https://i.redd.it/oh3cuop6vabc1.jpeg
Can't see where the sniper is,thambassador,971,2024-11-10 03:51:19,https://www.reddit.com/gallery/1gnry02
"ok, just listen...",ENDRAER,970,2024-05-12 14:56:00,https://i.redd.it/5l9p3ajte00d1.png
That's it. Bernal is my favorite map in the game,Yaluzar,966,2024-12-13 19:12:09,https://images.squarespace-cdn.com/content/v1/62d66fa29e72c560f8efc020/6c6252b1-294b-43e7-8d1a-f68b7e8e7d71/Bernal.jpg?format=1000w
TEXT CHAT IS COMING!!,typothetical,967,2024-05-08 16:11:01,https://i.redd.it/dyvrzo8k88zc1.png
[Concept art] Some medical themed items I had in mind,SulfurousDragon,967,2024-11-13 20:38:35,https://i.redd.it/eiv6tx6mcq0e1.png
"Well well well, from Embarks official balance notes",Xerqthion,1183,2024-09-26 12:23:31,https://i.redd.it/um0o32mjc5rd1.png
How is it going for y'all? ,Black-_-Phoenix,963,2024-06-18 11:51:41,https://i.redd.it/c0j75xdpjb7d1.jpeg
This post is for contracted Holtow🟧™️ members only.,theunscrewedspartan,967,2024-09-28 18:16:05,https://i.redd.it/2qtouum9dlrd1.jpeg
Dead go boom is finally gone!!!,ttvimShinyatheninja,980,2024-02-08 09:58:49,https://www.reddit.com/r/thefinals/comments/1alsat8/dead_go_boom_is_finally_gone/
