Title,Author,Score,Created_UTC,URL
"The court ordered Automattic to restore WP Engine's access to WordPress.org, Remove the ""Not Affiliated with WP Engine Checkbox"" on the login page, remove the list of customers who allegedly left WP Engine, and more.",onairmarc,8,2024-12-12 15:48:26,https://techcrunch.com/2024/12/10/court-orders-mullenweg-and-automattic-to-restore-wp-engines-access-to-wordpress-org
Introducing Limbo: A complete rewrite of SQLite in Rust,jabawack81,9,2024-12-12 12:11:48,https://turso.tech/blog/introducing-limbo-a-complete-rewrite-of-sqlite-in-rust
"What happened to the ""my development setup is better than yours"" video?",PhillipDeLarge,10,2024-12-06 11:54:11,https://www.reddit.com/r/theprimeagen/comments/1h7zor1/what_happened_to_the_my_development_setup_is/
You have built an Erlang,ryanwinchesterdev,9,2024-11-29 13:50:01,https://vereis.com/posts/you_built_an_erlang
"Goodbye, Rust. I wish you success but I'm back to C++ (sorry, it is a rant)",AdearienRDDT,9,2024-11-27 17:02:07,/r/rust/comments/1h15md8/goodbye_rust_i_wish_you_success_but_im_back_to_c/
 Apple Intelligence is for the Stupid Ones ,StilgarTF,9,2024-11-19 06:48:10,https://youtu.be/D0V554NyXWM
History Of Regex Engine ,GopherLearnsSt4t,8,2024-11-19 02:40:58,https://compileralchemy.substack.com/p/regex-engines-history-and-contributions
Teach me simple software design,Jeggerrrrrrrrrrz,9,2024-11-16 18:11:55,https://www.reddit.com/r/theprimeagen/comments/1gst7l2/teach_me_simple_software_design/
Sometimes moving teams or companies is the fastest way to get promoted ,dalton_zk,8,2024-11-09 13:06:23,https://i.redd.it/g1vkdbrakvzd1.jpeg
Don't ask AI to write your code bruh,SSSniperCougar,9,2024-11-12 16:28:22,https://youtu.be/LxehKQ8HTL4?si=0ZSAiMLRM9sgZJ4g
Glyph editor is probably what the god of thunder would use,BroadbandJesus,8,2024-11-05 04:08:08,https://x.com/zack_overflow/status/1853494692169896361?s=46&t=eS_dJtjCz6p_9g5xvh18NQ
Netflix goes from React to Vanilla JS,BroadbandJesus,9,2024-10-29 22:46:36,https://youtu.be/XtOLyo-3tzA?si=cllh2zsCoEXYWipy
Deez Nuts ,Murky_Limit_5544,9,2024-10-25 15:32:16,https://v.redd.it/szkegxomhlwd1
When is too much yaml too much?,nucLeaRStarcraft,10,2024-10-22 20:29:07,https://i.imgur.com/yPC6G6L.png
The Great Gaslighting of the JavaScript Era,Moayed_Alkamel,9,2024-10-12 23:56:45,https://www.spicyweb.dev/the-great-gaslighting-of-the-js-age/
"Hackers take control of robot vacuums in multiple cities, yell racial slurs",ShadeEleven,9,2024-10-19 02:09:35,https://www.reddit.com/r/theprimeagen/comments/1g6yrgh/hackers_take_control_of_robot_vacuums_in_multiple/
Flip Keep it Inn,SSSniperCougar,9,2024-10-08 17:57:42,https://i.redd.it/rgl57rr3nktd1.jpeg
Leaving Rust gamedev after 3 years [96 mins read],SilverBug78,9,2024-10-06 16:08:27,https://www.reddit.com/r/theprimeagen/comments/1fxjztw/leaving_rust_gamedev_after_3_years_96_mins_read/
What LLMs For Coding Should Actually Look Like,feketegy,8,2024-09-30 07:05:26,https://sotergreco.com/what-llms-for-coding-should-actually-look-like
I made Elden Ring in Excel.,eva01pilothmm,10,2024-09-27 17:05:54,/r/Eldenring/comments/1fqir4h/i_made_elden_ring_in_excel/
Where can I listen to Hack And Stache?,Maskdask,8,2024-09-30 06:54:51,https://www.reddit.com/r/theprimeagen/comments/1fsphih/where_can_i_listen_to_hack_and_stache/
Quarkus (Java) vs Fiber (Go): Performance Benchmark in Kubernetes #201,Rustin007,8,2024-09-24 12:02:46,https://youtu.be/PL0c-SvjSVg
Return of the Amazonian,andre_rodi,10,2024-09-19 15:09:38,https://i.redd.it/802npq0s7spd1.png
Wonderful vi - DHH,ChampionshipSmall596,8,2024-09-17 22:15:22,https://world.hey.com/dhh/wonderful-vi-a1d034d3
Why Scrum is Stressing You Out,feketegy,7,2024-09-15 08:23:17,https://rethinkingsoftware.substack.com/p/why-scrum-is-stressing-you-out
Terminal + IDE + Vim as a Jr. Self Taught Dev,Sn-cy,8,2024-09-14 22:54:45,https://www.reddit.com/r/theprimeagen/comments/1fgyaek/terminal_ide_vim_as_a_jr_self_taught_dev/
Leaving Rust gamedev after 3 years,brat_semaphored,10,2024-09-09 23:37:49,https://loglog.games/blog/leaving-rust-gamedev/
"Exclusive: Laravel, an open source startup in Arkansas founded by Taylor Otwell, raises $57 million Series A from Accel",holocene7,8,2024-09-05 18:16:56,https://fortune.com/2024/09/05/laravel-raises-57-million-series-a-from-accel/
Zoomers are smarter than Primeagen thinks,NectarineUnited6364,10,2024-09-02 01:14:56,https://youtu.be/OI4DbECnp8A?si=DwejkY7efFLcBaNH
Telegram CEO arrested in France,one_more_byte,9,2024-08-25 00:53:10,https://www.reuters.com/world/europe/telegram-messaging-app-ceo-pavel-durov-arrested-france-tf1-tv-says-2024-08-24/
Why is Japan So Weak in Software?,feketegy,9,2024-08-20 15:04:03,https://youtu.be/ky1nGQhHTso?si=Lp21jBHtHII8NXrU
"Factorio teaches you software engineering, seriously.",UnbreakablePaperBag,9,2024-08-08 16:15:07,https://www.youtube.com/watch?v=vPdUjLqC15Q
US Gov to convert all C to Rust,Accomplished-Diet566,9,2024-08-01 07:45:20,https://www.youtube.com/watch?v=anfCoIGP8HM
The difference between you and ThePrimeagen. ,ilovecandy_uwu,9,2024-08-06 12:17:16,https://www.youtube.com/watch?v=8UumdecztKk
Uncle Bob video ,Looploop420,8,2024-07-09 21:02:53,https://www.reddit.com/r/theprimeagen/comments/1dzdgs6/uncle_bob_video/
Primeagen on Hasan,No_Travel,8,2024-07-09 08:01:56,https://www.reddit.com/r/theprimeagen/comments/1dywwi8/primeagen_on_hasan/
"Exploring a New Approach to Realistic Lighting: Radiance Cascades
",CuteAndSweetAsCandy,9,2024-07-02 17:13:05,https://youtu.be/3so7xdZHKxw
AI Hype is completely out of control - especially since ChatGPT-4o (Internet of Bugs),amrojjeh1,9,2024-06-10 20:01:01,https://www.reddit.com/r/theprimeagen/comments/1dcuzy1/ai_hype_is_completely_out_of_control_especially/
"Why is PS3 emulation so fast: RPCS3 optimizations explained
",godieph,9,2024-04-23 04:37:41,https://www.youtube.com/watch?v=19ae5Mq2lJE
The Unhinged Nature of GTA V Source Code,According_Pea_5567,10,2024-04-09 01:27:22,https://youtu.be/QZ6rLbu4LQw?si=HJhQG6PjEQwWoySg
what does prime use for website shortcuts,Cold-Beyond-8914,8,2024-05-31 07:44:45,https://www.reddit.com/r/theprimeagen/comments/1d4q51m/what_does_prime_use_for_website_shortcuts/
Comparing the performance of returning pointers vs. returning values,Conf8rmix,8,2024-03-29 11:25:10,https://youtu.be/ISOjCvpNiYA
Wth happened Primeagen all you need to know about git video?!,Jermu87,9,2024-03-22 07:02:51,https://www.reddit.com/r/theprimeagen/comments/1bkt7cy/wth_happened_primeagen_all_you_need_to_know_about/
"They call them 007: 0 line of code, 0 docs read, 7 video of the primeagen watched",2jesusisbetterthan1,9,2024-02-19 16:09:18,https://i.redd.it/v47mygw9gkjc1.png
LMAO,_prom_,10,2024-02-12 05:15:50,https://www.youtube.com/watch?v=sbdFwFDTDqU
Linux 6.8 Network Optimizations Can Boost TCP Performance For Many Concurrent Connections By ~40%,myrsnipe,10,2024-03-06 12:56:18,https://www.reddit.com/r/theprimeagen/comments/1b7z0o8/linux_68_network_optimizations_can_boost_tcp/
Faster baby faster 🥹🥺,b0a04gl,9,2023-12-29 12:06:42,https://v.redd.it/uzd8gkal589c1
What is your least favorite programming language?,Hashi856,8,2024-12-24 16:53:41,https://youtu.be/03lRzf7iSiU?si=VmP0sX7W79FjvnLn
Copilot is a real one,Radiant-Public-4238,9,2024-01-15 23:36:28,https://www.reddit.com/r/theprimeagen/comments/197nq19/copilot_is_a_real_one/
Italian group makes song about java,cciciaciao,7,2024-12-09 11:06:56,https://www.reddit.com/r/theprimeagen/comments/1ha7cfz/italian_group_makes_song_about_java/
ARC-AGI is a genuine AGI test but o3 cheated,fold_left,8,2024-12-23 17:39:48,https://www.lesswrong.com/posts/KHCyituifsHFbZoAC/arc-agi-is-a-genuine-agi-test-but-o3-cheated
"If Not React, Then What?",feketegy,8,2024-11-30 10:08:06,https://infrequently.org/2024/11/if-not-react-then-what
Meta's MySQL Fork You Never Knew About,dalton_zk,8,2024-12-17 13:22:10,https://kirshatrov.com/posts/facebook-mysql-fork
Cory Doctorow: What Kind of Bubble is AI?,NverKhachoyan,9,2024-11-21 23:05:55,https://locusmag.com/2023/12/commentary-cory-doctorow-what-kind-of-bubble-is-ai/
How Architecture Destroyed Software Development,rabinito,9,2024-11-20 12:06:28,https://www.youtube.com/watch?v=55_ke382o7c
"So, anthropomorphism? ",bonmas,8,2024-11-21 18:52:51,https://i.redd.it/f9rz7zp1xa2e1.png
"No, Quantum Computers Won't Break All Encryption",Practical-Ideal6236,9,2024-11-05 13:38:11,https://www.trevorlasn.com/blog/quantum-computers-wont-break-encryption
Why I Started Ditching Dependencies (And Why You Should Too!),AdearienRDDT,8,2024-11-18 19:09:35,https://youtube.com/watch?v=s_oT5bggjrc&si=yT7C_BFmVpExdPpS
'I was a software engineer in Silicon Valley - I quit and technology is not good for you.',ClickThese5934,8,2024-11-18 08:46:43,https://www.reddit.com/r/theprimeagen/comments/1gu0gtc/i_was_a_software_engineer_in_silicon_valley_i/
"College Students React to NeetCode Reacting to ThePrimeagen's This Algorithm is 1,606,240% FASTER",thetruechom,9,2024-10-28 19:03:50,https://www.youtube.com/watch?v=SF5PACAJlZw
Switch statements apparently aren't object orientated enough,JonoLF02,8,2024-11-04 08:23:26,https://www.reddit.com/r/theprimeagen/comments/1gj9jkx/switch_statements_apparently_arent_object/
"The company behind Arc is now building a second, much simpler browser",rstargaryen,7,2024-10-26 15:25:59,https://www.theverge.com/2024/10/24/24279020/browser-company-ai-browser-arc
Cognitive Load is what matters,feketegy,7,2024-10-21 12:31:59,https://github.com/zakirullin/cognitive-load
How I write HTTP services in Go after 13 years | Grafana Labs,feketegy,8,2024-10-18 09:59:14,https://grafana.com/blog/2024/02/09/how-i-write-http-services-in-go-after-13-years/
Hacking Kia: Remotely Controlling Cars With Just a License Plate,jabawack81,8,2024-10-16 11:26:38,https://samcurry.net/hacking-kia
Indeed is unhinged,DmitriRussian,9,2024-10-16 09:51:50,https://www.reddit.com/r/webdev/comments/1g4eob3/saw_this_on_a_job_application_on_indeed/
Chinese researchers break RSA encryption with a quantum computer,_fard,8,2024-10-15 12:18:28,https://www.csoonline.com/article/3562701/chinese-researchers-break-rsa-encryption-with-a-quantum-computer.html
How ergonomic is too ergonomic?,Karidus_423,9,2024-10-15 21:01:14,https://www.reddit.com/r/theprimeagen/comments/1g4ibpt/how_ergonomic_is_too_ergonomic/
Matt forked ACF,rapakanal,7,2024-10-12 19:48:28,https://wordpress.org/news/2024/10/secure-custom-fields/
The best engineering interview question I’ve ever gotten,Majestic_Rule9192,7,2024-10-07 05:27:35,https://www.reddit.com/r/theprimeagen/comments/1fy0dnn/the_best_engineering_interview_question_ive_ever/
First Lunch With New Hire Junior Developer,kushal_141,8,2024-10-05 14:16:38,https://youtu.be/QFI1jk3g1gs
Why should I learn Go?,bizzehdee,8,2024-09-18 22:24:17,https://www.reddit.com/r/theprimeagen/comments/1fk5fby/why_should_i_learn_go/
The Value of Source Code,Interesting-City8720,7,2024-10-02 01:40:24,https://www.reddit.com/r/theprimeagen/comments/1fu4ya3/the_value_of_source_code/
This one is good,Autumnlight_02,8,2024-09-09 15:05:00,https://www.builder.io/blog/oss-consequences
How Lazy Programmers Outperform Everyone,DovaJun,8,2024-09-09 08:47:48,https://youtu.be/oYZnFT-Ry4E?si=lNXuJUnGmXglpEIF
Your company needs Junior devs,Hamza12700,7,2024-09-08 18:47:28,https://softwaredoug.com/blog/2024/09/07/your-team-needs-juniors
HTMX 2.0 is here: Everything you must know about it,feketegy,9,2024-09-08 08:34:37,https://blog.openreplay.com/htmx-2-0-is-here/
Is my blue your blue?,dalton_zk,8,2024-09-03 12:26:47,https://ismy.blue/
A new browser I'm actually hyped about,clickyswitch06,9,2024-09-06 15:11:05,https://www.youtube.com/watch?v=tKM2N4TQHQY
Grace Hopper Is The Computer Queen | Letterman '86 [9:37],one_more_byte,8,2024-09-02 18:33:45,https://www.youtube.com/watch?v=oE2uls6iIEU
 Spring is the worst framework ever created ,khalloof_7,8,2024-09-01 14:26:17,https://youtu.be/lsyZj6LBvVA?si=QFODHE0msUmy8XTr
How does Prime navigate his cursor?,Careless-Cover8000,8,2024-09-01 11:13:50,https://www.reddit.com/r/theprimeagen/comments/1f6bzsc/how_does_prime_navigate_his_cursor/
We can only send emails up to 500 miles away,Specialist-Algae5655,7,2024-08-26 13:15:53,https://www.reddit.com/r/theprimeagen/comments/1f1ny7s/we_can_only_send_emails_up_to_500_miles_away/
DHH: Software estimates have never worked and never will,DerTimonius,7,2024-08-20 15:15:30,https://www.reddit.com/r/theprimeagen/comments/1ewy7ap/dhh_software_estimates_have_never_worked_and/
Company writes 1000 microservices in JavaScript,Ok_Put_4205,7,2024-08-11 12:07:20,https://www.reddit.com/r/theprimeagen/comments/1epj8wy/company_writes_1000_microservices_in_javascript/
Highly offensive Jonathan Blow clips to boost your productivity,hgk01,8,2024-08-03 17:58:04,https://www.youtube.com/watch?v=CgdKYBqe6QA
Interview with Product Manager in 2024 [Corporate],TehSinastria,8,2024-07-07 15:24:35,https://www.youtube.com/watch?v=SXM728bzYTE&ab_channel=Programmersarealsohuman
The moment we stopped understanding AI [AlexNet],godieph,8,2024-07-02 01:54:56,https://www.youtube.com/watch?v=UZDiGooFs54
i scraped twitter and compiled a list of the most important books to read with nextjs + turso (sqlite),_rittik,9,2024-06-17 10:57:59,https://v.redd.it/2g9xckh3547d1
I made my own web,Lol_Broo,8,2024-06-03 11:09:47,https://youtu.be/qiOtinFFfk8?si=k2UUl55WAyhXDWhc
"""No way to prevent this"" say users of only language where this regularly happens",willwill2will,7,2024-05-28 08:03:09,https://xeiaso.net/shitposts/no-way-to-prevent-this/CVE-2024-4323/
The Magic of RISC-V Vector Processing (The AGI CPU?),godieph,9,2024-05-31 03:25:17,https://www.youtube.com/watch?v=Ozj_xU0rSyY
rule,qwool1337,9,2024-05-26 07:18:38,https://i.redd.it/4m3qclz02q2d1.jpeg
Rollnaldo-release,ray_krocs,8,2024-05-25 18:59:26,https://i.redd.it/0sdon9x4em2d1.jpeg
Do you also play?,leiswatch,9,2024-04-26 15:00:41,https://www.reddit.com/r/theprimeagen/comments/1cdnmbg/do_you_also_play/
Amazon Announces Plans to Fix S3 Bucket Issue,freebytes,8,2024-05-06 19:19:24,https://www.reddit.com/r/theprimeagen/comments/1clrj8g/amazon_announces_plans_to_fix_s3_bucket_issue/
What are the rules of programing?,rejectedlesbian,8,2024-04-20 20:58:51,https://www.reddit.com/r/theprimeagen/comments/1c90cdu/what_are_the_rules_of_programing/
Primeagen and Theo on Harry Mack Freestyles at the Streamer Awards Video (start at 6:27),marta_bach,9,2024-03-29 16:39:33,https://www.youtube.com/watch?v=sKHJqK7SGm8&t=387s
How old is Agen?,AndrewTateIsMyKing,8,2024-02-18 21:10:11,https://www.reddit.com/r/theprimeagen/comments/1au4ya4/how_old_is_agen/
I'm going back to vscode,JsonFt,8,2024-01-11 01:20:19,https://www.reddit.com/r/theprimeagen/comments/193p4tk/im_going_back_to_vscode/
Salmonella Baldman,holistic-engine,8,2024-12-20 06:42:37,https://v.redd.it/3jgczoi69y7e1
Perfect language for streamer-programmer!,gwenddolau,7,2024-12-21 11:50:14,https://tabloid.vercel.app/
Meta translate 10 millions lines of Java to Kotlin at Scale,dalton_zk,7,2024-12-22 18:22:49,https://engineering.fb.com/2024/12/18/android/translating-java-to-kotlin-at-scale/
Leaked GTA6 Depot,mix3dnuts,6,2024-12-12 10:06:07,https://i.redd.it/y8glhtu76e6e1.jpeg
Software Developers Statistics 2024 - JetBrains State of Developer Ecosystem Report,onairmarc,8,2024-12-16 14:50:49,https://www.jetbrains.com/lp/devecosystem-2024/
Digital consumption keeps me from getting better at my job,_armagheadon,6,2024-12-11 12:22:19,http://sibervepunk.com/digital-consumption.html
Writing down (and searching through) every UUID · eieio.games,feketegy,7,2024-12-07 09:15:21,https://eieio.games/blog/writing-down-every-uuid/
This is what makes software so expensive - Kent Beck,dalton_zk,8,2024-12-08 21:03:15,https://youtu.be/ZHpQs46xizQ?si=bxj8QbQs_EU1QN-z
What your Programming Language says about You [10:38],Remarkable_Ad_5601,8,2024-12-06 19:51:38,https://youtu.be/3DvBGGZfH-I
java hellowworld song ,Normal_Youth104,6,2024-12-04 10:04:46,https://www.reddit.com/r/theprimeagen/comments/1h6co9e/java_hellowworld_song/
Most Devs are Hired NOT to Create New Software,dalton_zk,8,2024-11-29 14:55:49,https://youtu.be/XJBcpQ2pyYk?si=16D5HhnTXmfhLOLZ
A perfect stop frame of Prime for Head First JavaScript book,SmileyAverage,7,2024-12-02 09:43:51,https://i.redd.it/t50df7a1oe4e1.png
Why Fly.io built their own scheduler,Megalomart-maniac,8,2024-11-27 11:20:48,https://youtu.be/dy2RJdDEvO0?si=hoQHgOlUzzTggmbG
Hyrum's Law in Golang,wilkesreid,7,2024-11-22 15:09:08,https://abenezer.org/blog/hyrum-law-in-golang
Processing 40 TB of code from ~10 million projects with a dedicated server and Go for $100,GandalfTheChemist,7,2024-11-26 18:31:37,https://www.reddit.com/r/theprimeagen/comments/1h0izpa/processing_40_tb_of_code_from_10_million_projects/
Advance algorithms course,IamUsike,6,2024-11-21 14:32:45,https://www.reddit.com/r/theprimeagen/comments/1gwhmx0/advance_algorithms_course/
David Heinemeier Hansson joins Shopify’s board: 20 years in the making,dalton_zk,7,2024-11-21 03:13:24,https://www.shopify.com/news/david-heinemeier-hansson-board
KISS with your neovim,TheMotionGiant,6,2024-11-20 03:01:28,https://youtu.be/Rck52SBMSyU?si=pjXCC25XY66eYs26
The Pokemon Go Spying Conspiracy Theory?  Yeah.  It's Verified. (19:04),bore530,8,2024-11-20 13:51:10,https://youtube.com/watch?v=EVmZy95vMUc&feature=shared
Did Linux Just Get 40x Faster?,ItsMeursault,8,2024-11-16 10:10:40,https://www.youtube.com/watch?v=m9dZkRwWEj8
Can we get a debrief why Netflix crashed?,redbeanpanda,7,2024-11-16 06:31:17,https://www.reddit.com/r/theprimeagen/comments/1gshcgy/can_we_get_a_debrief_why_netflix_crashed/
"Malicious PyPI package with 37,000 downloads steals AWS keys",jaderubini,6,2024-11-10 15:36:43,https://www.bleepingcomputer.com/news/security/malicious-pypi-package-with-37-000-downloads-steals-aws-keys/
Is it true that Odin can't be as fast as Zig/Rust because all LLVM optimizations aren't possible? - #2 by gingerBill - Explain - Odin,Financial_Airport933,7,2024-11-05 05:06:16,https://forum.odin-lang.org/t/is-it-true-that-odin-cant-be-as-fast-as-zig-rust-because-all-llvm-optimizations-arent-possible/221/2
icanhazip: How a simple IP address tool survived a deluge of users,StarflowerR57-08,7,2024-11-04 21:51:12,https://www.reddit.com/r/theprimeagen/comments/1gjqcxc/icanhazip_how_a_simple_ip_address_tool_survived_a/
Regex pattern to produce prime numbers…,GopherLearnsSt4t,7,2024-10-31 02:02:05,https://youtu.be/5vbk0TwkokM?si=5vfbNYi0vICUr3aQ
Scrum doesn't have to suck,raedslab,7,2024-10-30 20:17:16,https://blog.raed.dev/posts/scrum_doesnt_have_to_suck
Found this beauty in node source code,Hamza12700,6,2024-10-29 18:46:32,https://i.redd.it/e324pjxwqqxd1.png
I see,After-Decision5601,8,2024-10-27 11:19:32,https://www.reddit.com/r/theprimeagen/comments/1gd8qdx/i_see/
This is crazy they banned Colorado because of systems76????,EfficientProblem2555,8,2024-10-24 20:23:11,https://www.reddit.com/r/theprimeagen/comments/1gbcecu/this_is_crazy_they_banned_colorado_because_of/
Erlang; The Movie,nwjlyons,7,2024-10-26 21:25:07,https://youtu.be/xrIjfIjssLE
"Sanctions Hit Linux Kernel, Russian Programmers Banned [16:41]",Hungry_Seat8081,6,2024-10-24 17:34:52,https://youtu.be/L5Ec5jrpLVk?si=K_LCRWXhwn7nVF-J
Exception vs Errors,andres2142,8,2024-10-23 01:21:10,https://www.youtube.com/watch?v=Iflu9zEJipQ
this is a real linux user experience,Agile_Buddy,7,2024-10-21 20:50:48,https://www.reddit.com/r/theprimeagen/comments/1g90gkt/this_is_a_real_linux_user_experience/
Casey on Rust and Smart pointers [~30mins],UdPropheticCatgirl,8,2024-10-21 12:47:14,https://youtu.be/xt1KNDmOYqA?si=l0xh1qB5DXx5cOu5
Concerns Raised Over Bitwarden Moving Further Away From Open-Source,joseluisq,7,2024-10-20 16:16:29,https://www.phoronix.com/news/Bitwarden-Open-Source-Concerns
Why NextJS is better.,lilsaf98,7,2024-10-15 11:57:01,https://www.reddit.com/r/theprimeagen/comments/1g45w8q/why_nextjs_is_better/
 How Notion Scaled to 100 Million Users Without Their Database Exploding ,edumi_pt,8,2024-10-19 15:04:24,https://youtu.be/HruBoinmPBA?si=owMljiR_gM_Xm7-8
I spent 382 hours learning Rust and all I got was…,GopherLearnsSt4t,7,2024-10-15 02:41:57,https://medium.com/@ryanrothweiler/i-spent-382-hours-learning-rust-and-all-i-got-was-this-shiny-monkey-0f3163e06921
Home Depot software devs to start having to spend 1 day per quarter working a full day in a retail store,one_more_byte,8,2024-10-07 21:51:37,/r/cscareerquestions/comments/1fycv29/home_depot_software_devs_to_start_having_to_spend/
How Cloudflare auto-mitigated world record 3.8 Tbps DDoS attack,KingCoelho00,7,2024-10-03 13:59:59,https://www.reddit.com/r/theprimeagen/comments/1fv8fgc/how_cloudflare_automitigated_world_record_38_tbps/
Leaving tech forever,Emergency_Camel2604,9,2024-10-02 12:23:38,https://www.reddit.com/r/theprimeagen/comments/1fuevvd/leaving_tech_forever/
The worst API ever made - Casey Muratori,No_Thanks_9134,8,2024-10-02 04:06:08,https://caseymuratori.com/blog_0025
"Go is my hammer, and everything is a nail.",Sea-Election6308,8,2024-10-01 07:20:22,https://www.maragu.dev/blog/go-is-my-hammer-and-everything-is-a-nail
Secret shopping framework laptops (LTT video),syntaxsmurf,7,2024-09-30 17:11:03,https://www.youtube.com/watch?v=tE89COeFw7I
Hacking Linux via CUPS,Megalomart-maniac,7,2024-09-26 20:03:36,https://www.evilsocket.net/2024/09/26/Attacking-UNIX-systems-via-CUPS-Part-I/
Writing Youtube with a Bash Backend,Kyu_TheFox,7,2024-09-29 11:13:36,https://www.youtube.com/watch?v=b_WGoPaNPMY
This is why you can't blindly use AI [08:57],anurag_dev,7,2024-09-26 15:08:50,https://youtu.be/QZWPdJUwxls?si=NSg6JuaNMz_j3qvs
"Godot Responds to Mass Banning - No Apology, Blames Banned Users (31:49)",bore530,8,2024-10-01 06:09:05,https://www.reddit.com/r/theprimeagen/comments/1fthb6m/godot_responds_to_mass_banning_no_apology_blames/
Microservices are Technical Debt (NeetCode interviews DoorDash Principal Engineer),chickensalt72,7,2024-09-23 06:55:02,https://www.youtube.com/watch?v=LcJKxPXYudE
I was using AI tools wrong and maybe you're too!,Chaoticbamboo19,7,2024-09-21 06:33:02,https://www.reddit.com/r/theprimeagen/comments/1flwtt8/i_was_using_ai_tools_wrong_and_maybe_youre_too/
Rory Sutherland – Are We Now Too Impatient to Be Intelligent? | Nudgestock 2024 ,NucularLemon,7,2024-09-19 06:44:42,https://www.reddit.com/r/theprimeagen/comments/1fkemrv/rory_sutherland_are_we_now_too_impatient_to_be/
"BitKeeper, Linux, and licensing disputes: How Linus wrote Git in 14 days (mentioned in DHH interview)",dalton_zk,7,2024-09-18 13:51:23,https://graphite.dev/blog/bitkeeper-linux-story-of-git-creation
"To NeoVim, Or Not to NeoVim",kernel_p,8,2024-09-18 12:06:53,https://rwx.gg/tools/editors/neovim/
Real 10x Programmers Are SLOW To Write Code,Chrome102,8,2024-09-18 08:22:53,https://www.youtube.com/watch?v=2ClljZaK6_A
Please tell me Im not the only one who thinks this is horrible,ChrisXD_,6,2024-09-15 22:38:48,https://www.youtube.com/watch?v=dCuefNScYKM
Building a healthy and sustainable funding model for open source software,feketegy,6,2024-09-16 07:06:31,https://www.andreagrandi.it/posts/building-healthy-sustainable-funding-model-opensource-software/
"Passwords have problems, but passkeys have more",feketegy,7,2024-09-09 17:14:16,https://world.hey.com/dhh/passwords-have-problems-but-passkeys-have-more-95285df9
Setting up a production ready VPS is a lot easier than I thought.,Moayed_Alkamel,7,2024-09-07 13:26:57,https://www.youtube.com/watch?v=F-9KWQByeU0
Users don't like new Reddit design,humulupus,6,2024-09-09 10:43:34,https://new.reddit.com/r/help/comments/1ehmgmr/next_steps_for_newredditcom/
A Rant about Front-end Development,FrogManSnek,7,2024-09-13 08:33:05,https://www.reddit.com/r/theprimeagen/comments/1ffpsps/a_rant_about_frontend_development/
We can only send emails up to 500 miles away,Specialist-Algae5655,7,2024-09-06 15:38:57,https://www.reddit.com/r/theprimeagen/comments/1fai95u/we_can_only_send_emails_up_to_500_miles_away/
I coded a game.. and you guys hacked it,feketegy,6,2024-09-04 17:40:23,https://www.youtube.com/watch?v=x6FQqLDI2tg
The open source community strikes back,feketegy,6,2024-09-04 08:53:47,https://www.infoworld.com/article/3486307/the-open-source-community-strikes-back.html?ref=dailydev
Readability is not a property of object oriented programming.,j0eTheRipper0010,8,2024-08-29 04:45:20,https://i.redd.it/px96w1y89jld1.png
Chrome Is Beta Testing Built-In AI. Could This Kill a Lot of Startups?,N/A,8,2024-08-31 14:39:13,https://www.trevorlasn.com/blog/google-chrome-built-in-gemini-nano
Metaprogramming and JIT Compilers - A Brief Overview[15min],Ok-Tap139,7,2024-08-25 09:48:56,https://youtu.be/FFgvV0sA3kU?si=PKaV99GcsUwdApl2
Vim Racer - The goal of the game is to navigate to every target as quickly as possible,dalton_zk,7,2024-08-26 22:45:21,https://vim-racer.com/
these compression algorithms could halve our image file sizes (but we don't use them) #SoMEpi,godieph,8,2024-08-18 09:44:49,https://www.youtube.com/watch?v=RFWJM8JMXBs
"Please react to ""AI Coding Crap: More Examples. Claude 3.5 Sonnet Demo & more"" - Internet of Bugs is a great channel",mattaw2001,8,2024-08-13 16:50:46,https://www.youtube.com/watch?v=x0y1JWKSUp0
Common Causes of Memory Leaks in JavaScript,N/A,6,2024-08-12 07:16:04,https://www.trevorlasn.com/blog/common-causes-of-memory-leaks-in-javascript
 Java for the Haters in 100 Seconds ,khalloof_7,6,2024-08-22 16:45:45,https://youtu.be/m4-HM_sCvtQ?si=Qbb8TD43jcHDvwZM
How Games Fake Water,NeedLater,8,2024-08-05 17:03:29,https://youtu.be/PH9q0HNBjT4
Anyone Can Access Deleted & Private Repo Data on Github 28.07.24 ,Ambitious-Pride-6388,5,2024-07-28 10:10:31,https://trufflesecurity.com/blog/anyone-can-access-deleted-and-private-repo-data-github
AI Hype is completely out of control - especially since ChatGPT-4o,Dizonans,8,2024-06-15 15:48:35,https://www.youtube.com/watch?v=VctsqOo8wsc
