Title,Author,Score,Created_UTC,URL
my journey as a failed programmer,Financial_Airport933,16,2024-11-14 19:14:11,https://www.reddit.com/r/theprimeagen/comments/1grcns7/my_journey_as_a_failed_programmer/
More AI Hype Dies,Valuable_Tomato_2854,17,2024-10-11 14:00:15,https://youtu.be/3A-gqHJ1ENI?si=SdVmhaf-OLWMkfjr
JavaScript is still alive and well in 2024 you have nothing to worry about!,Marrconius,18,2024-11-07 08:53:33,https://i.redd.it/rvmvyvz11gzd1.jpeg
"1 bug, $50,000+ in bounties, how Zendesk intentionally left a backdoor in hundreds of Fortune 500 companies",Sudden-Cook7695,18,2024-10-12 15:20:09,https://gist.github.com/hackermondev/68ec8ed145fcee49d2f5e2b9d2cf2e52
serverlessServers,griffdawg123,16,2024-10-07 03:25:16,https://i.redd.it/taqdcug0t5td1.png
~9.5% of software engineers do virtually nothing: Ghost Engineers,Delicious_Problem242,17,2024-11-25 15:08:20,https://www.reddit.com/r/theprimeagen/comments/1gzky88/95_of_software_engineers_do_virtually_nothing/
Why don't more people use Linux? - DHH [~3 minute Text Article],kj_sh604,17,2024-09-02 20:46:21,https://world.hey.com/dhh/why-don-t-more-people-use-linux-33b75f53
Bun - Compile and run C in JavaScript,havefunxd,18,2024-09-19 11:12:14,https://www.reddit.com/r/theprimeagen/comments/1fki812/bun_compile_and_run_c_in_javascript/
"Google Accidentally Deletes $135 Billion Pension Fund, Chaos Ensues - Kevin Fang",DKB05,15,2024-08-07 04:52:23,https://www.youtube.com/watch?v=3GOAUyipnM4
"PRIME, GO BACK",Theradion,17,2024-04-20 00:09:09,https://www.reddit.com/r/theprimeagen/comments/1c8c5dl/prime_go_back/
this cant be a coincidence,Known_Pace1664,18,2024-05-26 22:50:14,https://i.redd.it/4awkcyr6ou2d1.png
Spitting out the vengeance 😂,b0a04gl,18,2023-12-30 10:20:39,https://i.redd.it/gmt8t70lre9c1.png
Is AI replacing Developers? New data suggests otherwise,Ashken,14,2024-12-23 19:38:48,https://www.linkedin.com/pulse/ai-replacing-developers-now-data-suggests-otherwise-github-dmwbc?utm_source=share&utm_medium=member_ios&utm_campaign=share_via
OpenAI O3: The Hype is Back,GuessMyAgeGame,15,2024-12-21 08:58:32,https://www.reddit.com/r/theprimeagen/comments/1hj61gc/openai_o3_the_hype_is_back/
Does using Vim enchance your Aura in society?,Linux-agen,15,2024-12-19 15:32:10,https://www.reddit.com/r/theprimeagen/comments/1hhvg1n/does_using_vim_enchance_your_aura_in_society/
The Law of Leaky Abstractions,flatminded,16,2024-11-15 21:36:08,https://www.joelonsoftware.com/2002/11/11/the-law-of-leaky-abstractions/
The 7 Levels of Programming,feketegy,16,2024-12-03 16:04:37,https://www.youtube.com/watch?v=itwco8_yV2k
🤬 F*CK NeoVim! It thinks its smarter than you. It's so not.,__ThisisnotJohn,16,2024-10-13 19:58:27,https://youtu.be/Ot9K3Rgfugc?si=VGzHvrPi6vyhrBZj
HTTP Mentioned,Klippenhof,15,2024-10-11 14:20:32,https://i.redd.it/3vlwuqi2z4ud1.png
Three Mile Island nuclear site to reopen in Microsoft deal,feketegy,17,2024-09-21 10:10:46,https://www.bbc.com/news/articles/cx25v2d7zexo.amp
 i was right.,khalloof_7,15,2024-09-18 11:38:05,https://youtu.be/F8cT1YCsxgo?si=-YEUti-_fZj3JJFc
Is this an accurate representation of what coding interviews might turn into (if they’re not already like that)?,dermeddjamel,15,2024-09-16 13:47:39,https://v.redd.it/9etiq2awp5pd1
"Bullshit remover, Test: ThePrimeagen is the best streamer. Result: Nah, he's just some dude who yells about Vim and TypeScript.",dalton_zk,17,2024-09-15 13:46:40,https://www.bullshitremover.com/
Meta admits it scraped all Australian Facebook posts since 2007 to train its AI,Brief_Cucumber5478,16,2024-09-12 15:21:49,https://www.techradar.com/pro/meta-admits-it-has-scraped-all-facebook-posts-since-2007-to-train-ai
Anon doesn't like ThePrimeagen,Magnivilator,15,2024-06-09 13:33:45,https://www.reddit.com/r/theprimeagen/comments/1dbtupm/anon_doesnt_like_theprimeagen/
Senior JS Developer 2024,Hamza12700,16,2024-04-14 16:27:07,https://www.youtube.com/watch?v=aWfYxg-Ypm4
"I've been internally screaming the whole video, it would be funny to see prime react to this",AnnyAskers,16,2024-03-10 17:02:02,https://youtu.be/1xKa4vxon_8?si=HhW7BoJdoZa__Rde
Scientists warn of AI collapse,bARDMW,16,2024-04-28 23:18:08,https://www.youtube.com/watch?v=NcH7fHtqGYM
thanks to roblox you can now react into neovim,Poylol-_-,17,2024-06-20 05:44:37,https://i.redd.it/eayg9xb10o7d1.jpeg
Golang 1.24 is looking seriously awesome,joseluisq,15,2024-12-17 06:16:26,https://devcenter.upsun.com/posts/go-124/
AI is not Designed for You,DovaJun,15,2024-12-13 03:02:21,https://youtu.be/6Lxk9NMeWHg?si=uSHyoXmXJQt1G178
Why Can't We Make Simple Software? - Peter van Hardenberg,ozamataz_buckshank1,16,2024-12-09 02:34:06,https://youtu.be/czzAVuVz7u4?si=FHjEr2oJcuquyjlx
SQLite vs PostgreSQL [14:00],Remarkable_Ad_5601,16,2024-11-10 12:55:40,https://www.youtube.com/watch?v=VzQgr-TgBzc
How to become a good backend engineer ,ThNormalOne,14,2024-11-02 09:01:07,https://www.reddit.com/r/theprimeagen/comments/1ghscor/how_to_become_a_good_backend_engineer/
"OpenAI announces chatgpt pro, $200 per month",one_more_byte,15,2024-12-05 18:39:12,https://openai.com/index/introducing-chatgpt-pro/
We're forking Flutter. This is why.,Noctember,16,2024-10-28 22:34:34,https://flutterfoundation.dev/blog/posts/we-are-forking-flutter-this-is-why/
Ghostty 1.0 is Coming,feketegy,16,2024-10-22 14:27:28,https://mitchellh.com/writing/ghostty-is-coming
How this guy reduced the GTA 5 loading time by 70% (Rockstar Games accepted this fix),Advanced_Ahole_69,15,2024-10-22 12:57:10,https://www.reddit.com/r/theprimeagen/comments/1g9hh7p/how_this_guy_reduced_the_gta_5_loading_time_by_70/
myNeovimExperienceSoFar,suffering_chicken,15,2024-10-08 02:13:03,https://i.redd.it/u8xcasrbuetd1.jpeg
"Whenever I write about the foolishness of working from home there is always one group of workers who squeal and protest the loudest. Yes, it’s the software developers...",ConflictUsed3017,14,2024-10-14 12:08:07,https://www.linkedin.com/posts/christiannellemann_whenever-i-write-about-the-foolishness-of-activity-7129361444046802944-eNf6?utm_source=share&utm_medium=member_desktop
Brainfart turned into a T-shirt -- should this exist?,BroadbandJesus,14,2024-09-21 12:54:19,https://i.redd.it/8qq7guigt5qd1.png
30 Things I hate about your game pitch,ConflictUsed3017,16,2024-09-27 19:39:00,https://i.redd.it/e6fokqy4nerd1.jpeg
Programming sucks,SirLag,16,2024-09-28 03:09:07,https://www.reddit.com/r/theprimeagen/comments/1fr54o5/programming_sucks/
gaining access to anyones browser without them even visiting a website,en3sis,15,2024-09-20 18:25:18,https://www.reddit.com/r/theprimeagen/comments/1fliwnv/gaining_access_to_anyones_browser_without_them/
Why I Prefer Exceptions to Error Values,DryRazzmatazz507,14,2024-09-10 23:33:55,https://cedardb.com/blog/exceptions_vs_errors/
"My game is 262,000 times faster than Minecraft. I'll show you how.",godieph,15,2024-09-07 12:22:26,https://www.youtube.com/watch?v=CJ94gOzKqsM
Roguelite Monkeytype? Try the Demo for Glyphica : Typing Survival!,Maleficent_Internet9,15,2024-09-07 10:31:30,https://v.redd.it/fhlvkkyeucnd1
Stop Designing Your Web Application for Millions of Users When You Don't Even Have 100,bizzehdee,15,2024-09-19 11:44:56,https://www.darrenhorrocks.co.uk/stop-designing-web-applications-for-millions/
Postmortem on rust usage in game dev,Slight_Permit,14,2024-04-27 01:21:29,https://www.reddit.com/r/theprimeagen/comments/1ce29yq/postmortem_on_rust_usage_in_game_dev/
Going back to JS after trying Golang/Templ,coravani,14,2024-08-14 17:13:42,https://www.youtube.com/watch?v=mt1ZCai1G-I
Crypto miner injected into popular Python package via GitHub branch name expansion,lettucemode,14,2024-12-06 16:05:08,https://www.reddit.com/r/theprimeagen/comments/1h84q5t/crypto_miner_injected_into_popular_python_package/
Hey Prime,mk_8,15,2024-04-01 19:04:49,https://v.redd.it/hd5voeev1xrc1
"Zero Disk architecture: The idea is simple. Instead of writing to a storage server, we will write to S3",dalton_zk,13,2024-11-24 16:59:05,https://avi.im/blag/2024/zero-disk-architecture/
Several Linux Kernel Driver Maintainers Removed Due To Their Association To Russia,joseluisq,13,2024-10-23 19:35:40,https://www.phoronix.com/news/Russian-Linux-Maintainers-Drop
Yet another bigboxSWE video,RGthehuman,14,2024-10-19 14:44:25,https://www.youtube.com/watch?v=6d32i2w_brY
Internet of Bugs - ChatGPT-O1 Changes Programming as a Profession. I really hated saying that.,DDev91,14,2024-10-14 13:40:07,https://www.reddit.com/r/theprimeagen/comments/1g3g0ek/internet_of_bugs_chatgpto1_changes_programming_as/
"15 year old kid ""backdoors"" Zendesk to create accounts in a bunch of F500 Slack workspaces",HendrikPeter,14,2024-10-14 09:13:54,https://www.reddit.com/r/theprimeagen/comments/1g3bmk4/15_year_old_kid_backdoors_zendesk_to_create/
The difference between you and ThePrimeagen.,EnvironmentFast2295,13,2024-08-07 16:14:05,https://www.reddit.com/r/theprimeagen/comments/1emfyl7/the_difference_between_you_and_theprimeagen/
Garbage,Epipodisma,14,2024-08-03 23:15:11,https://i.redd.it/3y96offj7jgd1.png
Oops...,NNYMgraphics,13,2024-06-11 21:43:13,https://i.redd.it/2iq2z5fsi06d1.png
"The flamethrower drone helps fight bushes. Everything is made entirely of text symbols. This is a location for my cyberpunk game, Effulgence.",Hashi856,13,2024-12-07 19:42:19,https://v.redd.it/6i4dowc06f5e1
Apple urged to scrap AI feature after it creates false headline,Anasynth,13,2024-12-19 13:03:30,https://www.bbc.com/news/articles/cx2v778x85yo
"C3 - Yet another ""better C"" language. Simple and readable",heavymetalmixer,13,2024-11-26 07:13:25,https://c3-lang.org/
"On ""Safe"" C++. HELL IN A REFCELL. [Article]",tears_falling,12,2024-11-19 17:05:10,https://izzys.casa/2024/11/on-safe-cxx/
How GitHub Reduced Repo Storage size by over 90%,SnooMuffins9844,12,2024-11-20 15:00:24,https://newsletter.betterstack.com/p/how-github-reduced-repo-storage-size
How I made a RAG without using a vector database ,boneMechBoy69420,14,2024-11-29 06:50:35,https://www.reddit.com/r/theprimeagen/comments/1h2fx6j/how_i_made_a_rag_without_using_a_vector_database/
"Another classic: I remember reading about someone suggesting creating a chat or email chain with all the people in the meeting to clarify the key points that will be discussed in the meeting By doing this, most of the meetings organically transformed into email chains and were cancelled",jabawack81,13,2024-11-14 00:08:33,https://i.redd.it/59cz2f5pao0e1.png
Netflix Netherlands and France offices raided in tax fraud probe,hHYa7iyW,13,2024-11-05 15:16:51,https://www.bbc.com/news/articles/cwy1vze09wwo
How we shrunk our Javascript monorepo git size by 94%,dalton_zk,12,2024-10-27 13:38:12,https://www.jonathancreamer.com/how-we-shrunk-our-git-repo-size-by-94-percent/
Crazy reaction of Prime about fireship.io uses windows machine 😂,ibntofajjal,13,2024-10-03 13:39:21,https://www.reddit.com/r/theprimeagen/comments/1fv7zo7/crazy_reaction_of_prime_about_fireshipio_uses/
I moved from Svelte to React,FrozenInc,13,2024-10-26 11:31:18,https://www.reddit.com/r/sveltejs/comments/1gbwi0b/i_moved_from_svelte_to_react/
If people don't already realize..,cobalt1137,13,2024-08-24 02:03:17,https://i.redd.it/o76v0eysrikd1.png
Why is PS3 emulation so fast: RPCS3 optimizations explained,thestudcomic,14,2024-09-06 14:47:21,https://www.reddit.com/r/theprimeagen/comments/1fah04h/why_is_ps3_emulation_so_fast_rpcs3_optimizations/
How to do named function arguments in Rust 🚀,Veetaha,14,2024-09-08 17:01:41,https://i.redd.it/qih2cgiq9mnd1.png
"How Everyone is a Little Bit Right, in Their Own Way",IxDayz,13,2024-09-17 07:16:29,https://i.redd.it/qc0a0jfilbpd1.png
Researcher reveals ‘catastrophic’ security flaw in the Arc browser,njlash,14,2024-09-22 16:57:26,https://www.reddit.com/r/theprimeagen/comments/1fmxxld/researcher_reveals_catastrophic_security_flaw_in/
The future of webdev jobs,badcoder420,12,2024-08-09 13:43:40,https://i.redd.it/w8so17ay6nhd1.png
"PySkyWiFi: completely free, unbelievably stupid wi-fi on long-haul flights",Free_Warning_3292,12,2024-08-02 15:45:06,https://www.reddit.com/r/theprimeagen/comments/1eiddm6/pyskywifi_completely_free_unbelievably_stupid/
NSA Releases Internal 1982 Lecture by Computing Pioneer Rear Admiral Grace Hopper,DShot92,13,2024-08-28 09:28:42,https://www.youtube.com/watch?v=_bP14OzIJWI
Found Prime on brooklyn99!!,rogerbradd,13,2024-07-14 16:45:07,https://i.redd.it/ik28mipkjicd1.png
"Prime and TeeJ Trailer - nobody asked for this, here it is anyway.",kmdrfx,13,2024-07-10 20:42:28,https://youtu.be/elMQmeAKy4c?si=Mlec0mGCQqdUtlGf
DHH: Open source is neither a community nor a democracy,Dizonans,13,2024-06-17 08:13:05,https://world.hey.com/dhh/open-source-is-neither-a-community-nor-a-democracy-606abdab
"To Log Into WordPress, You Now Have To Agree Pineapple on Pizza Is Good",EctoplasmicLapels,12,2024-12-16 17:11:09,https://www.404media.co/wordpress-login-pineapple-on-pizza/
Today’s stream inspired me to make a Typescript meme,jjcxdev,13,2024-02-22 15:29:11,https://i.redd.it/usyp7m0vn5kc1.jpeg
nothing could have prepared me for the DSA course ending,Cold-Beyond-8914,13,2024-06-10 13:44:06,https://www.reddit.com/r/theprimeagen/comments/1dclukh/nothing_could_have_prepared_me_for_the_dsa_course/
"So I made ""The Primeagen style select regex"" (read the ""test string"" in the image for details).",opasnimiki,12,2024-01-03 23:35:32,https://i.redd.it/f8p9jrnj8bac1.png
C++ Is An Absolute Blast,OkCollection283,12,2024-12-11 12:49:31,https://learncodethehardway.com/blog/31-c-plus-plus-is-an-absolute-blast/
IDE as coffee machines,jabawack81,13,2024-11-16 11:23:11,https://bsd.network/@ed1conf/113486823218390932
Software developer arrested in connection with murder of healthcare executive,dalton_zk,10,2024-12-10 03:16:03,https://www.bbc.com/news/articles/cp9nxee2r0do
31 Million Internet Archive Accounts Leaked Due to JavaScript Library,codebyj,12,2024-10-10 07:12:14,https://www.theverge.com/2024/10/9/24266419/internet-archive-ddos-attack-pop-up-message
How Discord Reduced Websocket Traffic by 40%,crazytaj,12,2024-09-22 23:13:05,https://discord.com/blog/how-discord-reduced-websocket-traffic-by-40-percent
#Scrum,Chrome102,12,2024-09-03 13:25:17,https://i.redd.it/4x7ukuhcilmd1.jpeg
The betrayal ,Gregtex,12,2024-09-16 11:06:40,https://i.redd.it/3rsm4rkpl5pd1.jpeg
How WebSockets cost us $1M on our AWS bill,-aa,12,2024-11-06 19:38:54,https://www.recall.ai/post/how-websockets-cost-us-1m-on-our-aws-bill
Nighmare fuel,prateekm2995,12,2024-08-19 03:36:15,https://i.redd.it/rz67s58mjjjd1.png
What rocket science can teach software engineering industry?,b1-88er,14,2024-07-25 10:36:12,https://www.reddit.com/r/theprimeagen/comments/1ebrmu2/what_rocket_science_can_teach_software/
[short] how to get a programming boyfriend 100% works,kaczor647,12,2024-08-24 16:48:55,https://www.instagram.com/p/C-84nZusuuv/
How do I overcome my frequent burnout ?,fadhilsaheer,12,2024-06-30 09:58:41,https://www.reddit.com/r/theprimeagen/comments/1dry2eg/how_do_i_overcome_my_frequent_burnout/
Where do I go after Java?,Lylio,12,2024-05-19 04:10:22,https://www.reddit.com/r/theprimeagen/comments/1cvfnpx/where_do_i_go_after_java/
Struggling with Real Programming: A Framework Developer's Perspective,Imaginary_Stage4867,12,2024-06-17 16:11:07,https://www.reddit.com/r/theprimeagen/comments/1di1wa3/struggling_with_real_programming_a_framework/
"Google deletes the 401k’s of 620,000. Australians",fengli,11,2024-05-11 16:06:32,https://www.reddit.com/r/theprimeagen/comments/1cpkt66/google_deletes_the_401ks_of_620000_australians/
"Nobody Gets Fired for Picking JSON, but Maybe They Should? · mcyoung",arjunindia,11,2024-12-16 15:40:05,https://mcyoung.xyz/2024/12/10/json-sucks/
Linux Users,Upstairs_Barber_5431,13,2024-01-17 13:22:00,https://i.redd.it/b686wupc40dc1.jpeg
gen z programmers are insane???,EnvironmentFast2295,11,2024-12-15 09:24:53,https://www.reddit.com/r/theprimeagen/comments/1hep2pr/gen_z_programmers_are_insane/
10 simple tips to (un)optimize your code,Icemourne_,10,2024-04-27 12:26:34,https://www.youtube.com/watch?v=uALJ5OXhbHY
Watched Prime's workshop on making a productive environment,TheMindGobblin,11,2024-12-15 08:52:18,https://www.reddit.com/r/theprimeagen/comments/1heonm7/watched_primes_workshop_on_making_a_productive/
"you can't proompt inject if there is no proompt, this was the solution from Google at the Slush conference booth to allow people to test Gemini without allowing them to be sneaky",jabawack81,10,2024-11-25 00:06:08,https://i.redd.it/vjtyarb9vx2e1.jpeg
"OpenAI, Google and Anthropic Are Struggling to Build More Advanced AI",bag_of_cells,12,2024-11-19 18:46:30,https://www.bloomberg.com/news/articles/2024-11-13/openai-google-and-anthropic-are-struggling-to-build-more-advanced-ai
"C++ Standards Contributor Banned For Using Word ""Question""",shebasedcannon,11,2024-11-26 00:21:04,https://www.youtube.com/watch?v=Ebz4ev_B2ec
Microsoft is the nicest corporation,evil_rabbit_32bit,10,2024-10-29 07:39:08,https://www.reddit.com/r/theprimeagen/comments/1gep2z6/microsoft_is_the_nicest_corporation/
Why boolean arguments should be avoided (Uncle Bob) - [2:40min],Excellent_Ant_2897,11,2024-11-18 12:27:52,https://www.youtube.com/watch?v=2Q9GRPxqCAk
Adobe's new image rotation tool is one of the most impressive AI concepts we've seen | Check the GIF for demo,rstargaryen,11,2024-10-17 16:38:42,https://www.creativebloq.com/design/adobes-new-image-rotation-tool-is-one-of-the-most-impressive-ai-concepts-weve-seen
the art of programming and why i won't use llm,brat_semaphored,12,2024-10-13 11:11:58,https://kennethnym.com/blog/why-i-still-wont-use-llm/
I’m tired of AI,Think_Solution_4004,12,2024-09-27 13:08:20,https://www.ontestautomation.com/i-am-tired-of-ai/
Wordpress.org blocks updates to WPEngine hosted sites ,EagleDelta1,10,2024-09-26 12:12:31,https://www.reddit.com/r/theprimeagen/comments/1fpuo48/wordpressorg_blocks_updates_to_wpengine_hosted/
Low Level Learning - This is the scariest technology I've ever seen,AhaGames,11,2024-10-04 18:36:08,https://www.youtube.com/watch?v=QAglUbhcbeI
How Discord Reduced Websocket Traffic by 40%,myrsnipe,11,2024-09-22 09:03:35,https://discord.com/blog/how-discord-reduced-websocket-traffic-by-40-percent
Rene (T2sde) got SWAT'ed and handcuffed LIVE while streaming Linux development!,PrestigiousTip4233,12,2024-09-14 02:38:12,https://www.youtube.com/watch?v=FIEwcTKUFCA
Load Balancing,feketegy,11,2024-09-20 08:48:26,https://samwho.dev/load-balancing/
The Internet is Becoming an Ocean of LLM-Generated Junk,N/A,11,2024-09-09 07:18:58,https://www.trevorlasn.com/blog/the-internet-is-becoming-an-ocean-of-llm-generated-junk
The secret inside One Million Checkboxes,DShot92,11,2024-08-30 12:22:35,https://www.youtube.com/watch?v=OI4DbECnp8A
Slack AI can be tricked into leaking data from private channels via prompt injection,jaderubini,10,2024-08-23 14:41:30,https://www.theregister.com/2024/08/21/slack_ai_prompt_injection/
What happened to Prime trying Zed on a macbook?,vdotcodes,12,2024-06-25 22:21:12,https://www.reddit.com/r/theprimeagen/comments/1doiljy/what_happened_to_prime_trying_zed_on_a_macbook/
The cloud is over-engineered and overpriced (no music),issyezza,10,2024-06-12 09:46:15,https://www.youtube.com/watch?v=jFrGhodqC08
"AI is effectively ‘useless’—and it’s created a ‘fake it till you make it’ bubble that could end in disaster, veteran market watcher warns",Zoravor,11,2024-07-10 02:26:52,https://finance.yahoo.com/news/ai-effectively-useless-created-fake-194008129.html
Reddit simply does not like posts where you are not praizing LLMs,Signal_Loquat_6245,9,2024-08-09 06:38:43,https://i.redd.it/uofw8lv63lhd1.png
Go evolves in the wrong direction,wiiqwertyuiop,11,2024-06-11 06:12:25,https://valyala.medium.com/go-evolves-in-the-wrong-direction-7dfda8a1a620
can we create a pinned post with all the advices that prime gives,Cold-Beyond-8914,12,2024-05-19 15:07:48,https://www.reddit.com/r/theprimeagen/comments/1cvqdj1/can_we_create_a_pinned_post_with_all_the_advices/
Coding in dumb programs,88BTM,10,2024-04-21 09:09:40,https://youtu.be/djIufZ7Fyms
"PHP is perfect, unlike React",CoffeeLife1999,10,2024-06-06 11:23:48,https://www.youtube.com/watch?v=9DsMIni4rvw
Why are you wrong about 0 based indexing,Hamza12700,11,2024-05-07 10:09:13,https://www.youtube.com/watch?v=0uQ3bkiW5SE
 very interesting vid on airstrafing in video games,Dismal-Sea781,9,2024-12-21 14:44:38,https://www.reddit.com/r/theprimeagen/comments/1hjb7cr/very_interesting_vid_on_airstrafing_in_video_games/
Men - we do be like that.,AnnyAskers,11,2024-01-28 17:26:00,https://i.redd.it/rp8zq7krg6fc1.jpeg
Interview with 80s Computer Nerd,joseluisq,10,2024-12-22 16:26:01,https://youtu.be/T5QNUNd0sx8?si=5VMG1uTTXGBzXDNA
Primes dev environment stream,Chrispy_Xz,11,2024-12-05 21:33:00,https://www.reddit.com/r/theprimeagen/comments/1h7khsu/primes_dev_environment_stream/
Should you learn Rust in 2025?,dalton_zk,10,2024-12-21 13:01:35,https://youtu.be/eJFWTS0ktXo?si=IjoJLUJ1GzTfDtQi
It's not hard to make games in C++,dalton_zk,10,2024-12-02 15:54:07,https://youtu.be/RosSRBy0FYY?si=Av0OwAUF6mP_9gDj
Full Stack Developers Rage: The Rise and Fall of the Full Stack Developer,aronwozere,10,2024-11-30 12:47:04,https://www.reddit.com/r/theprimeagen/comments/1h3bv6k/full_stack_developers_rage_the_rise_and_fall_of/
Deno v. Oracle: Canceling the JavaScript Trademark,joseluisq,10,2024-11-27 23:23:37,https://deno.com/blog/deno-v-oracle
anyone have a reupload of this video?,bbyzyzz,11,2024-11-30 02:35:46,https://i.redd.it/3g4xmloxay3e1.jpeg
Rust and Go vs everything else,dalton_zk,10,2024-11-23 13:01:01,https://bitfieldconsulting.com/posts/rust-and-go
VSCode is sending your code!,CosmicWanderer1-618,11,2024-10-29 13:29:59,/r/vscode/comments/1gepias/vscode_is_sending_your_code/
I don't have time to learn React,feketegy,10,2024-11-21 11:46:36,https://www.keithcirkel.co.uk/i-dont-have-time-to-learn-react/
Prime over here cosplaying as ćuk norris lol,BruceJi,11,2024-11-10 10:18:28,https://v.redd.it/2u066op4sv0d1
Prime Tonight ,SSSniperCougar,9,2024-10-23 04:34:00,https://i.redd.it/p3wy12ydpfwd1.jpeg
"Write code that is easy to DELETE, not easy to EXTEND",GopherLearnsSt4t,10,2024-10-28 04:48:04,https://programmingisterrible.com/post/139222674273/write-code-that-is-easy-to-delete-not-easy-to
Please do not cheat - 7 out of 10 likely used chatGPT during interview question (not leetcode),craders,10,2024-10-23 02:26:08,https://www.reddit.com/r/cscareerquestions/comments/1g9l83u/psa_please_do_not_cheat/
Bro really did,AdHungry8024,9,2024-10-08 06:39:53,https://i.redd.it/her04f66ahtd1.jpeg
Bless me father for I have sinned. ,OilOld80085,10,2024-10-21 03:29:47,https://www.reddit.com/r/theprimeagen/comments/1g8glaz/bless_me_father_for_i_have_sinned/
Junior Developer Interviews in 2024 Be Like,MedicalPin7635,10,2024-10-04 13:32:11,https://www.youtube.com/watch?v=StYhR1pWqQw
Your code is worthless,DryRazzmatazz507,11,2024-09-30 20:35:47,https://youtu.be/Y6ZHV0RH0fQ?si=Soe8t9IjQmO7oeYo
Announcing Swift 6,Speedorama,9,2024-09-18 00:45:03,https://www.swift.org/blog/announcing-swift-6/
We Spent $20 To Achieve RCE And Accidentally Became The Admins Of .MOBI,feketegy,10,2024-09-11 13:28:47,https://labs.watchtowr.com/we-spent-20-to-achieve-rce-and-accidentally-became-the-admins-of-mobi/
Spring is the worst framework ever created [14min video abt how too much abstraction is bad ig],cbg_27,9,2024-09-02 22:39:02,https://www.reddit.com/r/theprimeagen/comments/1f7k53k/spring_is_the_worst_framework_ever_created_14min/
Why I still self host my servers (and what I've recently learned),feketegy,11,2024-09-06 07:40:25,https://chollinger.com/blog/2024/08/why-i-still-self-host-my-servers-and-what-ive-recently-learned/?ref=dailydev
"AWS cloud chief says ""most developers could stop coding soon as AI takes over""",Southern_Solution_80,12,2024-08-21 08:01:18,https://www.reddit.com/r/theprimeagen/comments/1exjxo6/aws_cloud_chief_says_most_developers_could_stop/
ThePrimeagen in GTA6,Ok_Ingenuity_3576,9,2024-08-31 18:19:09,https://i.redd.it/kqowmvqloyld1.png
???!,ezekielbaniaga,10,2024-08-06 10:05:10,https://i.redd.it/zifm0nk6p0hd1.png
Python Foundation Drama,Mediocre_Lecture_114,11,2024-08-13 20:40:52,https://www.reddit.com/r/theprimeagen/comments/1erilvz/python_foundation_drama/
Technical Debt Is Killing Your Business,N/A,11,2024-07-31 11:59:40,https://www.trevorlasn.com/blog/technical-debt-is-killing-your-business
Neovim Popularity,besseddrest,10,2024-07-18 21:44:51,https://www.reddit.com/r/theprimeagen/comments/1e6n3ev/neovim_popularity/
Getting started with Turbo Pascal. Any pointers? ,Marrconius,9,2024-05-23 00:27:54,https://i.redd.it/ticurbl0m22d1.png
What are git aliases you use a lot?,alex17ryan,10,2024-05-19 10:28:21,https://www.reddit.com/r/theprimeagen/comments/1cvl880/what_are_git_aliases_you_use_a_lot/
"Lessons learned after 3 years of fulltime Rust game development, and why we're leaving Rust behind",Luc-redd,11,2024-04-28 06:06:02,https://loglog.games/blog/leaving-rust-gamedev/
Anything runs in Parallel... in Rust but looks Python ...,godieph,10,2024-05-18 08:26:11,https://www.youtube.com/watch?v=HCOQmKTFzYY
"Debunking Devin: ""First AI Software Engineer"" Upwork lie exposed!",jsega,10,2024-04-09 17:42:51,https://youtu.be/tNmgmwEtoWE
It's all relative,N/A,10,2024-02-16 14:30:37,https://i.redd.it/d1bhyvxwjyic1.jpeg
 She Quit Computer Science To Start OnlyFans,Dizonans,13,2024-12-24 12:51:58,https://www.youtube.com/watch?v=_uEG0H4RXcA&t=0s
Why we bet on Scala at SwissBorg,Krever,11,2024-03-26 07:07:24,https://medium.com/swissborg-engineering/why-we-bet-on-scala-at-swissborg-6364b6419d95
wholesome.af,ConstantAmbition896,10,2024-12-17 21:52:23,https://www.twitch.tv/theprimeagen/clip/CrispyCrispyKathyMau5-cL8OX_V9psOtzfTU
