Title,Author,Score,Created_UTC,URL
How 1 software engineer outperforms 138 (22:37 but last 7 mins is fluff),a_iliev13,5,2024-10-02 17:16:01,https://www.reddit.com/r/theprimeagen/comments/1full1u/how_1_software_engineer_outperforms_138_2237_but/
Hacking Kia: Remotely Controlling Cars With Just a License Plate,pfc-anon,6,2024-09-28 06:34:14,https://samcurry.net/hacking-kia
The Architecture of a Web 3.0 application.,feketegy,5,2024-09-25 12:05:09,https://ameer98.medium.com/the-architecture-of-a-web-3-0-application-7b06e66346b9
We are under DDoS attack and we do nothing \ Tableplus,justaklboy,4,2024-09-24 16:45:12,https://tableplus.com/blog/2024/03/how-we-deal-with-ddos.html
Tmux in 100 seconds,bore530,4,2024-09-23 09:39:25,https://www.youtube.com/watch?v=vtB1J_zCv8I
High Agency Individual Contributor,LordMacko,4,2024-09-18 07:50:19,https://www.youtube.com/watch?v=dLTUqPue9sQ
SurrealDB 2.0,SliceRabbit,5,2024-09-17 21:33:46,https://youtu.be/v4nfF_pf7iU
Every developer needs a raspberry pie,ogkrish,4,2024-09-24 05:27:28,https://m.youtube.com/watch?v=Vp4glSVPT8o
The empire of C++ strikes back with Safe C++ proposal,AhaGames,6,2024-09-16 23:05:21,https://www.theregister.com/2024/09/16/safe_c_plusplus/
Uhhh... Guys? I think somethinga is off with prime,AnnyAskers,5,2024-09-15 19:13:27,https://www.reddit.com/gallery/1fhkjxk
"pure backend Projects, to get hired",rishavmehra,5,2024-09-15 18:33:45,https://www.reddit.com/r/theprimeagen/comments/1fhjla4/pure_backend_projects_to_get_hired/
Can ChatGPT o1-preview Solve PhD-level Physics Textbook Problems? (Part 2),Onlymafia1,5,2024-09-15 18:15:08,https://youtu.be/a8QvnIAGjPA?si=8ow4YIIeWwHHrXfw
Assessing the Energy Efficiency of Programming Languages,SmbUUsedToKnow,6,2024-09-14 23:56:17,https://www.reddit.com/r/theprimeagen/comments/1fgzj3k/assessing_the_energy_efficiency_of_programming/
I Hacked Diablo II To Use Modern Graphics (Vulkan),godieph,5,2024-09-13 00:31:28,https://www.youtube.com/watch?v=FUJY1jcWmJU
Migrating from AWS to Self-Hosting - Zig Programming Language,feketegy,5,2024-09-14 07:59:26,https://ziglang.org/news/migrate-to-self-hosting/
"Why Your Personal Projects Aren't Getting You Hired
",Kosssm,5,2024-09-12 13:25:55,https://www.reddit.com/r/theprimeagen/comments/1ff2ixv/why_your_personal_projects_arent_getting_you_hired/
Why GitHub Actually Won,dalton_zk,5,2024-09-10 12:36:14,https://blog.gitbutler.com/why-github-actually-won/
What is this font? For some reason it looks like JetBrains Mono but I don't want to believe it,khalloof_7,5,2024-09-10 18:30:44,https://i.redd.it/y891ceu8z0od1.png
4k vs 64k kernel page size comparison,myrsnipe,5,2024-09-09 16:18:54,https://www.phoronix.com/review/ampereone-64k-linux611
Lawyer YouTuber faces discrimination by computer programming school for using a QWERTY keyboard,ManyInterests,5,2024-09-10 02:44:00,https://www.youtube.com/watch?v=lvZ0nfC54Sg
The Untold story of VsCode,fat_coder_420,4,2024-09-09 03:08:25,https://youtu.be/vBhaFvwvRac?si=Bgi10vSmHK6Nh5YK
typescriptUsersBeLike,ComprehensiveWord201,4,2024-09-08 23:19:37,https://i.redd.it/izzqenwxfmnd1.gif
Building UI in C to piss off React devs,ChevyTanner1,6,2024-09-07 20:16:33,https://youtu.be/SRgLA8X5N_4?si=9_4hcR88lc-NhILx
Just a good 2 hour long video about modern CPU's,Kamikadze12,6,2024-09-07 00:42:04,https://youtu.be/wGSSUSeaLgA
Unrealistic Deadlines In Software Engineering,N/A,4,2024-09-07 14:30:01,https://www.trevorlasn.com/blog/unrealistic-deadlines-in-software-engineering
"gRPC: 5 Years Later, Is It Still Worth It?",feketegy,5,2024-09-04 16:33:27,https://kostyay.com/grpc-5-years-later-is-it-still-worth-it-b181a3b2b73b
YubiKeys are vulnerable to cloning attacks thanks to newly discovered side channel,bag_of_cells,6,2024-09-04 13:48:07,https://arstechnica.com/security/2024/09/yubikeys-are-vulnerable-to-cloning-attacks-thanks-to-newly-discovered-side-channel/
Improving Git Diff Algo,perseus365,5,2024-09-04 02:58:56,https://stackoverflow.blog/2024/08/05/this-developer-tool-is-40-years-old-can-it-be-improved/?utm_campaign=tns+platform&utm_content=inline-mention&utm_medium=referral&utm_source=the+new+stack
Can we do better than 'diff'? ,markk116,5,2024-09-03 15:50:14,https://stackoverflow.blog/2024/08/05/this-developer-tool-is-40-years-old-can-it-be-improved
The Best Terminal Shell Ever Created,jainil69420,5,2024-09-01 09:37:06,https://youtu.be/K_yK-tEeGDA
Silicon Valley Investors on Starbuck's Ex-CEO not working after 6 PM,feketegy,6,2024-08-31 10:34:12,https://youtube.com/clip/Ugkx4y5eHYoVY1gd18JGLQ_jDEH0zhvGx5St?si=tl5dAbROFizH3ZwV
THE SECRET INSIDE ONE MILLION CHECKBOXES,CaptnPrice,4,2024-08-30 10:21:25,http://eieio.games/essays/the-secret-in-one-million-checkboxes/
Building a drawing board app without writing a single line of code [12:34],jaderubini,5,2024-08-29 13:16:32,https://youtu.be/4ezTjzpzSak?si=stu3szOW6ELc5Wvn
"Theo - t3.gg reviews 'Going back to Next"" after giving Go a try.",MickeyMooose,4,2024-08-28 20:27:11,https://www.youtube.com/watch?v=FSA5IDRgSe8
Go sync.Pool and the Mechanics Behind It,moniquelive,5,2024-08-27 20:28:27,https://www.reddit.com/r/theprimeagen/comments/1f2rbtz/go_syncpool_and_the_mechanics_behind_it/
"""Learn Computer Science this way""",mathmtica,4,2024-08-26 06:46:29,https://www.reddit.com/r/theprimeagen/comments/1f1hpy1/learn_computer_science_this_way/
How to think like a genius programmer,tausiqsamantaray,5,2024-08-27 07:11:04,https://www.youtube.com/watch?v=kQUwImj32PA
I am abusive to Git,lritzdorf,5,2024-08-25 16:34:18,https://www.reddit.com/r/theprimeagen/comments/1f10iht/i_am_abusive_to_git/
"You Are NOT Dumb, You Just Lack the Prerequisites",dalton_zk,5,2024-08-25 14:31:33,https://lelouch.dev/blog/you-are-probably-not-dumb/
C isn’t a Hangover; Rust isn’t a Hangover Cure,Middle-Entrance7399,6,2024-08-22 01:11:42,https://www.reddit.com/r/theprimeagen/comments/1ey6lkb/c_isnt_a_hangover_rust_isnt_a_hangover_cure/
The 4-chan Go programmer,CEDoromal,6,2024-08-24 00:57:21,https://www.dolthub.com/blog/2024-08-23-the-4-chan-go-programmer/
Some stackoverflow answers be wild!!,Deep-Total-9200,6,2024-08-21 15:32:29,https://i.redd.it/0urbdwjcd1kd1.png
6 lessons learned from losing hundreds of hours and tens of thousands of dollars freelancing,Viking_Sec,5,2024-08-20 16:07:48,https://blog.valhallaresearch.net/6-lessons-learned-from-losing-hundreds-of-hours-and-tens-of-thousands-of-dollars-freelancing-65e341567167406dbccb88df301c4202?pvs=4
Ladybird project / Andreas Kling announced Swift as successor language,funcmike,6,2024-08-19 19:49:44,https://x.com/awesomekling/status/1822236888188498031
Official neovim support in VSCode!!!,__albatross,6,2024-08-19 00:55:36,https://youtu.be/F7ZEKjDia1c?si=cydZ0-PSTfMoHOB5
"The Destruction of Knights Capital: The most expensive software bug in human history: $49 million/sec, $8.6 billion in 28 minutes.",pfc-anon,5,2024-08-06 05:59:42,https://www.quora.com/What-is-the-costliest-coding-error-anyone-has-ever-made/answer/Theodore-Smith-9?prompt_topic_bio=1
"Who is fastest? Node.js, Bun.js, or Deno.js",N/A,5,2024-08-02 18:10:21,https://www.trevorlasn.com/blog/benchmarks-for-node-bun-deno
Panic! at the Tech Job Market,hfkrodnejfj,5,2024-07-17 21:43:59,https://matt.sh/panic-at-the-job-market
"Book Club: A Philosophy Of Software by John Ousterhout.  At least it's better than ""Clean Code""",PTRounder,6,2024-07-23 08:12:31,https://youtu.be/4xqkI953K6Y?si=n2pYw0Zk6SJU2rdK
"Intuit is laying off 1,800 employees as AI leads to a strategic shift",The_Maximus_Prime,5,2024-07-12 11:34:40,https://www.reddit.com/r/theprimeagen/comments/1e1ff2z/intuit_is_laying_off_1800_employees_as_ai_leads/
Why OOP is slow - and a stupid idea to fix it ,JudgmentOld4975,5,2024-07-12 08:45:37,https://www.reddit.com/r/theprimeagen/comments/1e1cro4/why_oop_is_slow_and_a_stupid_idea_to_fix_it/
Devs vs PM in the work place,Chrome102,4,2024-07-12 10:34:12,https://youtu.be/DFSWM-nly0w?si=woQdevmQ8fxq9Dx9
"A 2D, insanely particle-rich, highly performant game written in Rust.",slydjinn,4,2024-07-04 12:39:58,https://www.reddit.com/r/rust/comments/18ul125/writing_a_game_in_rust_the_gnorp_apologue/?rdt=42526
Rlly cool video on a different approach to ASCII games.,Jaded_Cookie_8838,5,2024-06-30 20:30:28,https://www.reddit.com/r/theprimeagen/comments/1dsasa3/rlly_cool_video_on_a_different_approach_to_ascii/
Why async Rust,structured_bindings,5,2024-06-22 16:50:51,https://www.reddit.com/r/theprimeagen/comments/1dlzzl5/why_async_rust/
Detecting Agile BS,TheGamblersDice,6,2024-06-28 15:24:46,https://media.defense.gov/2018/Oct/09/2002049591/-1/-1/0/DIB_DETECTING_AGILE_BS_2018.10.05.PDF
[Programmers are also human] Tech job requirements in 2023 video,solofeeed,5,2024-06-18 20:33:03,https://www.reddit.com/r/theprimeagen/comments/1dj0r2f/programmers_are_also_human_tech_job_requirements/
Yet another monad tutorial,leo_farroco,4,2024-06-18 16:23:16,https://tech.nextroll.com/blog/dev/2022/11/11/exploring-monads-javascript.html
Hacking Millions of Modems (and Investigating Who Hacked My Modem),detroyejr,5,2024-06-04 15:07:56,https://samcurry.net/hacking-millions-of-modems
"Passkeys: A Shattered Dream
26 Apr 2024",Shasele,4,2024-05-30 18:46:27,https://www.reddit.com/r/theprimeagen/comments/1d4b8ws/passkeys_a_shattered_dream_26_apr_2024/
Grayjayer has been stalking Primeagen for a while now,CURVX,5,2024-05-30 13:41:43,https://i.redd.it/f0uoadh0ik3d1.jpeg
"UK Woman Mistaken As Shoplifter By Facewatch, Now She's Banned From All Stores With Facial Recognition Tech",Dizonans,6,2024-05-28 16:22:24,https://www.ibtimes.co.uk/uk-woman-mistaken-shoplifter-facewatch-now-shes-banned-all-stores-facial-recognition-tech-1724785
[Feedback request on skill issues] Sorry boomer lurking by and ranting,madskillissues,5,2024-05-26 05:59:50,https://www.reddit.com/r/theprimeagen/comments/1d0uva2/feedback_request_on_skill_issues_sorry_boomer/
Rabbit AI Scam Confirmed!,goodguycsgo,6,2024-05-28 08:19:44,https://www.youtube.com/watch?v=zLvFc_24vSM&ab_channel=Coffeezilla
"We like ragging on JS here, right? Fun reminder you can write JS with only 6 characters",DNEAVES,5,2024-05-21 12:57:30,https://jsfuck.com/
"Jim Keller: Arm vs x86 vs RISC-V - Does it Matter?
",gjosifov,5,2024-05-23 12:19:29,https://www.youtube.com/watch?v=yTMRGERZrQE
Donald Knuth - My advice to young people,Curious-Source-9368,4,2024-05-20 10:12:31,https://www.youtube.com/watch?v=75Ju0eM5T2c
Issue with background color on nvim-treesitter-context,JumperBoi_7,6,2024-06-20 22:39:07,https://i.redd.it/jlo16lr01t7d1.png
"When you have a new project idea, how do you modelize it?",alex17ryan,5,2024-06-01 10:46:35,https://www.reddit.com/r/theprimeagen/comments/1d5k9us/when_you_have_a_new_project_idea_how_do_you/
Should I learn typescript?,Btolsen131,5,2024-05-19 13:01:53,https://www.reddit.com/r/theprimeagen/comments/1cvns2q/should_i_learn_typescript/
How do I find my niche,Your-not-a-sigma,5,2024-05-19 06:46:33,https://www.reddit.com/r/theprimeagen/comments/1cvi4l6/how_do_i_find_my_niche/
Primeagen after dosing excel for 10 years straight,Kysawier,5,2024-05-14 15:56:30,https://www.youtube.com/shorts/YEupUXeijmM
If pho were British,No_Gain4004,5,2024-05-02 16:29:37,https://www.reddit.com/r/theprimeagen/comments/1cik1si/if_pho_were_british/
MongoDB is WebScale™,smolcheeld,6,2024-04-30 05:20:49,https://www.youtube.com/watch?v=b2F-DItXtZs&pp=ygUcbW9uZ28gaXMgd2ViIHNjYWxlIHByaW1lYWdlbg%3D%3D
Top 10 Programming Books-Dead Tree Edition: Internet of Bugs,Fitsum_Joseph,4,2024-04-27 10:12:07,https://www.youtube.com/watch?v=ZfcHwBKcNzY
newSQLIdearViable?,mostmetausername,6,2024-05-13 17:50:34,https://i.redd.it/bkqmf6u8d80d1.png
is it still called squeal tho?,dalailahner,6,2024-04-23 10:22:09,https://i.redd.it/b1bo7vc383wc1.png
Based take on cloud and guide to screw bezos,Kysawier,6,2024-04-25 14:50:46,https://www.youtube.com/watch?v=Cd9aRtwj9xA
Web Programming is about to collapse?!,Hamza12700,3,2024-04-21 06:17:51,https://youtu.be/yodWEPgn8NA?si=mjGOIjiAHDYP2BCE
Devin drama is back and its worse than we thought :O,ladislaff93,6,2024-04-10 07:48:07,https://www.youtube.com/watch?v=tNmgmwEtoWE
I ported THOUSANDS of apps to Windows 95,godieph,5,2024-04-12 00:38:06,https://www.youtube.com/watch?v=CTUMNtKQLl8
Comparing 10 programming languages. I built the same app in all of them,Malo-Netvor,6,2024-04-10 01:08:35,https://youtu.be/-MbTj8DGOP0?si=2Qa431JzZXG2ee7U
I can't wait to hear Prime's take on this,Marrconius,4,2024-03-27 02:44:15,https://www.tiktok.com/@conniecodes/video/7350345243683867934
I Spread Dangerous Misinformation (Apology Video),According_Pea_5567,6,2024-03-27 19:39:02,https://youtu.be/QSVqWxkv23A?si=NBP2Lv0VSIRzv2Do
I worked on 2 published academic papers on LLMs and I cant get a job...,rejectedlesbian,5,2024-03-24 23:18:10,https://www.reddit.com/r/theprimeagen/comments/1bmyngm/i_worked_on_2_published_academic_papers_on_llms/
"The ""Interesting"" Code Editor",godieph,5,2024-03-20 01:32:59,https://www.youtube.com/watch?v=gbN1eXFskYU
Mad man created a OS using jquery,Yogeshvishal,5,2024-03-12 05:26:30,https://www.youtube.com/watch?v=jYV1VDhw7E8
AsciiDoc - New Markdown Alternative,Hamza12700,4,2024-03-02 11:24:46,https://youtu.be/EhXpJo3YbKg?si=ZYMjFFJ7Ftz1UtS-
So You Think You Know Git - FOSDEM 2024,zinguirj,5,2024-02-23 15:52:08,https://www.youtube.com/watch?v=aolI_Rz0ZqY
HTMZ - Use this instead of HTMX,_devansh08_,6,2024-02-21 08:23:01,https://www.youtube.com/watch?v=hrQBVwqq9cI
Preparation for possible Nix arc,awfulstack,6,2024-02-18 15:44:48,https://www.reddit.com/r/theprimeagen/comments/1atwz2t/preparation_for_possible_nix_arc/
Go's Structured Logging Package,peakyraven,5,2024-02-07 16:16:21,https://www.youtube.com/watch?v=8rnI2xLrdeM&ab_channel=GopherConUK
Cool visualization of the neovim repo being built,zotteren,5,2024-02-03 18:26:24,https://www.youtube.com/watch?v=m6mlsx0LP2I
Ten stages of every programmer,N/A,5,2024-01-28 09:49:09,https://www.youtube.com/watch?v=gT0hOoT8rpI
I Made a Linux kernel module to do mouse pointer acceleration,Gnarus_G,4,2024-01-27 22:22:46,https://www.reddit.com/r/theprimeagen/comments/1acmpky/i_made_a_linux_kernel_module_to_do_mouse_pointer/
Migrating 3.7 million lines of code in one PR,aTTENT10N,5,2023-12-28 16:42:45,https://www.reddit.com/r/theprimeagen/comments/18sy9n7/migrating_37_million_lines_of_code_in_one_pr/
"Rust std fs slower than Python!? No, it's hardware!",Sudden_Tap7630,6,2023-12-27 17:37:10,https://xuanwo.io/2023/04-rust-std-fs-slower-than-python/
What font does Prime use in Nvim?,yousefedaped,3,2024-12-24 12:37:30,https://www.reddit.com/r/theprimeagen/comments/1hlcp0k/what_font_does_prime_use_in_nvim/
I made my own Programming Language,00Hyla,5,2023-12-26 23:53:33,https://youtu.be/pgeSGBwtHW8?si=0kTaydjgOuvdgpLy
What is the bouncy thing that prime sits on?,Commercial_Media_471,4,2024-12-23 08:20:22,https://www.reddit.com/r/theprimeagen/comments/1hkjcyr/what_is_the_bouncy_thing_that_prime_sits_on/
What if everyone is just being sabotaged?,RobLach,4,2024-12-22 01:34:53,https://specificsuggestions.com/share/EN/4789.html
The Lobster programming language is sick as Frick!,takko_the_boss,4,2024-12-16 21:17:14,https://www.reddit.com/r/theprimeagen/comments/1hfttiq/the_lobster_programming_language_is_sick_as_frick/
How to become a cracked dev,nimbuplz,5,2024-12-14 14:16:42,https://www.youtube.com/watch?v=LzdRNGK0D8I
How Tinder Recommends To 75 Million Users with Geosharding,dunklesToast,3,2024-12-10 18:22:39,https://open.substack.com/pub/bytebytego/p/how-tinder-recommends-to-75-million?r=3yz57k
I think I'm a fan ?,ChevyTanner1,4,2024-12-14 01:50:42,https://www.reddit.com/gallery/1hds6u1
Mediocrity is Rising | Raw and real talk before 2024 ends.,GaneshPalraj,4,2024-12-10 17:56:56,https://youtu.be/zKd_kxcxGbo
Elixir vs Go (Golang) Performance (Latency - Throughput - Saturation - Availability) [11:28],Remarkable_Ad_5601,3,2024-12-08 20:54:45,https://youtu.be/eDq9GbRPA0Q
Why would anyone need javascript generator functions,FireyMango,4,2024-12-10 12:19:52,https://www.reddit.com/r/theprimeagen/comments/1hb0i04/why_would_anyone_need_javascript_generator/
Love to see Prime's react on this post,__Nafiz,4,2024-12-06 09:05:02,https://www.reddit.com/r/theprimeagen/comments/1h7xbq7/love_to_see_primes_react_on_this_post/
Metalband publishes song written in Java,Delusion_Of_Adequacy,4,2024-12-05 22:53:25,https://www.youtube.com/watch?v=yup8gIXxWDU
Keynote: The Road To LiveView 1.0 by Chris McCord | ElixirConf EU 2023,CompetitiveSubset,3,2024-12-01 08:21:58,https://www.youtube.com/watch?v=FADQAnq0RpA
"Why pipes sometimes get ""stuck"": buffering",sugan0tech,3,2024-11-30 08:14:17,https://jvns.ca/blog/2024/11/29/why-pipes-get-stuck-buffering/
Interview with an Emacs Enthusiast in 2023 [Colorized],AdearienRDDT,4,2024-11-30 12:23:44,https://youtube.com/watch?v=urcL86UpqZc&si=4E_m0mBmi6vupORq
AI Won't Fix the Fundamental Flaw of Programming,No_Floor4561,4,2024-11-25 17:41:52,https://youtube.com/watch?v=82JpGhctWpU&si=AT3C9-oy20nyxKvj
Need Advice on Resources to Move back to Good Engineering Practices,UrKnightmares,3,2024-11-22 16:01:50,https://www.reddit.com/r/theprimeagen/comments/1gxb61w/need_advice_on_resources_to_move_back_to_good/
I built my own 16-Bit CPU in Excel [ 15:44 ],Relevant_Echidna_336,4,2024-11-17 05:44:20,https://www.youtube.com/watch?v=5rg7xvTJ8SU
How To Make Coding Addictive,dalton_zk,3,2024-11-06 15:29:58,https://youtu.be/K7hU_z9X4Kk?si=nzeEC52XHxHjiROo
15 terabytes of data and $2.18,defrvv,4,2024-11-09 11:54:03,https://x.com/steve_tenuto/status/1854919704483434763
"From Notion to Neovim - Simple, Non-Commercial, Open Source Notes",NonchalantNick,4,2024-11-04 11:21:55,https://www.youtube.com/watch?v=XRpHIa-2XCE
"If you need the money, don't take the job!",dalton_zk,5,2024-11-03 13:59:41,https://bitfieldconsulting.com/posts/need-money
Awesome advise from a 70 IQ guy.,Free_Warning_3292,4,2024-10-29 21:09:22,https://www.reddit.com/r/theprimeagen/comments/1gf5lei/awesome_advise_from_a_70_iq_guy/
"Why breaking Intel in two is the only way to save America’s most important manufacturer, according to its former board directors",joseluisq,4,2024-10-23 01:51:17,https://fortune.com/2024/10/22/why-breaking-intel-in-two-is-the-only-way-to-save-americas-most-important-manufacturer-according-to-its-former-board-directors/
15 Billion Mile Software Update ,PhonkNerdyBit,4,2024-10-27 18:51:26,https://www.youtube.com/watch?v=_CPxe8yql0Q
 Silly Linux mistake exposes a terabyte of secret Pokémon data [Fireship][4:28],jabawack81,4,2024-10-22 19:12:39,https://www.youtube.com/watch?v=NCLBok_C9Hg
Rich Hickey on Actors ,davidarenas,3,2024-10-22 17:47:39,https://clojure.org/about/state#actors
How is this Website so fast!?,BaH4uK,4,2024-10-22 14:20:29,https://www.reddit.com/r/theprimeagen/comments/1g9jam7/how_is_this_website_so_fast/
Is Python Fast Now??! | Python 3.13 Released [06:27],Remarkable_Ad_5601,5,2024-10-21 11:40:13,https://youtu.be/NUxKhQblgFk
How 1 Software Engineer Outperforms 138 - Lichess Case Study,MartinSAE,3,2024-10-20 12:16:13,https://youtu.be/7VSVfQcaxFY?si=Kuvrtgwqx_CJ5xgl
3 Lessons from the Smartest Developers I’ve Worked With,Sea-Election6308,4,2024-10-20 06:36:24,https://brianjenney.medium.com/3-lessons-from-the-smartest-developers-ive-worked-with-5b233f51fc15
The Montréal Effect: Why Programming Languages Need a Style Czar,feketegy,3,2024-10-19 19:02:17,https://earthly.dev/blog/language-style-czar/
Are AI Coding Assistants Helping or Hurting You?,leiswatch,4,2024-10-18 20:17:41,https://www.reddit.com/r/theprimeagen/comments/1g6rnnw/are_ai_coding_assistants_helping_or_hurting_you/
PimpMyRice - Creating and swapping rices made easy,daddodev,4,2024-10-18 11:52:22,https://v.redd.it/3ptu20ol6ivd1
I didn't expect to laugh this much,justaklboy,5,2024-10-18 06:59:16,https://www.reddit.com/gallery/1g5cexn
"Intel, AMD team with tech titans and Linus Torvalds to form x86 ISA advisory group",one_more_byte,4,2024-10-17 13:01:41,https://www.theregister.com/2024/10/15/intel_amd_x86_future/
"Skills that programmers need, to defend both their code and their careers (the ludic.mataroa.blog guy)",Jordan51104,3,2024-10-14 13:59:11,https://www.reddit.com/r/theprimeagen/comments/1g3gffe/skills_that_programmers_need_to_defend_both_their/
How Uber Reduced Their Log Size By 99%,SnooMuffins9844,4,2024-10-15 08:43:44,https://newsletter.betterstack.com/p/how-uber-reduced-their-log-size-by
The self fulfining prophecy of react ,Moayed_Alkamel,5,2024-10-13 00:04:32,https://joshcollinsworth.com/blog/self-fulfilling-prophecy-of-react
Why is /r/ThePrimeagenReact private,j15s,4,2024-10-11 20:46:09,https://www.reddit.com/r/theprimeagen/comments/1g1jocm/why_is_rtheprimeagenreact_private/
Fancy ideas for better programming tools!,N/A,3,2024-10-12 19:35:51,https://www.reddit.com/r/theprimeagen/comments/1g27ywl/fancy_ideas_for_better_programming_tools/
"Sabine Hossenfelder's based review on AI coding
",SaptamPro,4,2024-10-10 15:29:12,https://www.youtube.com/watch?v=3A-gqHJ1ENI
HTTP 1 Vs HTTP 2 Vs HTTP 3,feketegy,5,2024-10-10 06:57:55,https://www.youtube.com/watch?v=UMwQjFzTQXw
What 3 YEARS of Linux does to you,ral6h,3,2024-10-10 05:56:09,https://youtu.be/cS5XIPqhy1Y?si=nSAiy3hUGJiQ9_64
Aus Gov Blows Millions on CRUD app with 20 users,sorryfortheessay,5,2024-10-10 03:58:05,https://m.youtube.com/watch?embeds_referring_euri=https%3A%2F%2Fwww.google.com%2F&source_ve_path=MTY0NTA2LDE2NDUwMw&v=LAXj6tfrtOY&feature=youtu.be
The computer built to last 50 years,rstargaryen,4,2024-10-09 14:05:12,https://ploum.net/the-computer-built-to-last-50-years/index.html
A modest critique of Htmx,rstargaryen,4,2024-10-09 13:58:11,https://chrisdone.com/posts/htmx-critique/
Is Age Really a Factor in Tech?,N/A,5,2024-10-09 19:30:21,https://www.trevorlasn.com/blog/ageism-in-tech
"I saw the video ""If you don't like it, make your own""— so I built a tool to update Go versions",EquipmentDry5782,3,2024-10-09 02:15:15,https://www.reddit.com/r/theprimeagen/comments/1fzh1ff/i_saw_the_video_if_you_dont_like_it_make_your_own/
The Milton-agen,SSSniperCougar,4,2024-10-08 21:38:47,https://v.redd.it/3ftjfabiqltd1
"Gordon Letwin: ""What's happening to OS/2"" (1995)",VaksAntivaxxer,3,2024-10-08 17:51:35,https://groups.google.com/g/comp.os.ms-windows.misc/c/-iNeep60eVE/m/Xl5ddAtJENcJ
Google's AI thinks I left a Gatorade bottle on the moon,SSSniperCougar,4,2024-10-07 12:26:01,https://www.reddit.com/r/theprimeagen/comments/1fy6clz/googles_ai_thinks_i_left_a_gatorade_bottle_on_the/
How a Hacker Saved The Internet,NotaNomba,2,2024-10-06 18:23:22,https://www.reddit.com/r/theprimeagen/comments/1fxn41q/how_a_hacker_saved_the_internet/
The Value of Source Code,jelly-filled,5,2024-10-06 04:10:40,https://youtu.be/Y6ZHV0RH0fQ?si=erJdzxvjiYuCVPbD
Rookie Firebase mistake nearly destroys Arc browser,ADaskalov,4,2024-10-05 15:33:57,https://www.youtube.com/watch?v=QINoB1_OXUk&ab_channel=Fireship
Please react to this video,LuiTheDude,3,2024-10-05 14:02:59,https://www.reddit.com/r/theprimeagen/comments/1fwr3xf/please_react_to_this_video/
Less htmx is More,feketegy,5,2024-10-03 10:20:27,https://unplannedobsolescence.com/blog/less-htmx-is-more/
"Sam Altman has no clue how to generate money, so he has a plan. (AI btw)",Gregtex,4,2024-09-30 08:49:10,https://youtu.be/gjQUCpeJG1Y
Matt Mullenweg & The Truth About Thesis 🌶️,PootNoodlez,5,2024-09-27 16:27:21,https://pearsonified.com/truth-about-thesis-com/
"GitHub - spawnmason/randar-explanation: ""Randar"" is an exploit for Minecraft which uses LLL lattice reduction to crack the internal state of an incorrectly reused java.util.Random in the Minecraft server, then works backwards from that to locate other players currently loaded into the world.",Hype3x,3,2024-09-25 17:45:03,https://github.com/spawnmason/randar-explanation
Why Android's fullMode hates Gson so much?,theapache64,4,2024-09-24 02:41:38,https://theapache64.github.io/posts/why-fullMode-hates-gson-so-much/
How Notion uses SQLite for Caching,feketegy,4,2024-09-27 09:33:38,https://blog.neetcode.io/p/notion-uses-sqlite-caching
Why r8 (Android compiler) preferred BMW over Audi? (4 mins read),theapache64,4,2024-09-21 04:13:26,https://theapache64.github.io/posts/why-r8-preferred-bmw-over-audi/
Stop using ease-out in your UIs!,bdjnk,5,2024-09-19 21:41:35,https://www.reddit.com/r/theprimeagen/comments/1fkvys7/stop_using_easeout_in_your_uis/
Google is Running Out of Storage,feketegy,4,2024-09-15 08:54:56,https://www.youtube.com/watch?v=K7scVcNuX0E
How Cache Works Inside a CPU [9:20],BitLemonSoftware,6,2024-09-15 09:41:57,https://youtu.be/zF4VMombo7U
How to crack software?,Aeros05,5,2024-09-15 07:18:56,https://www.reddit.com/r/theprimeagen/comments/1fh6vib/how_to_crack_software/
"""An 8-year old codes with Cursor."" Please Prime it's my first submission, don't let me down with your reaction!",tigerwolfgames,5,2024-09-15 01:02:25,https://www.reddit.com/r/theprimeagen/comments/1fh0s7p/an_8year_old_codes_with_cursor_please_prime_its/
Janet Jackson had the power to crash laptop computers,feketegy,4,2024-09-14 08:11:16,https://devblogs.microsoft.com/oldnewthing/20220816-00/?p=106994
Tech Bros Inventing Things That Already Exist,dance_of_shiva,4,2024-09-14 05:52:20,https://www.youtube.com/watch?v=3jhTnk3TCtc
Let's talk about Apple Intelligence...,feketegy,3,2024-09-10 17:28:08,https://youtu.be/DLzOQYY6wjM?si=mrK0LDmyjxXuLdMq
Say hello to OpenAI o1—vim mentioned btw,iBreatheBSB,4,2024-09-13 04:14:01,https://www.reddit.com/r/theprimeagen/comments/1ffm0zn/say_hello_to_openai_o1vim_mentioned_btw/
Good Refactoring vs Bad Refactoring,ArthurAraruna,3,2024-09-10 08:21:51,https://www.builder.io/blog/good-vs-bad-refactoring
Andrew Kelley Practical Data Oriented Design (DoD),gigamonster256,3,2024-09-09 16:17:04,https://www.youtube.com/watch?v=IroPQ150F6c
Where GREP Came From - Computerphile,Moayed_Alkamel,5,2024-09-08 16:29:47,https://www.youtube.com/watch?v=NTfOnGZUZDk
