Title,Author,Score,Created_UTC,URL
How AI should take over the world,sagar_dahiya69,213,2024-09-22 04:56:34,https://i.redd.it/tcfz8ha5laqd1.jpeg
History of frontend,0xJuanGabriel,665,2024-11-11 00:24:47,https://i.redd.it/6wwb8qg6260e1.jpeg
"Wait, it's all libc? It always has been!",joseluisq,167,2024-11-10 17:30:52,https://i.redd.it/bpvo5w9e040e1.jpeg
Doubt,Marrconius,179,2024-09-23 15:09:09,https://i.redd.it/zms2qkd6rkqd1.png
Heroin Addict Gets Clean And Attains A Computer Information Systems Degree With a 4.0 Average,goguspa,174,2024-12-12 18:25:28,https://www.reddit.com/gallery/1hciniw
Anybody would like to say anything?,nwjlyons,108,2024-10-21 13:54:51,https://i.redd.it/z5ho414h74wd1.jpeg
Noice,BroadbandJesus,136,2024-11-13 05:55:50,https://i.redd.it/9di4fuy1zl0e1.png
Once you get a taste there's no going back,ChevyTanner1,172,2024-09-07 09:18:40,https://i.redd.it/l6qy1mu8ucnd1.jpeg
Is the lawn mower thing true??,kolosal6921,105,2024-10-30 04:16:52,https://i.redd.it/3vtggxppktxd1.jpeg
Npm install ,Moayed_Alkamel,105,2024-10-26 23:47:55,https://v.redd.it/wqhhhtkzt6xd1
Nobody cares about technical GitHub projects unless they solve a Business Problem,Ok_End_573,106,2024-09-09 06:50:20,https://i.redd.it/ix9ykzkbdqnd1.jpeg
Now you know who is sucker ,Aware-Silver-2221,100,2024-10-25 07:36:52,https://v.redd.it/e98l8p1uvuwd1
this pops up if you search clean code ,In-Hell123,87,2024-10-22 05:12:40,https://i.redd.it/g4x00madr8wd1.png
The key to success is developers 😂,Aware-Silver-2221,89,2024-07-03 08:29:33,https://v.redd.it/8k2duewal9ad1
Do it like the 2000s :P,ibenic,100,2024-08-30 15:17:48,https://i.redd.it/udvqt28xitld1.jpeg
No evidence has been given though,Vincent-Thomas,86,2024-09-07 17:55:26,https://i.redd.it/60rse8nfefnd1.jpeg
Just in case...,defrvv,87,2024-12-18 04:14:34,https://i.redd.it/hmoyj73b8j7e1.png
Linus Torvalds reckons AI is ‘90% marketing and 10% reality’,one_more_byte,741,2024-10-28 15:53:03,https://www.tomshardware.com/tech-industry/artificial-intelligence/linus-torvalds-reckons-ai-is-90-percent-marketing-and-10-percent-reality
Me using @Neovim  while I see all the others fighting over which fork of vs code is best,bajcmartinez,103,2024-11-14 12:24:23,https://i.redd.it/fwe491o91v0e1.jpeg
Two brothers from different womb,jimexp69,95,2024-10-09 12:38:45,https://i.redd.it/x0y413ey6qtd1.png
Yeet no_cap,LeafRollingWeevil,79,2024-12-06 12:51:02,https://i.redd.it/dooj4b76685e1.jpeg
New book just dropped,joseluisq,77,2024-11-05 23:49:49,https://i.redd.it/cbj9nn5g76zd1.jpeg
"Crap, it's my code...",onairmarc,73,2024-10-07 02:01:46,https://i.redd.it/hhxwpiyir8td1.jpeg
npm madness,AdearienRDDT,82,2024-11-27 01:54:18,https://v.redd.it/4hl3m5g1lc3e1
SCRUM has killed the work of Dev,dalton_zk,72,2024-10-29 13:31:08,https://i.redd.it/zeyg8anl6pxd1.png
whatMatters,BroadbandJesus,74,2024-12-19 04:36:33,https://i.redd.it/gdygc90g4n7e1.png
How ThePrimeagen ruined my life (Clickbait),HerrDerNasn,82,2024-04-01 09:07:36,https://www.reddit.com/r/theprimeagen/comments/1bsytbz/how_theprimeagen_ruined_my_life_clickbait/
So much curry,Remarkable_Ad_5601,69,2024-11-12 17:39:43,https://i.redd.it/iuey63qqbi0e1.png
What does it mean???,SnooSquirrels5508,68,2024-10-07 14:12:55,https://i.redd.it/r201ex73ectd1.png
The way he writes the 4 lives rent free in my head,SSSniperCougar,69,2024-10-15 14:07:56,https://v.redd.it/joyd17ghgxud1
It makes sense,jabawack81,70,2024-11-13 20:26:39,https://i.redd.it/wv2ha3l4un0e1.jpeg
Jiatan mentioned,jabawack81,68,2024-10-26 13:15:07,https://i.redd.it/qoqu6vlvt1xd1.png
The Bob Ross of Rust?!?,keyofprosperity,66,2024-12-05 20:34:19,https://www.youtube.com/watch?v=mxjDdwcQGlM
“Can’t make myself code anymore”,Moamlrh,242,2024-12-20 10:01:49,https://i.redd.it/0o75x8lq8z7e1.jpeg
"Finally, a use case for ChatGPT!",Fine-Marzipan-3470,62,2024-08-02 21:02:05,https://i.redd.it/egdctx3vebgd1.png
Tech debt,HighlySuccessful,63,2024-06-29 10:13:18,https://i.redd.it/tmdfrn92kh9d1.png
Why did Prime take down his Glove80 Review?,DataBreach96,58,2024-10-04 17:18:00,https://i.redd.it/4hzzco99wrsd1.png
Neovim config,feketegy,57,2024-10-01 12:58:58,https://i.redd.it/2ibun88e75sd1.jpeg
soWhoIsSendingPatchesNow,jabawack81,54,2024-11-21 23:20:54,https://i.redd.it/ig2c4puxd92e1.jpeg
theprimeagen has given up,abaza738,58,2024-04-25 10:56:44,https://v.redd.it/opgvaal3flwc1
How is this Website so fast!?,shebasedcannon,54,2024-10-18 17:45:33,https://www.youtube.com/watch?v=-Ln-8QM8KhQ
Like My Setup? ,Ok-Entertainer6533,53,2024-12-16 15:03:39,https://i.redd.it/fw3l244y687e1.jpeg
Well well well how the turntables ,Candid-Ad8423,57,2024-09-25 12:57:24,https://i.redd.it/7q1xrlcodyqd1.png
"The masculine urge to say ""i use neovim btw"" to everyone you know.",Zkrallah,51,2024-10-18 18:41:12,https://i.redd.it/8q6vp46z7kvd1.jpeg
salvation,dalailahner,51,2024-04-25 10:30:31,https://i.redd.it/r9lhtw30slwc1.jpeg
look how they massacred my boy 😢 (source: fireship),Training_You_372,70,2024-12-10 17:42:05,https://i.redd.it/nosmuqzp526e1.jpeg
The reason why I watch ThePrimeagen,SnooBeans640,51,2024-09-09 15:41:46,https://i.redd.it/h255hsld0tnd1.png
From Instagram,Icy_Friend_2263,51,2024-11-12 00:29:13,https://v.redd.it/b8ou46s11b0e1
"I'm pretty sure everything that could have been said about the WP drama has already been said, but firedev's report on it has the best graphics so far.",jabawack81,46,2024-10-12 13:52:48,https://i.redd.it/yr4agncgybud1.png
Sometimes simple solutions are better,AscendedPulsar,47,2024-08-16 11:36:35,https://i.redd.it/nnvd0zvgi0jd1.jpeg
prime is judging you for using ai,SSSniperCougar,56,2024-10-06 21:29:55,https://i.redd.it/fw99wf45f7td1.jpeg
99% of AI companies,probablysitting,45,2024-08-29 18:16:35,https://i.redd.it/rsdgd8iimmld1.jpeg
whichAreYouPlaguedWith,Apergra,47,2024-04-11 19:51:22,https://i.redd.it/bb5j1hrd7wtc1.png
New book's cover: Typescript for Javascript Developers,joseluisq,44,2024-11-13 08:18:55,https://i.redd.it/49t2ipnnom0e1.jpeg
Wait 64 bit pointers only use 48 bits? Always has been,joseluisq,46,2024-12-14 06:42:27,https://i.redd.it/lc35mmcpfr6e1.png
Pushing to Master... ,AllesYoF,46,2024-12-19 16:29:13,https://i.redd.it/zjtyymnv9t7e1.png
Fellas. BE HONEST. We've all been there. ,Marrconius,49,2024-07-21 02:04:35,https://i.redd.it/piehpdax4sdd1.jpeg
How old is prime?,mvogelpi,46,2024-05-26 22:25:11,https://i.redd.it/fdimrxmops2d1.jpeg
1.5 yrs in with 0 work done at Amazon. [source in the comments],feketegy,46,2024-08-23 15:15:05,https://i.redd.it/nisjuce2kfkd1.png
Primes Learning Lisp Cause Lex,SSSniperCougar,46,2024-10-20 14:01:16,https://i.redd.it/iv5l0kyu3xvd1.jpeg
Mediocrity is Rising | Raw and real talk before 2024 ends.,DovaJun,46,2024-12-07 16:59:27,https://youtu.be/zKd_kxcxGbo?si=yaqdtOgFzaMnqnLK
I didn't know that theprimeagen was in a German metal band,TomatilloGullible721,43,2024-08-22 16:28:34,https://i.redd.it/mcmdfk92s8kd1.png
I'm disappointed with primeagen,idealintelligence,45,2024-06-10 18:35:12,https://www.reddit.com/r/theprimeagen/comments/1dcsu7i/im_disappointed_with_primeagen/
Hit or miss?,NoName914,42,2024-10-08 14:17:22,https://i.redd.it/dj4zojmsjjtd1.jpeg
JS devs are junior forever lol,LeafRollingWeevil,42,2024-12-04 14:23:30,https://youtu.be/8OaOTpxPKrA?si=kr1Z7rW23HVQSlEr
primes last doing at netflix,dalailahner,39,2024-04-24 10:40:30,https://i.redd.it/0vzfbigvoewc1.jpeg
My team has new interns,praharshnbhatt,42,2024-05-07 19:27:47,https://i.redd.it/hzzm5nes22zc1.jpeg
How I cut video streaming cost by 97%,noodleswind,46,2024-08-04 08:07:55,https://subatic.com/story
Ah yes...,DryRazzmatazz507,157,2024-10-18 11:44:24,https://i.redd.it/f06echcj5ivd1.png
JSON mentioned,churris_x,41,2024-03-28 17:30:32,https://i.redd.it/l17ja8ie14rc1.png
Another Prime Meme Template ,SSSniperCougar,40,2024-10-23 18:09:37,https://i.redd.it/o1ev76hwqjwd1.jpeg
T-Shirt Sizes at the Linux Symposium,feketegy,41,2024-10-04 06:27:40,https://i.redd.it/ff1ntrb9oosd1.jpeg
Why does he highlight text like that?,Skull_is_dull,42,2024-08-07 00:59:19,https://www.reddit.com/r/theprimeagen/comments/1elymew/why_does_he_highlight_text_like_that/
https://godbolt.org/z/W5MeM49sz,Remarkable_Ad_5601,38,2024-10-30 20:29:17,https://i.redd.it/6kct4gn2eyxd1.jpeg
There’s never been a better time to be a programmer.  There’s never been a worse time to be a corporate programmer.,nightbeast88,42,2024-05-23 20:04:03,https://www.reddit.com/r/theprimeagen/comments/1cz289k/theres_never_been_a_better_time_to_be_a/
Pic on LinkedIn describing LinkedIn,BeautifulEvening,36,2024-11-15 15:28:46,https://www.reddit.com/r/theprimeagen/comments/1gryvaq/pic_on_linkedin_describing_linkedin/
Programming Is DEAD In Corporations | Tsoding,DovaJun,38,2024-11-06 17:28:42,https://youtu.be/4GZdeWWraTs?si=B-qFEISBnYmwKjUn
The best article on the internet?!,Efffectery,36,2024-12-13 19:29:07,https://www.reddit.com/r/theprimeagen/comments/1hdk5t4/the_best_article_on_the_internet/
REACT TO LICHESS CASE STUDY,Dry_Assistance3998,34,2024-09-30 08:32:35,https://www.reddit.com/r/theprimeagen/comments/1fsqr9f/react_to_lichess_case_study/
Prime be like,N/A,35,2024-05-10 19:51:28,https://i.redd.it/egguka2xbfzc1.jpeg
More Microservices than Users,Chrome102,36,2024-09-03 13:01:07,https://i.redd.it/r6okcj1udlmd1.jpeg
The name is THEPRIMEAGEN,thecodetitan_13,36,2024-05-01 14:11:56,https://i.redd.it/jfbsitzyotxc1.jpeg
Long Term Linux Maintainer Banned After Protesting Removal of Russian Programmers,ConflictUsed3017,36,2024-10-31 22:15:52,https://www.reddit.com/r/theprimeagen/comments/1ggqlkv/long_term_linux_maintainer_banned_after/
Just one more package 😅,LeafRollingWeevil,35,2024-12-04 15:36:30,https://i.redd.it/y6k853evpu4e1.jpeg
Async + Mutex,TheGreaT1803,37,2024-12-01 22:29:00,https://i.redd.it/fn5j958qcb4e1.jpeg
Dr Prime is in the House,SSSniperCougar,35,2024-10-06 22:28:03,https://v.redd.it/jrui980ep7td1
I just got laid off.,Teknostompa,35,2024-07-13 17:43:17,https://i.redd.it/258qgls5pbcd1.png
Printf debugging for the win,Hamza12700,33,2024-08-17 19:19:29,https://i.redd.it/gmwbz629y9jd1.png
Does anyone know this guy?,Freshpocky,35,2024-12-11 00:55:41,https://v.redd.it/gav0xivph06e1
Berkeley Professor Says Even His ‘Outstanding’ Students With 4.0 GPAs Aren’t Getting Any Job Offers — ‘I Suspect This Trend Is Irreversible’,busta_thymes,37,2024-11-22 00:27:04,https://www.yourtango.com/sekf/berkeley-professor-says-even-outstanding-students-arent-getting-jobs
Honey's Scam,TheGamblersDice,34,2024-12-23 00:01:51,https://www.youtube.com/watch?v=vc4yL3YTwWk
Microsoft AI leaks 100 MILLION users Medical Records,BroadbandJesus,41,2024-12-21 20:36:18,https://youtu.be/kixSCr3gm90?si=2QCfnDsALDKT-QrV
Do 10% of developers do *nothing*? by Alberta Tech (9:27 minutes),PhoneBricker,36,2024-11-29 17:06:37,https://www.youtube.com/watch?v=_a_Vz2ytVCQ
I can't start any more side projects.,commander1keen,32,2024-04-10 07:20:48,https://i.redd.it/rubms0hesltc1.png
Winamp owner deletes 'Open Source' repository after a bumpy month on GitHub,joseluisq,31,2024-10-17 09:41:47,https://www.tomshardware.com/tech-industry/winamp-owner-deletes-open-source-repository-after-a-bumpy-month-on-github
"Google to sell Chrome AND be banned from re-entering the browser market for five years, recommends US Department of Justice",joseluisq,34,2024-11-23 17:45:57,https://www.pcgamer.com/hardware/Google-should-sell-chrome-and-more-recommends-US-DoJ/
Senior developer fixing bugs live on production,Malo-Netvor,34,2024-04-08 19:46:19,https://i.redd.it/b2zzbnyn7btc1.jpeg
Salesforce CEO Marc Benioff says Microsoft Copilot has disappointed many customers,peakyraven,34,2024-09-24 17:35:00,https://fortune.com/2024/08/30/salesforce-ceo-marc-benioff-agentforce-microsoft-copilot-ai-chatbot-openai/
Mobile Development,DerSolo,32,2024-12-20 14:54:12,https://i.redd.it/cwkmuopwo08e1.jpeg
Credit - The Vim Experience by Bog,rstargaryen,32,2024-11-05 17:08:29,https://i.redd.it/xo0j9hgr74zd1.png
"""I Will Fucking Piledrive You If You Mention AI Again"", an article I found to be an amusing read",Loose_Monitor,30,2024-06-20 03:49:50,https://ludic.mataroa.blog/blog/i-will-fucking-piledrive-you-if-you-mention-ai-again/
LinkedIn is Drowning in AI Generated Content Slop,Practical-Ideal6236,31,2024-12-11 20:06:31,https://www.trevorlasn.com/blog/linkedin-is-drowning-in-ai-generated-content-slop
 Top G Andrew Tate penetrated by LGBT hackers ,Chemical-Ad3798,30,2024-11-25 15:02:14,https://www.reddit.com/r/theprimeagen/comments/1gzkt9g/top_g_andrew_tate_penetrated_by_lgbt_hackers/
Microsoft Recall mandatory in 24H2 -> Dependency on File Explorer,mizendacat,30,2024-10-09 13:03:37,https://youtu.be/G9FRadIkkE0?si=fdpWEBJ_tglqd7Pl
"EY Pune, India employee (26f) died due to work stress ",SoftwareLanky1027,32,2024-09-18 16:40:15,https://www.reddit.com/gallery/1fjxcvw
Is this prime ?,isaeef,28,2024-08-04 21:00:00,https://v.redd.it/eetx09nbopgd1
CEO Jaspar Carmichael-Jack’s ad campaign to “stop hiring humans” and use his AI instead ,omark96,30,2024-12-16 02:26:15,https://i.redd.it/q3a9565ijx6e1.jpeg
You ok TJ?,Diablodl,29,2024-11-16 16:54:13,https://i.redd.it/7xv56c6bna1e1.png
Criticize Scrum at your peril.,Kevler1,30,2024-11-09 20:43:45,https://i.redd.it/2z5q8sdqtxzd1.png
tell me you watch prime without telling me you watch prime,me-heer,29,2024-04-22 06:45:55,https://www.reddit.com/r/theprimeagen/comments/1ca41hz/tell_me_you_watch_prime_without_telling_me_you/
"stolen, like every meme should be",dalailahner,27,2024-03-07 12:14:30,https://i.redd.it/fdrbpiyvlwmc1.jpeg
OK this AI thing is getting out of control. People are not paying to get roasted like this for no reason Microsoft (some will even pay extra though).,Training_You_372,28,2024-12-05 06:06:13,https://i.redd.it/23e1nit01z4e1.jpeg
"Court might watch Prime as evidence, Complaint by WP Engine ",ibenic,29,2024-10-03 01:30:14,https://www.reddit.com/r/theprimeagen/comments/1fuwi0q/court_might_watch_prime_as_evidence_complaint_by/
The Man Who Killed Google Search,TinderThrowItAwayNow,28,2024-10-30 18:47:21,https://www.wheresyoured.at/the-men-who-killed-google/
Response to DHH | Matt Mullenweg,ibenic,28,2024-10-14 17:52:29,https://ma.tt/2024/10/on-dhh/
It was not enough,Ok-Entertainer6533,28,2024-12-17 12:39:02,https://i.redd.it/4fehsy22me7e1.jpeg
"Linus Torvalds advises developers to pursue meaningful projects, not hype",one_more_byte,28,2024-09-23 09:19:09,https://www.networkworld.com/article/3526076/linus-torvalds-advises-open-source-developers-to-pursue-meaningful-projects-not-hype.html
https://git-roasted.com/,washedlih,27,2024-10-31 01:59:57,https://i.redd.it/16mc9ri610yd1.png
Prime Meme Template ,SSSniperCougar,27,2024-10-23 17:29:59,https://i.redd.it/v3cdotvtjjwd1.jpeg
"Linus Torvalds: C vs. Rust Debate Has ""Religious Undertones""",feketegy,27,2024-09-17 07:02:32,https://thenewstack.io/linus-torvalds-c-vs-rust-debate-has-religious-undertones/
You know it’s true ,LeafRollingWeevil,25,2024-10-16 10:26:14,https://i.redd.it/xi8bpfluh3vd1.jpeg
How 1 Software Engineer Outperforms 138 - Lichess Case Study,xVemux,28,2024-09-29 11:28:59,https://youtu.be/7VSVfQcaxFY
everySingleTime,pretentious_prickhol,28,2024-08-17 11:26:39,https://i.redd.it/yfabm0zvl7jd1.jpeg
Banned C++ Contributor Speaks Out,joseluisq,30,2024-12-02 00:56:54,https://youtu.be/SLPVo6tsFXo?si=zS8mEG5Z1ZDrD9-_
Thank Mr ThePrimeagen for your help with Neovim,N/A,27,2024-05-04 07:35:12,https://www.reddit.com/r/theprimeagen/comments/1cjut1s/thank_mr_theprimeagen_for_your_help_with_neovim/
Vimagen in shambles ,AnnyAskers,26,2024-03-01 09:27:13,https://i.redd.it/aqdwfpjwinlc1.jpeg
Missed Debugging Skill,rustybridges,26,2024-12-20 23:19:39,https://www.reddit.com/r/theprimeagen/comments/1hiwkhr/missed_debugging_skill/
wHaT kEyBoArD dO yOu UsE?,jakeHL,26,2024-10-15 09:27:28,https://i.redd.it/ybnqtxhaku6d1.jpeg
159 employees are leaving Automattic as CEO’s fight with WP Engine escalates,Anasynth,27,2024-10-04 11:00:08,https://techcrunch.com/2024/10/04/159-employees-are-leaving-automattic-as-ceos-fight-with-wp-engine-escalates/
"I used the phrase ""Rawdogging SQL"" in a meeting today and I blame Prime for the weird looks I got. ",Marrconius,26,2024-07-22 16:01:33,https://i.redd.it/8c7mipe0f3ed1.png
You spelled it wrong,Beautiful-Rock-1901,26,2024-12-22 23:20:54,https://i.redd.it/ffmucy6alg8e1.jpeg
They're even putting ads in the console now?,Hashi856,26,2024-06-04 20:07:51,https://i.redd.it/auph6wbb3m4d1.png
The Vim Experience by Bog,Akane_Kurokawa_1,27,2024-11-04 20:02:23,https://www.reddit.com/r/theprimeagen/comments/1gjnpgb/the_vim_experience_by_bog/
Company: Feel stressed? You're fired. ,fcmyk,23,2024-12-09 12:58:25,https://www.linkedin.com/feed/update/urn:li:activity:7271758403717214211/
Over 25% of code in Google is written by AI.,johnathanwick69420,26,2024-10-30 11:40:31,https://youtu.be/tApt9dmVOr8?si=gdrOMMrTwAtPCJem
Now you know who is sucker ,Aware-Silver-2221,24,2024-10-25 07:36:17,https://v.redd.it/7gibc68qvuwd1
Why does ThePrimeagen literally always miss the (first & last) characters when selecting text??! ... it's so frustratingly intentional,____ben____,26,2024-09-03 07:03:54,https://i.redd.it/zmyryumvljmd1.png
Microsoft Recall is MANDATORY,KrazyKirby99999,25,2024-10-10 12:44:09,https://youtu.be/G9FRadIkkE0
DHH: Our cloud-exit savings will now top ten million over five years,StandMammoth5271,24,2024-10-17 19:50:36,https://world.hey.com/dhh/our-cloud-exit-savings-will-now-top-ten-million-over-five-years-c7d9b5bd
"prime trying zed, that damn copy buffer",Moayed_Alkamel,24,2024-12-02 18:22:23,https://i.redd.it/ktp7rcvl9h4e1.png
Prime & Teej welcoming the Aliens,SSSniperCougar,25,2024-10-07 20:45:55,https://i.redd.it/fup0ruc7cetd1.jpeg
Git rebase is literally communism,WesolyKubeczek,24,2024-07-20 19:42:55,https://www.reddit.com/r/theprimeagen/comments/1e83u8w/git_rebase_is_literally_communism/
**David ,defrvv,24,2024-12-03 11:58:31,https://i.redd.it/a70ff2zbpl4e1.jpeg
Just play outer wilds,iBreatheBSB,22,2024-11-30 09:55:10,https://i.redd.it/r4hgpckbh04e1.jpeg
[Duolingo] How we reduced our cloud spending by 20%,proxy_life,22,2024-11-02 12:39:20,https://blog.duolingo.com/reducing-cloud-spending/
Prime doesn't understand the DRY principle,clickrush,25,2024-06-21 11:52:57,https://www.reddit.com/r/theprimeagen/comments/1dl262w/prime_doesnt_understand_the_dry_principle/
LinkedIn done the right way!,B1gShadow,22,2024-10-15 11:51:42,https://i.redd.it/eq6jrbv3swud1.png
The ultimate TODO comment (by bonkers world),Gregtex,23,2024-09-13 11:43:30,https://i.redd.it/er6ybsogdkod1.png
Theme id?,everdrone97,23,2024-07-05 21:38:57,https://i.redd.it/jantft8zrrad1.jpeg
Our man quits and it all goes to hell...,morewordsfaster,23,2024-04-23 13:04:56,https://i.redd.it/i3byr090y1wc1.png
Why Copilot is Making Programmers Worse at Programming,bizzehdee,23,2024-09-12 10:49:20,https://www.darrenhorrocks.co.uk/why-copilot-making-programmers-worse-at-programming/
Prime on the side after leaving netflix,RealBoiMan,22,2024-04-07 23:51:21,https://i.redd.it/th13gidpu4tc1.jpeg
Figured this was the right place to post this,Edlingaon,23,2024-02-21 06:30:12,https://i.redd.it/l3hj4ndsuvjc1.jpeg
Why does Prime appear to not like Rust anymore,30DVol,21,2024-12-17 15:29:00,https://www.reddit.com/r/theprimeagen/comments/1hgd31l/why_does_prime_appear_to_not_like_rust_anymore/
Has Prime spoken about him using a Yoga Ball as an office chair?,DataBreach96,20,2024-12-03 05:44:29,https://i.redd.it/w71yoc7smk4e1.png
A user got deactivated from the Make Wordpress slack for posting this meme in #ranting,quiche-eater,23,2024-10-18 12:51:28,https://i.redd.it/32xeas9n9bvd1.jpeg
He chose power instead,Zkrallah,22,2024-10-20 12:51:47,https://i.redd.it/qe0oykmgrwvd1.jpeg
What happens when you outsource your development to India,edgecto,23,2024-09-23 08:41:25,https://peabee.substack.com/p/whats-inside-the-qr-code-menu-at
My new microservices setup is ready to handle all 10 of my users!,jabawack81,23,2024-09-04 07:11:34,https://i.redd.it/tr5hsq7dqimd1.png
"A pilot has reacted to one of your videos (Not copilot, but like. A dude that pilots an airplane) ",Gorrilac,22,2024-12-03 14:59:26,https://youtu.be/wGffO7-oGUo?si=dSX81gjzox05h9Q9
Waiting for Prime's reaction to this,Pattern-Ashamed,20,2024-12-23 17:06:54,https://www.reddit.com/r/theprimeagen/comments/1hks935/waiting_for_primes_reaction_to_this/
YouTube Coders are LYING to You. Here's How.,No_Landscape_1514,22,2024-04-19 04:25:42,https://youtu.be/y5KCiHFGPUo?si=3ZZrE7JQfI6OxAqy
'A lot of demoralized people': Ghost jobs wreaking havoc on tech workers,dalton_zk,21,2024-11-01 00:55:07,https://www.sfgate.com/tech/article/ghost-jobs-california-tech-industry-19871249.php
The name ... is the TheTsoding-agen,Wonderful-Mango7435,20,2024-09-25 16:47:37,https://www.twitch.tv/tsoding/clip/WanderingLovelyBeanVoHiYo-VUEC8KPzhbRxym5K
Prime should react to this: “ I hacked my friend’s phone to show how easy it is” - Veritasium,Runaway_Monkey_45,21,2024-09-22 01:39:52,https://youtu.be/wVyu7NB7W6Y?si=Bv35icPRES6NDEPA
I need someone to talk to,Pigmeej,21,2024-12-16 21:56:59,https://www.reddit.com/r/theprimeagen/comments/1hfurb5/i_need_someone_to_talk_to/
I received this lovely bit of fraud today.,jjcxdev,20,2024-11-07 17:57:01,https://i.redd.it/sjw8ooo7qizd1.png
Russian Court Fines Google $20 decillion,feketegy,19,2024-10-30 07:20:58,https://gizmodo.com/russian-court-wants-google-to-cough-up-20000000000000000000000000000000000-2000517887
Can anyone tell me how to get this look?,HANGYAKUz,21,2024-09-29 18:07:08,https://i.redd.it/61xjo3vkgsrd1.jpeg
watching the livestream,Evropa_TheLastBattle,20,2024-07-09 03:16:45,https://i.redd.it/qkggu78suebd1.png
I DRINK YOUR MILKSHAKE,geschenkideen24,19,2024-02-23 00:28:30,https://i.redd.it/u4nujqdyb8kc1.jpeg
A note from Vim-Racer,Crippledupdown,19,2024-09-02 04:39:02,https://www.reddit.com/r/theprimeagen/comments/1f6y82b/a_note_from_vimracer/
OS internals book,peakyraven,19,2024-02-15 12:03:49,https://i.redd.it/17488ixroqic1.jpeg
Report TheStartup™️ to OSHA?,BroadbandJesus,19,2024-11-13 15:13:50,https://i.redd.it/1eqpjxjoqo0e1.jpeg
AI makes tech debt more expensive,dalton_zk,19,2024-11-15 01:27:04,https://www.gauge.sh/blog/ai-makes-tech-debt-more-expensive
'A lot of money is going to get wasted': MIT economist sounds the alarm on AI hype,johnathanwick69420,18,2024-10-04 06:46:13,https://www.businessinsider.in/tech/news/a-lot-of-money-is-going-to-get-wasted-mit-economist-sounds-the-alarm-on-ai-hype/articleshow/113884129.cms
Nvidia dethrones Apple as the world's most valuable company,rstargaryen,19,2024-10-26 14:28:08,https://markets.businessinsider.com/news/stocks/nvidia-stock-price-market-cap-apple-most-valuable-company-nvda-2024-10
HTMX is trash change my mind,Ninetynostalgia,18,2024-11-15 18:16:55,https://www.reddit.com/r/theprimeagen/comments/1gs2u3p/htmx_is_trash_change_my_mind/
Real 10x Programmers Are SLOW To Write Code,im_in_every_post,19,2024-09-16 20:11:05,https://youtu.be/2ClljZaK6_A
I found another use case for AI!,Fine-Marzipan-3470,19,2024-08-23 04:59:08,https://i.redd.it/57k931n6ickd1.jpeg
Just a thought,BrilliantQuiet6480,19,2024-07-15 15:21:36,https://i.redd.it/b6atgbkc9pcd1.png
The difference between you and ThePrimeagen.,Accurate_Ad9173,20,2024-08-19 15:42:57,https://www.reddit.com/r/theprimeagen/comments/1ew52l5/the_difference_between_you_and_theprimeagen/
Post-Netflix Prime,WesolyKubeczek,18,2024-06-18 08:05:33,https://www.reddit.com/r/theprimeagen/comments/1dild1j/postnetflix_prime/
From zero to building my own compiler,rejectedlesbian,18,2024-06-15 23:11:16,https://www.reddit.com/r/theprimeagen/comments/1dgu4on/from_zero_to_building_my_own_compiler/
Am I the only one who doesn't understand half of the shit prime talk about in his videos?,alex17ryan,20,2024-03-19 17:42:54,https://www.reddit.com/r/theprimeagen/comments/1biq9us/am_i_the_only_one_who_doesnt_understand_half_of/
3 lessons about software engineering I learned from my criminal career,Frosto0,18,2024-12-18 04:16:59,https://www.reddit.com/r/theprimeagen/comments/1hgtjvn/3_lessons_about_software_engineering_i_learned/
AI is not Designed for You,DovaJun,19,2024-12-06 19:43:49,https://youtu.be/6Lxk9NMeWHg?si=6URqH5Ad7VaANO5i
The future of software is Nix,WorkingBeginning9782,18,2024-10-26 00:05:21,https://determinate.systems/posts/the-future-is-nix/
You should be reading academic computer science papers.,Visible_Spot_8698,19,2024-11-18 14:40:16,https://www.reddit.com/r/theprimeagen/comments/1gu67kz/you_should_be_reading_academic_computer_science/
Deno 2.0 release - the intro is epic,Sorcer_85,16,2024-10-10 13:22:49,https://www.youtube.com/watch?v=d35SlRgVxT8
I didn't expect to laugh this much,pratham_mittal,18,2024-10-17 08:38:28,https://www.reddit.com/gallery/1g5cexn
"Factorio teaches you software engineering, seriously.",clickyswitch06,16,2024-10-21 05:31:37,https://www.youtube.com/watch?v=vPdUjLqC15Q
Netflix left their test page in production 🤣,IamZeri0n,18,2024-04-23 06:59:28,https://i.redd.it/i3byr090y1wc1.png
Can't wait for the deets on CrowdStrike shutting the world down,Drone30389,20,2024-07-19 11:34:25,https://www.reddit.com/r/theprimeagen/comments/1e71jeh/cant_wait_for_the_deets_on_crowdstrike_shutting/
What do y'all think?,N/A,18,2024-03-14 07:44:02,https://i.redd.it/p6dkfov0e4oc1.jpeg
Now I'm lost in the lazy land,throw_away_3212,19,2024-01-09 12:55:05,https://i.redd.it/8osgm4h7webc1.jpeg
"Why AI is making software dev skills more valuable, not less",DovaJun,16,2024-12-15 04:16:48,https://youtu.be/FXjf9OQGAlY?si=vVjl70z2jKEI04WH
why fewer videos?,narrei,18,2024-11-29 14:47:00,https://www.reddit.com/r/theprimeagen/comments/1h2ncom/why_fewer_videos/
How Silicon Valley is disrupting democracy,feketegy,17,2024-12-13 10:57:34,https://www.technologyreview.com/2024/12/13/1108459/book-review-silicon-valley-democracy-techlash-rob-lalka-venture-alchemists-marietje-schaake-tech-coup/
